á	ˈ aː
abair	ˈ a bˠ ə ɾʲ
ábalta	ˈ aː bˠ ə lˠ t̪ˠ ə
ab	ə bˠ
abhaile	ə ˈ vˠ a lʲ ə
ach	ˈ a x
acu	ə ˈ k u
aduaidh	ə ˈ d̪ˠ uˑə ɟ
adúbradh	a ˈ d̪ˠ uː bˠ ɾˠ ə
a	ə
aeraíocht	eː ˈ ɾˠ iˑə x t̪ˠ
agaibh	ə ˈ ɡ i vʲ
agaibhse	ə ˈ ɡ i vʲ ʃ ə
againn	ə ˈ ɡ i nʲ
agam	ə ɡ u mˠ
agamsa	ə ˈ ɡ ə mˠ sˠ ə
agat	ə ˈ ɡ u t̪ˠ
ag	ə ɟ
aghaidh	ˈ ai ɟ
agus	ˈ a ɡ ə sˠ
aice	ˈ a c ə
aici	ˈ e c ə
aicisí	ˌ a c ə ˈ ʃ iː
aicme	ˈ a c mʲ ə
aidhm	ˈ ai mʲ
aige	e ɟ ə
aigesean	ˈ a ɟ ə ʃ ə nˠ
aighneas	ˈ ai nʲ ə sˠ
aighnis	ˈ ai nʲ ə ʃ
aigne	ˈ a ɟ ə nʲ ə
áil	ˈ aː lʲ
áilleacht	ˈ aː lʲ ə x t̪ˠ
aimsir	ˈ ai mʲ ʃ ə ɾʲ
aimsire	ˈ ai mʲ ʃ ə ɾʲ ə
aingeal	ˈ a ɲ ə lˠ
ainm	ˈ a nʲ ə mʲ
airc	ˈ a ɾʲ c
airde(1)	ˈ iː ɾˠ dʲ ə
airde	ˈ aː ɾˠ dʲ ə
air	e ɾʲ
airgead	ˈ a ɾʲ ə ɟ ə d̪ˠ
airigh	ˈ a ɾʲ i ɟ
airighdís	ˌ a ɾʲ i ɟ ˈ dʲ iː ʃ
airíodar	a ˈ ɾʲ iˑə d̪ˠ ə ɾˠ
ais	ˈ a ʃ
aisti	ˈ a ʃ tʲ ə
ait	ˈ a tʲ
áit	ˈ aː tʲ
aitean	ˈ a tʲ ə nˠ
aithne	ˈ a h ə nʲ ə
allta	ˈ au lˠ t̪ˠ ə
alltacht	ˈ au lˠ t̪ˠ ə x t̪ˠ
amach	ə ˈ mˠ a x
amas	ˈ a mˠ ə sˠ
amháin	ə ˈ vˠ aː nʲ
amhlaidh	ˈ au lˠ i ɟ
amhras	ˈ au ɾˠ ə sˠ
amú	ə ˈ mˠ uː
amuigh	ə ˈ mˠ u h
ana	ˈ a nˠ ə
anacair	ˈ a nˠ ə k ə ɾʲ
anall	ə ˈ nˠ au lˠ
anama	ˈ a ˈ nˠ a mˠ ə
anam	ˈ a nˠ ə mˠ
an-bheag	ˈ a nˠ ə ˈ vʲ ə ɡ
an	ə nˠ
aniar	ə ˈ nʲ iˑə ɾˠ
aníos	ə ˈ nʲ iː sˠ
an-mhaith	ˈ a nˠ ə ˈ vˠ a
an-mhór	ˈ a nˠ ə ˈ vˠ uː ɾˠ
ann	ˈ au nˠ
anois	ə ˈ nˠ i ʃ
anonn	ə ˈ nˠ uː nˠ
anuas	ə ˈ nˠ uˑə sˠ
aon	ˈ eː nˠ
aos	ˈ eː sˠ
ár	ˈ aː ɾˠ
aráin	ə ˈ ɾˠ aː nʲ
arán	ə ˈ ɾˠ aː nˠ
araon	ə ˈ ɾˠ eː nˠ
arbhair	ˈ a ɾˠ ə vˠ ə ɾʲ
ar	ə ɾˠ
arís	ə ˈ ɾʲ iː ʃ
arm	ˈ a ɾˠ ə mˠ
armáil	ˌ a ɾˠ ə ˈ mˠ aː lʲ
arsa	ˈ ə ɾˠ sˠ ə
arsan	ˈ a ɾˠ sˠ ə nˠ
as	ˈ a sˠ
astu	ˈ a sˠ t̪ˠ ə
atá	ə ˈ t̪ˠ aː
atáim	ə ˈ t̪ˠ aː mʲ
athair	ˈ a h ə ɾʲ
athar	ˈ a h ə ɾˠ
áthas	ˈ aː h ə sˠ
ath-léighte	ˈ a ˈ lʲ eː j tʲ ə
aturnae	ˌ a t̪ˠ ə ɾˠ ˈ nˠ eː
ba	bˠ ə
bac	ˈ bˠ a k
baclainn	ˈ bˠ a k lˠ ə nʲ
bácús	bˠ aː ˈ k uː sˠ
baile	ˈ bˠ a lʲ ə
bailithe	ˈ bˠ a lʲ ə h ə
baineadh	ˈ bˠ i nʲ ə x
báine	ˈ bˠ aː nʲ ə
bainne	ˈ bˠ a nʲ ə
baint	ˈ bˠ i nʲ tʲ
bainte	ˈ bˠ i nʲ tʲ ə
báis	ˈ bˠ aː ʃ
balcais	ˈ bˠ a lˠ k ə ʃ
ball	ˈ bˠ au lˠ
b'amhlaidh	ˈ bˠ au lˠ ə
bána	ˈ bˠ aː nˠ ə
ban	ˈ bˠ a nˠ
bán	ˈ bˠ aː nˠ
baol	ˈ bˠ eː lˠ
b'ar	ˈ bˠ a ɾˠ
barr	ˈ bˠ aː ɾˠ
bás	ˈ bˠ aː sˠ
bata	ˈ bˠ a t̪ˠ ə
beaga	ˈ bʲ o ɡ ə
beagáinín	ˈ bʲ ə ɡ aː ˈ nʲ iː nʲ
beagán	bʲ o ˈ ɡ aː nˠ
beag	ˈ bʲ o ɡ
béal	ˈ bʲ iˑə lˠ
bean	ˈ bʲ a nˠ
beannacht	bʲ ə ˈ nˠ a x t̪ˠ
beann	ˈ bʲ au nˠ
bearna	ˈ bʲ aː ɾˠ nˠ ə
bearnach	bʲ ə ɾˠ ˈ nˠ a x
beatha	ˈ bʲ a h ə
b'é	ˈ bʲ eː
beidh(1)	ˈ bʲ e ɟ
beidh	ˈ bʲ e
b'éigean	ˈ bʲ eː ɟ ə nˠ
béil	ˈ bʲ eː lʲ
béile	ˈ bʲ eː lʲ ə
beirt	ˈ bʲ e ɾˠ tʲ
beithíoch	bʲ e ˈ h iˑə x
beo	ˈ bʲ oː
b'fhearr	ˈ bʲ au ɾˠ
b'fhéidir	ˈ bʲ eː dʲ ə ɾʲ
bhácáil	vˠ aː ˈ k aː lʲ
bhácúis	vˠ aː ˈ k uː ʃ
bhaile	ˈ vˠ a lʲ ə
bhail	ˈ vˠ a lʲ
bhainfeadh	ˈ vˠ i nʲ ə x
bhaint	ˈ vˠ i nʲ tʲ
bhairille	ˈ vˠ a ɾʲ ə lʲ ə
bháis	ˈ vˠ aː ʃ
bhall	ˈ vˠ au lˠ
bhán	ˈ vˠ aː nˠ
bhaol	ˈ vˠ eː lˠ
bharántas	vˠ a ˈ ɾˠ aː nˠ t̪ˠ ə sˠ
bhara	ˈ vˠ a ɾˠ ə
bharr	ˈ vˠ aː ɾˠ
bharúntacht	vˠ a ˈ ɾˠ uː nˠ t̪ˠ ə x t̪ˠ
bhata	ˈ vˠ a t̪ˠ ə
bheagán	vʲ o ˈ ɡ aː nˠ
bheag	ˈ vʲ o ɡ
bhéal	ˈ vʲ iˑə lˠ
bhean	ˈ vʲ a nˠ
bhéarfadh	ˈ vʲ iˑə ɾ̥ˠ ə x
bhearna	ˈ vʲ aː ɾˠ nˠ ə
bheatha	ˈ vʲ a h ə
bhéiceas	ˈ vʲ eː c ə sˠ
bheidh(1)	ˈ vʲ e ɟ
bheidh	ˈ vʲ ei ɟ
bheidís	vʲ e ˈ dʲ iː ʃ
bheifeá	vʲ e ˈ fʲ aː
bheinn	ˈ vʲ e nʲ
bheirt	ˈ vʲ e ɾˠ tʲ
bheith	ˈ vʲ e h
bhfágadh	ˈ vˠ aː ɡ ə x
bhfanaidís	ˌ vˠ a nˠ ə ˈ dʲ iː ʃ
bhfanfadh	ˈ vˠ a nˠ ə x
bhfeabhas	ˈ vʲ au sˠ
bhfeaca	ˈ vʲ a k ə
bhféadfadh	ˈ vʲ iˑə t̪ˠ ə x
bhféadfaidís	ˈ vʲ iˑə t̪ˠ ə dʲ iː ʃ
bhféadfaí	vʲ iˑə t̪ˠ fˠ iː
bhfear	ˈ vʲ a ɾˠ
bhfeiceadh	ˈ vʲ e c ə
bhfeicfeadh	ˈ vʲ e c ə x
bhfeicinn	ˈ vʲ e c ə nʲ
bhfeidhm	ˈ vʲ ai mʲ
bhfeirimitíbh	ˈ vʲ e ɾʲ ə mʲ ə tʲ iː vʲ
bhfeirm	ˈ vʲ e ɾʲ ə mʲ
bhfiacala	ˈ vʲ iˑə k ə lˠ ə
bhfichidí	ˌ vʲ i ç ə ˈ dʲ iː
bhfocal	ˈ vˠ o k ə l̻ˠ
bhfochair	ˈ vˠ o x ə ɾʲ
bhformhór	ˌ vˠ o ɾˠ ə ˈ vˠ oː ɾˠ
bhfuair	ˈ vˠ uˑə ɾʲ
bhfuil	ˈ vˠ i lʲ
bhfuinneamh	ˈ vˠ i nʲ ə vˠ
bhídís	ˈ vʲ iː dʲ iː ʃ
bhig	ˈ vʲ i ɟ
bhinn	ˈ vʲ iː nʲ
bhínn	ˈ vʲ iː nʲ
bhíodar	ˈ vʲ iˑə d̪ˠ ə ɾˠ
bhíodh	ˈ vʲ iˑə x
bhí	ˈ vʲ iː
bhlasta	ˈ vˠ lˠ a sˠ t̪ˠ ə
bhláth	ˈ vˠ lˠ aː
bhliain	ˈ vʲ lʲ iˑə nʲ
bhlúire	ˈ vˠ lˠ uː ɾʲ ə
bhotháin	vˠ o ˈ h aː nʲ
bhóthair	ˈ vˠ oː h ə ɾʲ
bhóthar	ˈ vˠ oː h ə ɾˠ
bhó	ˈ vˠ oː
bhraiceal	ˈ vˠ ɾˠ a c ə lˠ
bhrath	ˈ vˠ ɾˠ a h
bhreá	ˈ vʲ ɾʲ aː
bhreith	ˈ vʲ ɾʲ e h
bhreoiteachtaí	ˈ vʲ ɾʲ oː tʲ ə x t̪ˠ iː
bhreoiteacht	ˈ vʲ ɾʲ oː tʲ ə x t̪ˠ
bhriseadh	ˈ vʲ ɾʲ i ʃ ə
bhriste	ˈ vʲ ɾʲ i ʃ tʲ ə
bhrí	ˈ vʲ ɾʲ iː
bhrollach	vˠ ɾˠ o ˈ lˠ a x
bhrú	ˈ vˠ ɾˠ uː
bhuachaill	ˈ vˠ uˑə x ə lʲ
bhuadhdar	ˈ vˠ uˑə ɣ d̪ˠ ə ɾˠ
bhuaileadh	ˈ vˠ uˑə lʲ ə
bhuailfeadh	ˈ vˠ uˑə lʲ ə x
bhuailinn-se	ˈ vˠ uˑə lʲ ə nʲ ʃ e
bhuail	ˈ vˠ uˑə lʲ
bhuaireamh	ˈ vˠ uˑə ɾʲ ə vˠ
bhuairt	ˈ vˠ uˑə ɾˠ tʲ
bhualadh	ˈ vˠ uˑə lˠ ə
bhuartha	ˈ vˠ uː ɾˠ h ə
bhuile	ˈ vˠ i lʲ ə
bhuille	ˈ vˠ i lʲ ə
bhuí	ˈ vˠ iː
bhun	ˈ vˠ u nˠ
bí	ˈ bʲ iː
bíodh	ˈ bʲ iˑə x
bioránach	bʲ i ˈ ɾˠ aː nˠ ə x
bith	ˈ bʲ i
bithiúnach	bʲ i ˈ h uː nˠ ə x
bliain	ˈ bʲ lʲ iˑə nʲ
bliana	ˈ bʲ lʲ iˑə nˠ ə
blianta	ˈ bʲ lʲ iˑə nˠ t̪ˠ ə
blúire	ˈ bˠ lˠ uː ɾʲ ə
bó	ˈ bˠ oː
bochta	ˈ bˠ o x t̪ˠ ə
bocht	ˈ bˠ o x t̪ˠ
bodhar	ˈ bˠ au ɾˠ
b'óige	ˈ bˠ oː ɟ ə
bóithrín	bˠ oː ˈ ɾ̥ʲ iː nʲ
bonn	ˈ bˠ au nˠ
bosca	ˈ bˠ u sˠ k ə
bothán	bˠ ə ˈ h aː nˠ
bóthar	ˈ bˠ oː h ə ɾˠ
bpáirc	ˈ bˠ aː ɾʲ c
bpáircín	bˠ aː ɾʲ ˈ c iː nʲ
bpáirt	ˈ bˠ aː ɾˠ tʲ
bpoiblíocht	ˌ bˠ o bʲ ə ˈ lʲ iˑə x t̪ˠ
bpoll	ˈ bˠ au lˠ
bponc	ˈ bˠ o ŋ k
bportach	bˠ o ɾˠ ˈ t̪ˠ a x
bpráta	ˈ bˠ ɾˠ aː t̪ˠ ə
bprísúnach	bʲ ɾʲ iː ˈ sˠ uː nˠ ə x
braon	ˈ bˠ ɾˠ eː nˠ
brat	ˈ bˠ ɾˠ a t̪ˠ
breá	ˈ bʲ ɾʲ aː
breab	ˈ bʲ ɾʲ a bˠ
breac	ˈ bʲ ɾʲ a k
bréagacha	ˈ bʲ ɾʲ eː ɡ ə x ə
bréag	ˈ bʲ ɾʲ iˑə ɡ
breátha	ˈ bʲ ɾʲ aː h ə
breathnú	bʲ ɾʲ a ˈ n̥ˠ uː
breis	ˈ bʲ ɾʲ e ʃ
breith	ˈ bʲ ɾʲ e h
breoiteacht	ˈ bʲ ɾʲ oː tʲ ə x t̪ˠ
brí	ˈ bʲ ɾʲ iː
briogadáin	ˌ bʲ ɾʲ i ɡ ə ˈ d̪ˠ aː nʲ
bríomhar	ˈ bʲ ɾʲ iː vˠ ə ɾˠ
briseadh	ˈ bʲ ɾʲ i ʃ ə
briste	ˈ bʲ ɾʲ i ʃ tʲ ə
bróga	ˈ bˠ ɾˠ oː ɡ ə
bróg	ˈ bˠ ɾˠ oː ɡ
bruach	ˈ bˠ ɾˠ uˑə x
brú	ˈ bˠ ɾˠ uː
buachaill	ˈ bˠ uˑə x ə lʲ
buachaillí	ˌ bˠ uˑə x ə ˈ lʲ iː
buadh	ˈ bˠ uˑə ɣ
buadhdar	ˈ bˠ uˑə ɣ d̪ˠ ə ɾˠ
buaileadh	ˈ bˠ uˑə lʲ ə x
buile	ˈ bˠ i lʲ ə
buille	ˈ bˠ i lʲ ə
bun	ˈ bˠ u nˠ
bunúsach	bˠ u ˈ nˠ uː sˠ ə x
cabáiste	k a ˈ bˠ aː ʃ tʲ ə
cad	ˈ k a d̪ˠ
cailíní	k a ˈ lʲ iː nʲ iː
cailín	k a ˈ lʲ iː nʲ
cainte	ˈ k ai nʲ tʲ ə
caint	ˈ k ai nʲ tʲ
caisleán	k u ʃ ˈ lʲ aː nˠ
caitheadh	ˈ k a h ə x
caitheamh	ˈ k a h ə vˠ
cá	ˈ k aː
caoi	ˈ k iː
caola	ˈ k eː lˠ ə
capall	ˈ k a pˠ ə lˠ
cárbh	ˈ k aː ɾˠ vˠ
cár	ˈ k aː ɾˠ
casadh	ˈ k a sˠ ə
cás	ˈ k aː sˠ
casúr	k a ˈ sˠ uː ɾˠ
cathain	ˈ k a h ə nʲ
cathaoireach	k a ˈ h iː ɾʲ ə x
cath	ˈ k a h
cead	ˈ c a d̪ˠ
céad	ˈ c iˑə d̪ˠ
ceann	ˈ c au nˠ
ceaptí	c a pʲ ˈ tʲ iː
ceart	ˈ c a ɾˠ t̪ˠ
ceathair	ˈ c a h ə ɾʲ
ceathrar	ˈ c a h ə ɾ̥ˠ ə ɾˠ
cé	ˈ c eː
ceist	ˈ c e ʃ tʲ
ceiste	ˈ c e ʃ tʲ ə
cérbh	ˈ c e ɾˠ vˠ
chabáiste	x a ˈ bˠ aː ʃ tʲ ə
chaereach	ˈ x eː ɾʲ ə x
chailín	x a ˈ lʲ iː nʲ
chailleadh	ˈ x a lʲ ə x
chaill	ˈ x ai lʲ
cháil	ˈ x aː lʲ
chaint	ˈ x ai nʲ tʲ
chaisleáin	x u ʃ ˈ lʲ aː nʲ
chaisleán	x u ʃ ˈ lʲ aː nˠ
chaitheamh	ˈ x a h ə vˠ
chaithfeadh	ˈ x a h ə x
chaithidís	ˌ x a h ə ˈ dʲ iː ʃ
chaithinn	ˈ x a h ə nʲ
chaith	ˈ x a h
chaoi	ˈ x iː
chapall	ˈ x a pˠ ə lˠ
charraig	ˈ x a ɾˠ ə ɟ
chasadh	ˈ x a sˠ ə
chathaoir	x a ˈ h iː ɾʲ
cheacht	ˈ ç a x t̪ˠ
chéad	ˈ ç iˑə d̪ˠ
cheannaigh	ˈ ç a nˠ i ɟ
cheann	ˈ ç au nˠ
cheart	ˈ ç a ɾˠ t̪ˠ
cheathrar	ˈ ç a h ə ɾˠ ə ɾˠ
cheile	ˈ ç e lʲ ə
chéile	ˈ ç eː lʲ ə
cheist	ˈ ç e ʃ tʲ
cheithre	ˈ ç e ɾʲ ə
chiall	ˈ ç iˑə lˠ
chiallmhar	ˈ ç iˑə lˠ vˠ ə ɾˠ
chíosa	ˈ ç iː sˠ ə
chíos	ˈ ç iː sˠ
chirte	ˈ ç i ɾˠ tʲ ə
chíste	ˈ ç iː ʃ tʲ ə
chlaí	ˈ x lˠ iː
chlampar	ˈ x lˠ a mˠ pˠ ə ɾˠ
chlann	ˈ x lˠ au nˠ
chleamhnas	ˈ ç lʲ au nˠ ə sˠ
chliabháin	ç lʲ iˑə ˈ vˠ aː nʲ
chloch	ˈ x lˠ o x
chlós	ˈ x lˠ oː sˠ
chluas	ˈ x lˠ uˑə sˠ
chnapóigín	x nˠ a ˈ pˠ oː ɟ iː nʲ
chneasta	ˈ ç nʲ a sˠ t̪ˠ ə
chnoc	ˈ x nˠ u k
chnoic	ˈ x nˠ i c
chogadh	ˈ x o ɡ ə
choimeádaidís	x o ˈ mʲ aː d̪ˠ ə dʲ iː ʃ
choimeádfadh	x i ˈ mʲ aː t̪ˠ ə x
choimeád	x i ˈ mʲ aː d̪ˠ
choínleach	ˈ x iː nʲ lʲ ə x
choinne	ˈ x i nʲ ə
choir	ˈ x o ɾʲ
chóir	ˈ x oː ɾʲ
chois	ˈ x o ʃ
cholainn	ˈ x o lˠ ə nʲ
choláiste	ˈ x lˠ aː ʃ tʲ ə
chómnuighe	ˈ x oː mˠ nˠ ə j ə
chomparáid	ˌ x o mˠ pˠ ə ˈ ɾˠ aː dʲ
chonaic	ˈ x nˠ i c
chorcáinín	x o ɾˠ ˈ k aː nʲ iː nʲ
chorp	ˈ x o ɾˠ pˠ
chor	ˈ x o ɾˠ
chosaint	ˈ x o sˠ ə nʲ tʲ
chosain	ˈ x o sˠ ə nʲ
chosa	ˈ x o sˠ ə
chosc	ˈ x o sˠ k
chos	ˈ x o sˠ
chreachadh	ˈ ç ɾʲ a x ə
chreach	ˈ ç ɾʲ a x
chreidimh	ˈ ç ɾ̥ʲ e dʲ i vʲ
chrích	ˈ ç ɾʲ iː
chrith	ˈ ç ɾʲ i
chrochadh	ˈ x ɾˠ o ˈ x ə
chroch	ˈ x ɾ̥ˠ o x
chrom	ˈ x ɾˠ au mˠ
chró	ˈ x ɾˠ oː
chruinne	ˈ x ɾˠ i nʲ ə
chruinnigh	ˈ x ɾˠ i nʲ i ɟ
chuadar	ˈ x uˑə d̪ˠ ə ɾˠ
chuaird	ˈ x uˑə ɾˠ dʲ
chuid	ˈ x i dʲ
chuige	ˈ x i ɟ ə
chúig	ˈ x uː ɟ
chúil	ˈ x uː lʲ
chuimhneamh	ˈ x iː nʲ ə vˠ
chúinne	ˈ x uː nʲ ə
chuireadh	ˈ x i ɾʲ ə x
chuirfeadh	ˈ x i ɾʲ ə x
chuiridís	ˈ x i ɾʲ ə dʲ iː ʃ
chuir	ˈ x i ɾʲ
chúis	ˈ x uː ʃ
chúl	ˈ x uː lˠ
chumas-sa	ˈ x u mˠ ə sˠ ə
chumas	ˈ x u mˠ ə sˠ
chuma	ˈ x u mˠ ə
chun	ˈ x u nˠ
chúrsa	ˈ x uː ɾˠ sˠ ə
chur	ˈ x u ɾˠ
ciall	ˈ c iˑə lˠ
cine	ˈ c i nʲ ə
cinn	ˈ c iː nʲ
cionn	ˈ c uː nˠ
ciontach	c u nˠ ˈ t̪ˠ a x
cíosa	ˈ c iː sˠ ə
cíos	ˈ c iː sˠ
ciotóige	c i ˈ t̪ˠ oː ɟ ə
císte	ˈ c iː ʃ tʲ ə
claí	ˈ k lˠ iː
clainne	ˈ k lˠ i nʲ ə
clampair	ˈ k lˠ a mˠ pˠ ə ɾʲ
clampar	ˈ k lˠ a mˠ pˠ ə ɾˠ
clann	ˈ k lˠ au nˠ
cleamhnas	ˈ c lʲ au nˠ ə sˠ
cleasaíocht	c lʲ a ˈ sˠ iˑə x t̪ˠ
cleas	ˈ c lʲ a sˠ
cleite	ˈ c lʲ e tʲ ə
clocha	ˈ k lˠ o x a
cloch	ˈ k lˠ o x
cloiche	ˈ k lˠ i h ə
clós	ˈ k lˠ oː sˠ
clúdaithe	ˈ k lˠ uː d̪ˠ ə h ə
cnámha	ˈ k nˠ aː vˠ ə
cneasta	ˈ c nʲ a sˠ t̪ˠ ə
cnucán	k nˠ u ˈ k aː nˠ
codladh	ˈ k o lˠ ə
cogaidh	ˈ k o ɡ i ɟ
cogarnaigh	ˈ k o ɡ ə ɾˠ nˠ i ɟ
coigríoch	ˌ k o ɟ ə ˈ ɾʲ iˑə x
coimeádadh	k i ˌ mʲ aː d̪ˠ ə x
coimeádhfaidh	k o ˈ mʲ aː ɣ ə
coínleach	ˈ k iː nʲ lʲ ə x
coínlíní	k iː nʲ ˈ lʲ iː nʲ iː
coinneal	ˈ k i nʲ ə lˠ
coise	ˈ k o ʃ ə
cois	ˈ k o ʃ
coláiste	k o ˈ lˠ aː ʃ tʲ ə
col	ˈ k o lˠ
comhluadar	ˈ k oː ˈ lˠ uˑə d̪ˠ ə ɾˠ
cónaí	k oː ˈ nˠ iː
cor	ˈ k o ɾˠ
corp	ˈ k o ɾˠ pˠ
cosa	ˈ k o sˠ ə
cos	ˈ k o sˠ
cos-lomrachta	ˈ k o sˠ ˈ lˠ au mˠ ˈ ɾˠ a x t̪ˠ ə
costais	ˈ k o sˠ t̪ˠ ə ʃ
crainn	ˈ k ɾˠ iː nʲ
crann	ˈ k ɾˠ au nˠ
creachadh	ˈ c ɾʲ a x ə
creideamh	ˈ c ɾʲ e dʲ ə vˠ
creidimh	ˈ c ɾʲ e dʲ ə vʲ
crích	ˈ c ɾʲ iː
críostaí	c ɾʲ iː sˠ ˈ t̪ˠ iː
crochadh	ˈ k ɾˠ o x ə
croise	ˈ k ɾˠ o ʃ ə
cromadh	ˈ k ɾˠ u mˠ ə
cromtha	ˈ k ɾˠ o mˠ h ə
crosta	ˈ k ɾˠ u sˠ t̪ˠ ə
cruadh-chíosa	ˈ k ɾˠ uˑə ɣ ˈ ç iː sˠ ə
cruinne	ˈ k ɾˠ i nʲ ə
cruinn	ˈ k ɾˠ iː nʲ
cuanta	ˈ k uˑə nˠ t̪ˠ ə
cuardaigh	ˈ k uˑə ɾˠ d̪ˠ i ɟ
cúbadh	ˈ k uː bˠ ə
cuid	ˈ k i dʲ
cúigear	ˈ k uː ɟ ə ɾˠ
cúige	ˈ k uː ɟ ə
cúig	ˈ k uː ɟ
cuimhin	ˈ k iː nʲ
cuimhneamh	ˈ k iː nʲ ə vˠ
cuimhne	ˈ k iː nʲ ə
cúinne	ˈ k uː nʲ ə
cuireadh	ˈ k i ɾʲ ə x
cuir	ˈ k i ɾʲ
cúis	ˈ k uː ʃ
cuma	ˈ k u mˠ ə
cúpla	ˈ k uː pˠ lˠ ə
cur	ˈ k u ɾˠ
cúrsaí	k uː ɾˠ ˈ sˠ iː
curtha	ˈ k u ɾ̥ˠ ə
dá	ˈ d̪ˠ aː
daingean	ˈ d̪ˠ a ɲ ə nˠ
daireofá	d̪ˠ a ˈ ɾʲ oː fˠ aː
dána	ˈ d̪ˠ aː nˠ ə
daoibh	ˈ d̪ˠ iː vʲ
daoine	ˈ d̪ˠ iː nʲ ə
d'aois	ˈ d̪ˠ iː ʃ
d'aon	ˈ d̪ˠ eː nˠ
daoradh	ˈ d̪ˠ eː ɾˠ ə
d'arbhar	ˈ d̪ˠ a ɾˠ ə vˠ ə ɾˠ
dárbh	ˈ d̪ˠ aː ɾˠ vˠ
d'ár	ˈ d̪ˠ aː ɾˠ
dár	ˈ d̪ˠ aː ɾˠ
dardaigh	ˈ d̪ˠ a ɾˠ d̪ˠ i ɟ
d'arm	ˈ d̪ˠ a ɾˠ ə mˠ
dathacha	d̪ˠ ə ˈ h a x ə
dead	ˈ dʲ a d̪ˠ
déag	ˈ dʲ iˑə ɡ
d'eagla	ˈ dʲ aː ˈ ɡ lˠ a
dealbh	ˈ dʲ a lˠ ə vˠ
déanamh	ˈ dʲ iˑə nˠ ə vˠ
déanta	ˈ dʲ iˑə nˠ t̪ˠ ə
déarfadh	ˈ dʲ iˑə ɾˠ ə x
déarfaidh	ˈ dʲ iˑə ɾˠ h ə
déarfaidís	ˈ dʲ iˑə ɾˠ h ə dʲ iː ʃ
de	dʲ e
dé	ˈ dʲ eː
deich	ˈ dʲ e
deighilte	ˈ dʲ e j ə lʲ tʲ ə
déileamh	ˈ dʲ eː lʲ ə vˠ
deimhneach	dʲ e vʲ ˈ nʲ a x
déine	ˈ dʲ eː nʲ ə
deireadh	ˈ dʲ e ɾʲ ə
deiridís	ˌ dʲ e ɾʲ ə ˈ dʲ iː ʃ
d'éirigh	ˈ dʲ eː ɾʲ i ɟ
deirim	ˈ dʲ e ɾʲ ə mʲ
deirimse	ˈ dʲ e ɾʲ ə mʲ ʃ ə
deirinn	ˈ dʲ e ɾʲ ə nʲ
déiríodar	dʲ eː ˈ ɾʲ iˑə d̪ˠ ə ɾˠ
deirtí	dʲ e ɾˠ ˈ tʲ iː
deisbhéalaí	dʲ e ʃ ˈ vʲ eː lˠ iː
déistineach	ˈ dʲ eː ʃ tʲ ə nʲ ə x
d'éitheach	ˈ dʲ eː h ə x
den	ˈ dʲ e nʲ
deoch	ˈ dʲ o x
deo	ˈ dʲ oː
desganaibh	ˈ dʲ e sˠ ɡ ə nˠ ə vʲ
d'fhágfadh	ˈ d̪ˠ aː ɡ ə x
dfháil	ˈ d̪ˠ aː lʲ
d'fhan	ˈ d̪ˠ au nˠ
d'fhanfainn	ˈ d̪ˠ a nˠ ə nʲ
d'fhásaidís	ˈ d̪ˠ aː sˠ ə dʲ iː ʃ
d'fhéac	ˈ dʲ eː k
d'fhéachadar	ˈ dʲ eː x ə d̪ˠ ə ɾˠ
dfhéach	ˈ dʲ eː x
d'fhéadadar	ˈ dʲ eː d̪ˠ ə d̪ˠ ə ɾˠ
d'fhéadfadh	ˈ dʲ eː d̪ˠ ə x
d'fhear	ˈ dʲ a ɾˠ
d'fhiacalaibh	ˈ dʲ iˑə k ə lˠ ə vʲ
dhá	ˈ ɣ aː
dhaingean	ˈ ɣ a ɲ ə nˠ
dhaoine	ˈ ɣ iː nʲ ə
dhaoradh	ˈ ɣ eː ɾˠ ə
dheabhróch	ˈ j aː ˈ vˠ ɾˠ oː x
dheacair	ˈ j a k ə ɾʲ
dheaghshláintíghe	ˈ j aː ɣ l̥ˠ aː nʲ ˈ tʲ iː j ə
dhéag	ˈ j iˑə ɡ
dhea	ˈ j a
dhéanamh	ˈ j iˑə nˠ ə vˠ
dhéanfadh	ˈ j iˑə nˠ ə x
dhéanfaidh	ˈ j iˑə nˠ i ɟ
dhéanfaimid	ˈ j iˑə nˠ ə mʲ iː dʲ
dhearbhaigh	ˈ j a ɾˠ ə vˠ i
dheas	ˈ j a sˠ
dhéin	ˈ j eː nʲ
dheirig	ˈ j e ɾʲ ə ɟ
dhé	ˈ j eː
dh'fhásaid	ˈ ɣ aː sˠ ə dʲ
dhíbirt	ˈ j iː bʲ ə ɾˠ tʲ
dhílis	ˈ j iː lʲ i ʃ
dhíobh	ˈ j iˑə vˠ
dhíoladar	ˈ j iˑə lˠ ə d̪ˠ ə ɾˠ
dhíoladh	ˈ j iˑə lˠ ə x
dhíolfadh	ˈ j iː lˠ ə x
dhíol	ˈ j iˑə lˠ
dhírigh	ˈ j iː ɾʲ i ɟ
dhísciú	j iː ʃ ˈ c uː
dhóbair	ˈ ɣ oː bˠ ə ɾʲ
dhó	ˈ ɣ oː
dhroch	ˈ ɣ ɾˠ o x
dhual	ˈ ɣ uˑə lˠ
dhubh	ˈ ɣ u vˠ
dhuine	ˈ ɣ i nʲ ə
dhul	ˈ ɣ u lˠ
dian	ˈ dʲ iˑə nˠ
díbirt	ˈ dʲ iː bʲ ə ɾˠ tʲ
di	ˈ dʲ i
difríocht	dʲ i ˈ fʲ ɾʲ iˑə x t̪ˠ
dimigh	ˈ dʲ i mʲ i ɟ
dinis	ˈ dʲ i nʲ ə ʃ
díobháil	dʲ iː ˈ vˠ aː lʲ
díobhála	dʲ iː ˈ vˠ aː lˠ ə
díobh	ˈ dʲ iˑə vˠ
díoladh	ˈ dʲ iˑə lˠ ə x
díol	ˈ dʲ iˑə lˠ
diompaigh	ˈ dʲ i mˠ pˠ i ɟ
diompaíodar	dʲ i mˠ ˈ pˠ iˑə d̪ˠ ə ɾˠ
díreach	ˈ dʲ iː ɾʲ ə x
d'ithe	ˈ dʲ i h ə
dlí	ˈ dʲ lʲ iː
dlíthe	ˈ dʲ lʲ iː ˈ h e
d'obair	ˈ d̪ˠ o ˈ bˠ a ɾʲ
dócha	ˈ d̪ˠ oː x ə
do	d̪ˠ o
dó	ˈ d̪ˠ oː
dóibh	ˈ d̪ˠ oː vʲ
dóic	ˈ d̪ˠ oː ˈ i c
d'óladh	ˈ d̪ˠ oː ˈ lˠ ai
dom	ˈ d̪ˠ o mˠ
domhan	ˈ d̪ˠ au nˠ
donas	ˈ d̪ˠ o nˠ ə sˠ
don	ˈ d̪ˠ o nˠ
droch	ˈ d̪ˠ ɾˠ o x
dronnaí	d̪ˠ ɾˠ o ˈ nˠ iː
drún	ˈ d̪ˠ ɾˠ uː nˠ
dtabharfadh	ˈ d̪ˠ uː ɾˠ ə x
dtabharfaí	d̪ˠ au ɾˠ ˈ fˠ iː
dtabharfainn	ˈ d̪ˠ uː ɾˠ h i nʲ
dtaca	ˈ d̪ˠ a k ə
dtachtfadh	ˈ d̪ˠ a x t̪ˠ ə x
dtagadh	ˈ d̪ˠ a ɡ ə x
dtalamh	ˈ d̪ˠ a lˠ ə vˠ
dtánag-sa	ˈ d̪ˠ aː nˠ ə ɡ sˠ ə
dtaobh	ˈ d̪ˠ eː vˠ
dteannta	ˈ dʲ au nˠ t̪ˠ ə
dtí	ˈ dʲ iː
dtigh	ˈ dʲ i ɟ
dtineóntaithe	dʲ i ˈ nʲ oː nˠ t̪ˠ ə h ə
dtiocfadh	ˈ dʲ u k ə x
dtráchtfá	d̪ˠ ɾˠ aː x t̪ˠ ˈ fˠ aː
dtreo	ˈ dʲ ɾʲ oː
dtrí	ˈ dʲ ɾ̥ʲ iː
dtriúr	ˈ dʲ ɾʲ uː ɾˠ
dtrucail	ˈ d̪ˠ ɾˠ u k ə lʲ
dtugainn	ˈ d̪ˠ u ɡ ə nʲ
dtugtar	ˈ d̪ˠ u ɡ t̪ˠ ə ɾˠ
dtuigfeadh	ˈ d̪ˠ i c ə x
dtuigtí	d̪ˠ i ɟ ˈ tʲ iː
d'uaigneas	ˈ d̪ˠ uˑə ɟ nʲ ə sˠ
dúbh-chéalacan	ˈ d̪ˠ uː vˠ ˈ ç eː lˠ ə k ə nˠ
dubh	ˈ d̪ˠ u vˠ
duibh	ˈ d̪ˠ i vʲ
dúil	ˈ d̪ˠ uː lʲ
duine	ˈ d̪ˠ i nʲ ə
dúinn	ˈ d̪ˠ uː nʲ
dúirt	ˈ d̪ˠ uː ɾˠ tʲ
duit	ˈ d̪ˠ i tʲ
dul	ˈ d̪ˠ u lˠ
dúnta	ˈ d̪ˠ uː nˠ t̪ˠ ə
ea	ˈ a
éadaigh	ˈ iˑə d̪ˠ i ɟ
éadain	ˈ eː d̪ˠ ə nʲ
éad	ˈ eː d̪ˠ
eagal	ˈ a ɡ ə lˠ
eagla	ˈ a ɡ lˠ ə
éagóir	eː ˈ ɡ oː ɾʲ
éagóra	eː ˈ ɡ oː ɾˠ ə
éalú	eː ˈ lˠ uː
easaontas	ˈ a ˈ sˠ eː nˠ t̪ˠ ə sˠ
é	e
éigean	ˈ eː ɟ ə nˠ
éigin	ˈ eː ɟ ə nʲ
éileamh	ˈ eː lʲ ə vˠ
eile	ˈ e lʲ ə
éirim	ˈ eː ɾʲ ə mʲ
Éirinn	ˈ eː ɾʲ i nʲ
éis	ˈ eː ʃ
eisean	ˈ e ʃ ə nˠ
éisteacht	ˈ eː ʃ tʲ ə x t̪ˠ
Eoghan	ˈ oː nˠ
eolas	ˈ oː lˠ ə sˠ
fada	ˈ fˠ a d̪ˠ ə
fad	ˈ fˠ a d̪ˠ
fadó	fˠ a ˈ d̪ˠ oː
fágadh	ˈ fˠ aː ɡ ə x
fágfar	ˈ fˠ aː ɡ fˠ ə ɾˠ
fágtha	ˈ fˠ aː k ə
fáibrí	fˠ aː ˈ bʲ ɾʲ iː
faid	ˈ fˠ a dʲ
faille	ˈ fˠ aː lʲ ə
fáilteach	ˈ fˠ aː lʲ tʲ ə x
faire	ˈ fˠ a ɾʲ ə
fairsing	ˈ fˠ a ɾˠ ʃ ə nʲ
fanfaidh	ˈ fˠ a nˠ i ɟ
fás	ˈ fˠ aː sˠ
feabhas	ˈ fʲ au sˠ
feaca	ˈ fʲ a k ə
féachaint	ˈ fʲ iˑə x ə nʲ tʲ
féach	ˈ fʲ iˑə x
féadadh	ˈ fʲ iˑə t̪ˠ ə x
fead	ˈ fʲ a d̪ˠ
feadh	fʲ ə
feall	ˈ fʲ au lˠ
fearaibh	ˈ fʲ a ɾˠ i vʲ
fear	ˈ fʲ a ɾˠ
féar	ˈ fʲ iˑə ɾˠ
fearr	ˈ fʲ aː ɾˠ
fé	ˈ fʲ eː
feiceadh	ˈ fʲ e c ə
féidir	ˈ fʲ eː dʲ ə ɾʲ
féin	ˈ fʲ eː nʲ
feirme	ˈ fʲ e ɾʲ ə mʲ ə
feirm	ˈ fʲ e ɾʲ ə mʲ
feiscint	ˈ fʲ i ʃ c ə nʲ tʲ
feitheamh	ˈ fʲ e h ə vˠ
fhada	ˈ a d̪ˠ ə
fhág	ˈ aː ɡ
fhaid	ˈ a dʲ
fhairsing	ˈ a ɾˠ ʃ ə nʲ
fhanadh	ˈ a nˠ ə
fhan	ˈ a nˠ
fhásfaidh	ˈ aː sˠ ə
fheaca	ˈ a k ə
fhéachaint	ˈ iˑə x ə nʲ tʲ
fhéach	ˈ iˑə x
fhéadadh	ˈ iˑə t̪ˠ ə x
fhéadaidís	ˈ eː d̪ˠ ə dʲ iː ʃ
fhéadainn	ˈ eː d̪ˠ ə nʲ
fheadar	ˈ a d̪ˠ ə ɾˠ
fhéadfadh	ˈ iˑə t̪ˠ ə x
fhéadfainn	ˈ iˑə t̪ˠ ə nʲ
fhéad	ˈ iˑə d̪ˠ
fhear	ˈ a ɾˠ
fhearr	ˈ aː ɾˠ
fhéidir	ˈ eː dʲ ə ɾʲ
fhéir	ˈ eː ɾʲ
fheirm	ˈ e ɾʲ ə mʲ
fheoil	ˈ oː lʲ
fhios	ˈ i sˠ
fhir	ˈ i ɾʲ
fhiú	ˈ j uː
fhocal	ˈ o k ə lˠ
fholáir	aː ɾʲ
fhonn	ˈ au nˠ
fhreagair	ˈ ɾʲ a ɡ ə ɾʲ
fhreagairt	ˈ ɾʲ a ɡ ə ɾˠ tʲ
fhreagra	ˈ ɾʲ a ɡ ɾˠ ə
fhuachta	ˈ uˑə x t̪ˠ ə
fhuacht	ˈ uˑə x t̪ˠ
fial	ˈ fʲ iˑə lˠ
fichead	ˈ fʲ i h ə d̪ˠ
fiche	ˈ fʲ i h ə
fichid	ˈ fʲ i h ə dʲ
file	ˈ fʲ i lʲ ə
fill	ˈ fʲ i lʲ
fillte	ˈ fʲ i lʲ tʲ ə
fíor	ˈ fʲ iˑə ɾˠ
fir	ˈ fʲ i ɾʲ
firín	fʲ i ˈ ɾʲ iː nʲ
fírinne	ˈ fʲ iː ɾʲ ə nʲ ə
fiú	ˈ fʲ uː
fliuch	ˈ fʲ lʲ u x
flúirseach	ˈ fˠ lˠ uː ɾˠ ʃ ə x
focail	ˈ fˠ o k ə lʲ
focal	ˈ fˠ o k ə l̻ˠ
foláine	ˈ fˠ o ˈ lˠ aː nʲ ə
foláir	ˈ fˠ lˠ aː ɾʲ
folamh	ˈ fˠ o lˠ ə vˠ
formhór	ˌ fˠ o ɾˠ ə ˈ vˠ oː ɾˠ
fós	ˈ fˠ oː sˠ
Fraincise	ˈ fˠ ɾˠ a nʲ c ə ʃ ə
Fraincis	ˌ fˠ ɾˠ ai ɲ ˈ c iː ʃ
fraoch	ˈ fˠ ɾˠ eː x
freagairt	ˈ fʲ ɾʲ a ɡ ə ɾˠ tʲ
freagra	ˈ fʲ ɾʲ a ɡ ɾˠ ə
fuaid	ˈ fˠ uˑə dʲ
fuair	ˈ fˠ uˑə ɾʲ
fuar	ˈ fˠ uˑə ɾˠ
fuat	ˈ fˠ uˑə t̪ˠ
fuath	ˈ fˠ uˑə
fuinneamh	ˈ fˠ i nʲ ə vˠ
fuinnimh	ˈ fˠ i nʲ ə vʲ
gabhadh	ˈ ɡ au ə x
gabháil	ˈ ɡ vˠ aː lʲ
gabhair	ˈ ɡ au ɾʲ
gabhar	ˈ ɡ au ɾˠ
gach	ˈ ɡ a x
gadhar	ˈ ɡ ai ɾˠ
Gaeil	ˈ ɡ eː lʲ
Gaelacha	ˈ ɡ eː lˠ ə x ə
Gael	ˈ ɡ eː lˠ
gairbhéal	ˌ ɡ a ɾʲ ə ˈ vʲ eː lˠ
gairbhéil	ˌ ɡ a ɾʲ ə ˈ vʲ eː lʲ
gairdín	ɡ a ɾˠ ˈ dʲ iː nʲ
gáire	ˈ ɡ aː ɾʲ ə
gáirí	ɡ aː ˈ ɾʲ iː
gairid	ˈ ɡ a ɾʲ ə dʲ
gais	ˈ ɡ a ʃ
galánta	ɡ a ˈ lˠ aː nˠ t̪ˠ ə
galar	ˈ ɡ a lˠ ə ɾˠ
galúinín	ɡ a ˈ lˠ uː nʲ iː nʲ
galún	ɡ a ˈ lˠ uː nˠ
gan	ˈ ɡ a nˠ
gandail	ˈ ɡ a n̻ˠ d̪ˠ ə lʲ
gandal	ˈ ɡ a n̻ˠ d̪ˠ ə lˠ
gaol	ˈ ɡ eː lˠ
garaidhthibh	ˈ ɡ a ˈ ɾˠ ai h ə vʲ
garbh	ˈ ɡ a ɾˠ ə vˠ
garraí	ɡ a ˈ ɾˠ iː
garraithe	ˈ ɡ a ɾˠ ə h ə
garsúinín	ˈ ɡ a ɾˠ sˠ uː ˈ nʲ iː nʲ
garsún	ɡ a ɾˠ ˈ sˠ uː nˠ
gasra	ˈ ɡ a sˠ ɾˠ ə
gcaidhséar	ɡ ai ˈ ʃ eː ɾˠ
gcailíní	ɡ a ˈ lʲ iː nʲ iː
gcaint	ˈ ɡ a nʲ tʲ
gcaisleán	ɡ u ʃ ˈ lʲ aː nˠ
gcaitear	ˈ ɡ a tʲ ə ɾˠ
gcaitheamh	ˈ ɡ a h ə vˠ
gcaithfeadh	ˈ ɡ a h ə x
gcara	ˈ ɡ a ɾˠ ə
gcaraigreach	ˈ ɡ a ɾˠ ə ɟ ɾʲ ə x
gcarraig	ˈ ɡ a ɾˠ ə ɟ
gcasadh	ˈ ɡ a sˠ ə
gcás	ˈ ɡ aː sˠ
gceachtana	ˈ ɟ a x t̪ˠ ə nˠ ə
gceacht	ˈ ɟ a x t̪ˠ
gcéad	ˈ ɟ iˑə d̪ˠ
gcéadta	ˈ ɟ iˑə t̪ˠ ə
gceannas	ˈ ɟ a nˠ ə sˠ
gceann	ˈ ɟ au nˠ
gceart	ˈ ɟ a ɾˠ t̪ˠ
gceist	ˈ ɟ e ʃ tʲ
gcine	ˈ ɟ i nʲ ə
gcionn	ˈ ɟ uː nˠ
gcíos	ˈ ɟ iː sˠ
gcirt	ˈ ɟ i ɾˠ tʲ
gclár	ˈ ɡ lˠ aː ɾˠ
gcloch	ˈ ɡ lˠ o x
gcnoc	ˈ ɡ nˠ u k
gcnuicín	ɡ nˠ i ˈ c iː nʲ
gcogaí	ɡ o ˈ ɡ iː
gcóir	ˈ ɡ oː ɾʲ
gcoláiste	ɡ o ˈ lˠ aː ʃ tʲ ə
gcomhaireamh	ˈ ɡ oː ɾʲ ə vˠ
gcomparáid	ˌ ɡ o mˠ pˠ ə ˈ ɾˠ aː dʲ
gcónaí	ɡ oː ˈ nˠ iː
gcorp	ˈ ɡ o ɾˠ pˠ
gcreideamh	ˈ ɟ ɾʲ e dʲ ə vˠ
gcrích	ˈ ɟ ɾʲ iː
gcrochfaí	ɡ ɾˠ o x ˈ fˠ iː
gcró	ˈ ɡ ɾˠ oː
gcuid	ˈ ɡ i dʲ
gcúig	ˈ ɡ uː ɟ
gcuimhne	ˈ ɡ iː nʲ ə
gcúinne	ˈ ɡ uː nʲ ə
gcuirfeadh	ˈ ɡ i ɾʲ ə x
gcúl	ˈ ɡ uː lˠ
gcuma	ˈ ɡ u mˠ ə
geala	ˈ ɟ a lˠ ə
geall	ˈ ɟ au lˠ
gearachaile	ˈ ɟ a ɾˠ ə x ə lʲ ə
géara	ˈ ɟ eː ɾˠ ə
géarchúiseach	ˈ ɟ eː ɾˠ ˈ x uː ʃ ə x
géar	ˈ ɟ iˑə ɾˠ
geimhrigh	ˈ ɟ e vʲ ɾʲ i ɟ
géire	ˈ ɟ eː ɾʲ ə
ghabháil	ˈ ɣ vˠ aː lʲ
ghabhar	ˈ ɣ au ɾˠ
gháir	ˈ ɣ aː ɾʲ
ghairbéal	ˌ ɣ a ɾʲ ə ˈ bʲ eː lˠ
ghairbhéal	ˌ ɣ a ɾʲ ə ˈ vʲ eː lˠ
gháire	ˈ ɣ aː ɾʲ ə
gháirí	ɣ aː ˈ ɾʲ iː
gháiridís	ˈ ɣ aː ɾʲ ə dʲ iː ʃ
ghairm	ˈ ɣ a ɾʲ ə mʲ
ghalar	ˈ ɣ a lˠ ə ɾˠ
ghana-chúiseach	ˈ ɣ a nˠ ə ˈ x uː ʃ ə x
ghandail	ˈ ɣ a n̻ˠ d̪ˠ ə lʲ
gharbh	ˈ ɣ a ɾˠ ə vˠ
gharraí	ɣ a ˈ ɾˠ iː
gharsúin	ɣ a ɾˠ ˈ sˠ uː nʲ
gharsún	ɣ a ɾˠ ˈ sˠ uː nˠ
ghas	ˈ ɣ a sˠ
ghealacán	ˌ j a lˠ ə ˈ k aː nˠ
gheall	ˈ j au lˠ
ghearfadh	j ə ˈ ɾˠ a x
ghé	ˈ j eː
ghiora	ˈ j i ɾˠ ə
ghiorra	ˈ j i ɾˠ ə
ghlacadh	ˈ ɣ lˠ a k ə
ghlacaidís	ˌ ɣ lˠ a k ə ˈ dʲ iː ʃ
ghlacfaidís	ˌ ɣ lˠ a k ə ˈ dʲ iː ʃ
ghlais	ˈ ɣ lˠ i ʃ
ghlanadh	ˈ ɣ lˠ a nˠ ə
ghlan	ˈ ɣ lˠ a nˠ
ghlór	ˈ ɣ lˠ oː ɾˠ
ghluais	ˈ ɣ lˠ uˑə ʃ
ghlúin	ˈ ɣ lˠ uː nʲ
ghlún	ˈ ɣ lˠ uː nˠ
ghnímh	ˈ j nʲ iː vʲ
ghníomh	ˈ j nʲ iˑə vˠ
ghnó	ˈ ɣ nˠ oː
ghnúis	ˈ ɣ nˠ uː ʃ
ghoileadar	ˈ ɣ o lʲ ə d̪ˠ ə ɾˠ
ghoile	ˈ ɣ i lʲ ə
ghoill	ˈ ɣ e lʲ
ghráin	ˈ ɣ ɾˠ aː nʲ
ghrámhar	ˈ ɣ ɾˠ aː vˠ ə ɾˠ
ghránna	ˈ ɣ ɾˠ aː nˠ ə
ghreim	ˈ j ɾʲ ei mʲ
ghualainn	ˈ ɣ uˑə lˠ ə nʲ
ghunna	ˈ ɣ u nˠ ə
ghustal	ˈ ɣ u sˠ t̪ˠ ə lˠ
glan	ˈ ɡ lˠ a nˠ
glaoch	ˈ ɡ lˠ eː x
glaoite	ˈ ɡ lˠ eː tʲ ə
glasa	ˈ ɡ lˠ a sˠ ə
glas	ˈ ɡ lˠ a sˠ
gléigeal	ˈ ɟ lʲ eː ɟ a lˠ
gléineach	ˈ ɟ lʲ eː nʲ ə x
glúin	ˈ ɡ lˠ uː nʲ
glún	ˈ ɡ lˠ uː nˠ
gnáth	ˈ ɡ nˠ aː
gníomhartha	ˈ ɟ nʲ iˑə ɾ̥ˠ ə
gníomh	ˈ ɟ nʲ iˑə vˠ
gnó	ˈ ɡ nˠ oː
go	ɡ ə
goile	ˈ ɡ e lʲ ə
gol	ˈ ɡ o lˠ
gorta	ˈ ɡ o ɾˠ t̪ˠ ə
gort	ˈ ɡ o ɾˠ t̪ˠ
gráinne	ˈ ɡ ɾˠ aː nʲ ə
greim	ˈ ɟ ɾʲ ai mʲ
gruth	ˈ ɡ ɾˠ u
gura	ˈ ɡ u ɾˠ ə
gurb	ɡ ə ɾˠ bˠ
gurbh	ɡ u ɾˠ vˠ
gur	ɡ ə ɾˠ
gustal	ˈ ɡ u sˠ t̪ˠ ə lˠ
h-airightí	ˌ h a ɾʲ i ɟ ˈ tʲ iː
háite	ˈ h aː tʲ ə
háit	ˈ h aː tʲ
hálainn	ˈ h aː lˠ ə nʲ
hamháin	h ə ˈ vˠ aː nʲ
hana	ˈ h a nˠ ə
hanam	ˈ h a nˠ ə mˠ
h-anspianta	ˈ h a nˠ ə ˈ sˠ pʲ iˑə nˠ t̪ˠ ə
haon	ˈ h eː nˠ
hardaíodh	h a ɾˠ ˈ d̪ˠ iˑə ɣ
hathair	ˈ h a h ə ɾʲ
hathar	ˈ h a h ə ɾˠ
hathbhliana	ˈ h a ˈ vʲ lʲ iˑə nˠ ə
héagóra	h eː ˈ ɡ oː ɾˠ ə
héagruas	h eː ˈ ɡ ɾˠ uˑə sˠ
hea	ˈ h a
héilíodh	h eː ˈ lʲ iˑə ɣ
hÉireann	ˈ h eː ɾʲ ə nˠ
hÉirinn	ˈ h eː ɾʲ i nʲ
héitheach	ˈ h eː h ə x
hIcí	h i ˈ c iː
h-ínnseadh	ˈ h iː nʲ ʃ ə
hoíche	ˈ h iː h ə
h-oídhcheanta	ˈ h iː j ç ə nˠ t̪ˠ ə
holc	ˈ h o lˠ k
huacht	ˈ h uˑə x t̪ˠ
huafás	h uː ˈ fˠ aː sˠ
huaire	ˈ h uˑə ɾʲ ə
huair	ˈ h uˑə ɾʲ
