á	ˈ aː
cairrín	 k a ˈ ɾʲ iː nʲ
cairt	ˈ k a ɾˠ tʲ
cairte	ˈ k a ɾˠ tʲ ə
cairtín	 k a ɾˠ ˈ tʲ iː nʲ
cairtpháipéar	 k a ɾˠ t̪ˠ ˈ fˠ aː pʲ eː ɾˠ
cáis	ˈ k aː ʃ
Cáisc	ˈ k aː ʃ c
cáise	ˈ k aː ʃ ə
caiséad	 k a ˈ ʃ eː d̪ˠ
caiseal	ˈ k a ʃ ə lˠ
caisiú	 k a ˈ ʃ uː
caisleán	 k u ʃ ˈ lʲ aː nˠ
caisligh	ˈ k a ʃ lʲ i ɟ
Caismíreach	 k a ˈ ʃ mʲ iː ɾʲ ə x
caismirt	ˈ k a ʃ mʲ ə ɾˠ tʲ
Caistíleach	 k a ʃ ˈ tʲ iː lʲ ə x
Caistílis	 k a ʃ ˈ tʲ iː lʲ ə ʃ
Caistílise	 k a ʃ ˈ tʲ iː lʲ ə ʃ ə
cait	ˈ k a tʲ
caite	ˈ k a tʲ ə
caiteachas	 k ə ˈ tʲ a x ə sˠ
caiteoir	 k a ˈ tʲ oː ɾʲ
caith	ˈ k a
caitheamh	ˈ k a h ə vˠ
caithir	ˈ k a h ə ɾʲ
caithréimeach	 k a ˈ ɾ̥ʲ eː mʲ ə x
caithrigh	ˈ k a ɾ̥ʲ i ɟ
Caitliceach	ˈ k a tʲ l̥ʲ ə c ə x
Caitliceachas	ˈ k a tʲ l̥ʲ ə c ə x ə sˠ
cál	ˈ k aː lˠ
calabraigh	ˈ k a lˠ ə bˠ ɾˠ i ɟ
calabraithe	ˈ k a lˠ ə bˠ ɾˠ ə h ə
calabrú	ˌ k a lˠ ə ˈ bˠ ɾˠ uː
calabrúchán	ˌ k a lˠ ə ˈ bˠ ɾˠ uː x aː nˠ
Caladónach	ˌ k a lˠ ə ˈ d̪ˠ oː nˠ ə x
Calafóirneach	ˌ k a lˠ ə ˈ fˠ oː ɾʲ nʲ ə x
calafort	ˈ k a lˠ ə fˠ ə ɾˠ t̪ˠ
calaoise	 k a ˈ lˠ iː ʃ ə
calc	ˈ k a lˠ k
calcadh	ˈ k a lˠ k ə
calcalas	ˈ k a lˠ k ə lˠ ə sˠ
calctha	ˈ k a lˠ k h ə
call	ˈ k au lˠ
callaire	ˈ k a lˠ ə ɾʲ ə
callán	 k a ˈ lˠ aː nˠ
callánach	 k a ˈ lˠ aː nˠ ə x
calm	ˈ k a lˠ ə mˠ
calma	ˈ k a lˠ ə mˠ ə
calmacht	ˈ k a lˠ ə mˠ ə x t̪ˠ
calra	ˈ k a lˠ ɾˠ ə
cam	ˈ k au mˠ
camall	ˈ k a mˠ ə lˠ
camán	 k ə ˈ mˠ aː nˠ
Camarún	ˌ k a mˠ ə ˈ ɾˠ uː nˠ
camas	ˈ k a mˠ ə sˠ
cámas	ˈ k aː mˠ ə sˠ
camastaíl	ˌ k a mˠ ə sˠ ˈ t̪ˠ iː lʲ
cambheart	ˈ k a mʲ bʲ h ə ɾˠ t̪ˠ
Cambódach	 k a mˠ ˈ bˠ oː d̪ˠ ə x
Cambóidis	 k a mˠ ˈ bˠ oː dʲ ə ʃ
Cambóidise	 k a mˠ ˈ bˠ oː dʲ ə ʃ ə
camchuairt	 k a mˠ ˈ x uˑə ɾˠ tʲ
camhaoir	ˈ k au ə ɾʲ
camóg	 k a ˈ mˠ oː ɡ
camógaíocht	 k a ˈ mˠ oː ɡ iˑə x t̪ˠ
campa	ˈ k a mˠ pˠ ə
campáil	 k a mˠ ˈ pˠ aː lʲ
campála	 k a mˠ ˈ pˠ aː lˠ ə
Campúiseach	 k a mˠ ˈ pˠ uː ʃ ə x
camshúileach	 k a mˠ ˈ h uː lʲ ə x
camtha	ˈ k a mˠ h ə
can	ˈ k a nˠ
cánach	ˈ k aː nˠ ə x
cánachais	ˈ k aː nˠ ə x ə ʃ
canadh	ˈ k a nˠ ə
canáil	 k a ˈ nˠ aː lʲ
canbhás	ˈ k au nˠ ə vˠ aː sˠ
cancrach	ˈ k au nˠ k ɾˠ ə x
cancrán	 k au nˠ ˈ k ɾˠ aː nˠ
candaí	 k a n̻ˠ ˈ d̪ˠ iː
candam	ˈ k a n̻ˠ d̪ˠ ə mˠ
cangarú	ˌ k a ŋ ə ˈ ɾˠ uː
canna	ˈ k a nˠ ə
cannabas	ˈ k a nˠ ə bˠ ə sˠ
cannaigh	ˈ k a nˠ i ɟ
canóin	 k a ˈ nˠ oː nʲ
canónaigh	 k a ˈ nˠ oː nˠ i ɟ
canta	ˈ k au nˠ t̪ˠ ə
cantain	ˈ k au nˠ t̪ˠ ə nʲ
Cantainis	ˈ k au nˠ t̪ˠ ə nʲ ə ʃ
Cantainise	ˈ k au nˠ t̪ˠ ə nʲ ə ʃ ə
cantal	ˈ k au nˠ t̪ˠ ə lˠ
cantalach	ˈ k au nˠ t̪ˠ ə lˠ ə x
cantalóir	ˈ k au nˠ t̪ˠ ə lˠ oː ɾʲ
Cantanach	ˈ k au nˠ t̪ˠ ə nˠ ə x
cantaoir	 k au nˠ ˈ t̪ˠ iː ɾʲ
cantarlann	ˈ k au nˠ t̪ˠ ə ɾˠ lˠ ə nˠ
canú	 k a ˈ nˠ uː
canúint	 k a ˈ nˠ uː nʲ tʲ
canúna	 k a ˈ nˠ uː nˠ ə
canúnach	 k a ˈ nˠ uː nˠ ə x
caoch	ˈ k eː x
caochbhealach	ˈ k eː ç vʲ ə lˠ ə x
caochta	ˈ k eː x t̪ˠ ə
caoga	ˈ k eː ɡ ə
caogadú	ˈ k eː ɡ ə d̪ˠ uː
caogaidí	ˈ k eː ɡ ə dʲ iː
caoi	ˈ k iː
caoin	ˈ k iː nʲ
caoineadh	ˈ k iː nʲ ə
caointeach	ˈ k iː nʲ ˈ tʲ a x
caol	ˈ k eː lˠ
caolaigeanta	ˈ k eː lˠ ə ɟ ə nˠ t̪ˠ ə
caolaigh	ˈ k eː lˠ i ɟ
caolaithe	ˈ k eː lˠ ə h ə
caolas	ˈ k eː lˠ ə sˠ
caolchúiseach	 k eː lˠ ˈ x uː ʃ ə x
caolsráid	 k eː lˠ ˈ sˠ ɾˠ aː dʲ
caolú	 k eː ˈ lˠ uː
caomhach	ˈ k eː vˠ ə x
caomhnaigh	ˈ k eː vˠ nˠ i ɟ
caomhnú	 k eː ˈ vˠ nˠ uː
caor	ˈ k eː ɾˠ
caora	ˈ k iː ɾˠ ə
caorach	ˈ k eː ɾˠ ə x
caorán	 k eː ˈ ɾˠ aː nˠ
caorthainn	ˈ k eː ɾˠ ˈ h a nʲ
caorthann	ˈ k eː ɾˠ ə h ə nˠ
capaill	ˈ k a pˠ ə lʲ
capall	ˈ k a pˠ ə lˠ
captaen	 k a pˠ ˈ t̪ˠ eː nˠ
captaenacht	 k a pˠ ˈ t̪ˠ eː nˠ ə x t̪ˠ
cár	ˈ k aː ɾˠ
cara	ˈ k a ɾˠ ə
carachtar	 k ə ˈ ɾˠ a x t̪ˠ ə ɾˠ
carachtracht	 k ə ˈ ɾˠ a x t̪ˠ ɾˠ ə x t̪ˠ
caratach	ˈ k a ɾˠ ə t̪ˠ ə x
carbaihiodráit	 k a ɾˠ ə bˠ ə h ə ˈ d̪ˠ ɾˠ aː tʲ
carball	ˈ k a ɾˠ ə bˠ ə lˠ
carbán	ˌ k a ɾˠ ə ˈ bˠ aː nˠ
carbhán	ˌ k a ɾˠ ə ˈ vˠ aː nˠ
carbhat	ˈ k a ɾˠ ə vˠ ə t̪ˠ
carbóin	ˌ k a ɾˠ ə ˈ bˠ oː nʲ
carcair	ˈ k a ɾˠ k ə ɾʲ
carcanóma	ˌ k a ɾˠ k ə ˈ nˠ oː mˠ ə
carda	ˈ k a ɾˠ d̪ˠ ə
cardáil	 k a ɾˠ ˈ d̪ˠ aː lʲ
cardashoithíoch	ˈ k a ɾˠ d̪ˠ ə h ə h iˑə x
Carghais	ˈ k a ɾˠ ə ɡ h ə ʃ
Carghas	ˈ k a ɾˠ ə ɡ h ə sˠ
carn	ˈ k a ɾˠ nˠ
carnabhal	ˈ k a ɾˠ nˠ ə lˠ
carnaigh	ˈ k a ɾˠ nˠ i ɟ
carnán	 k a ɾˠ ˈ nˠ aː nˠ
carr	ˈ k au ɾˠ
carraeir	 k a ˈ ɾˠ eː ɾʲ
carraeireacht	 k a ˈ ɾˠ eː ɾʲ ə x t̪ˠ
carraig	ˈ k a ɾˠ ə ɟ
carráiste	 k a ˈ ɾˠ aː ʃ tʲ ə
carranna	ˈ k a ɾˠ ə nˠ ə
carrbhealach	ˈ k au ɾʲ vʲ ə lˠ ə x
carrchlós	 k au ɾˠ ˈ x lˠ oː sˠ
carria	 k a ˈ ɾʲ iˑə
carrsheirbhíse	ˈ k au ɾʲ h ə ɾʲ vʲ iː ʃ ə
carst	ˈ k a ɾˠ sˠ t̪ˠ
carstach	 k ə ɾˠ sˠ ˈ t̪ˠ a x
cart	ˈ k a ɾˠ t̪ˠ
cárta	ˈ k aː ɾˠ t̪ˠ ə
Cartagach	ˈ k a ɾˠ t̪ˠ ə ɡ ə x
cártaí	 k aː ɾˠ ˈ t̪ˠ iː
carthanacht	ˈ k a ɾ̥ˠ ə nˠ ə x t̪ˠ
carthanachta	ˈ k a ɾ̥ˠ ə nˠ ə x t̪ˠ ə
carthanachtaí	ˈ k a ɾ̥ˠ ə nˠ ə x t̪ˠ iː
carthanas	ˈ k a ɾ̥ˠ ə nˠ ə sˠ
cartlann	ˈ k a ɾˠ t̪ˠ lˠ ə nˠ
Cartúiseach	 k a ɾˠ ˈ t̪ˠ uː ʃ ə x
cartún	 k a ɾˠ ˈ t̪ˠ uː nˠ
cartús	 k a ɾˠ ˈ t̪ˠ uː sˠ
carúl	 k a ˈ ɾˠ uː lˠ
cás	ˈ k aː sˠ
cas	ˈ k a sˠ
Casacach	ˈ k a sˠ ə k ə x
casadh	ˈ k a sˠ ə
cásáil	 k aː ˈ sˠ aː lʲ
cásálach	 k aː ˈ sˠ aː lˠ ə x
casaoid	 k a ˈ sˠ iː dʲ
casarnach	ˈ k a sˠ ə ɾˠ nˠ ə x
Cásca	ˈ k aː sˠ k ə
caschiorcal	ˈ k a ʃ ç ə ɾˠ k ə lˠ
caschoill	ˈ k a sˠ x ə lʲ
casnóg	 k a sˠ ˈ nˠ oː ɡ
cásobair	ˈ k aː sˠ ə bˠ ə ɾʲ
casóg	 k ə ˈ sˠ oː ɡ
cas-snáth	ˈ k a ˈ sˠ nˠ aː
cás-staidéar	ˈ k aː sˠ t̪ˠ a ˈ dʲ eː ɾˠ
casta	ˈ k a sˠ t̪ˠ ə
castáin	 k a sˠ ˈ t̪ˠ aː nʲ
castaire	ˈ k a sˠ t̪ˠ ə ɾʲ ə
castán	 k a sˠ ˈ t̪ˠ aː nˠ
castóir	 k a sˠ ˈ t̪ˠ oː ɾʲ
castriomaigh	ˈ k a ʃ tʲ ɾ̥ʲ ə mˠ i ɟ
casú	 k a ˈ sˠ uː
casúirín	 k a ˈ sˠ uː ɾʲ iː nʲ
casúr	 k a ˈ sˠ uː ɾˠ
cat	ˈ k a t̪ˠ
catach	 k ə ˈ t̪ˠ a x
catacóm	ˌ k a t̪ˠ ə ˈ k oː mˠ
cataíl	 k a ˈ t̪ˠ iː lʲ
cataitéar	ˌ k a t̪ˠ ə ˈ tʲ eː ɾˠ
catalóg	ˌ k a t̪ˠ ə ˈ lˠ oː ɡ
catalógaigh	ˌ k a t̪ˠ ə ˈ lˠ oː ɡ i ɟ
catalógaithe	ˌ k a t̪ˠ ə ˈ lˠ oː ɡ ə h ə
Catalóinis	ˌ k a t̪ˠ ə ˈ lˠ oː nʲ ə ʃ
Catalóinise	ˌ k a t̪ˠ ə ˈ lˠ oː nʲ ə ʃ ə
Catalónach	ˌ k a t̪ˠ ə ˈ lˠ oː nˠ ə x
catamarán	ˈ k a t̪ˠ ə mˠ ə ɾˠ aː nˠ
Catar	ˈ k a t̪ˠ ə ɾˠ
cath	ˈ k a h
cathain	ˈ k a h ə nʲ
cathair	ˈ k a h ə ɾʲ
Cathair	ˈ k a h ə ɾʲ
cathaoir	 k a ˈ h iː ɾʲ
cathaoireacha	 k a ˈ h iː ɾʲ ə x ə
cathaoirleach	 k a ˈ h iː ɾʲ lʲ ə x
cathaoirleacht	 k a ˈ h iː ɾʲ lʲ ə x t̪ˠ
cathartha	ˈ k a h ə ɾ̥ˠ ə
cathrach	ˈ k a h ə ɾˠ ə x
cathróir	 k a ˈ ɾ̥ˠ oː ɾʲ
cathú	 k a ˈ h uː
Cayman	ˈ k a mˠ ə nˠ
CDanna	ˈ k d̪ˠ a nˠ ə
cé	ˈ c eː
ceabairé	ˌ c a bˠ ə ˈ ɾʲ eː
ceachartha	ˈ c a x ə ɾ̥ˠ ə
ceacht	ˈ c a x t̪ˠ
ceachtar	ˈ c a x t̪ˠ ə ɾˠ
cead	ˈ c a d̪ˠ
céad	ˈ c iˑə d̪ˠ
ceadaigh	ˈ c a d̪ˠ i ɟ
céadainm	ˈ c iˑə ˈ d̪ˠ a nʲ ə mʲ
céadair	ˈ c iˑə d̪ˠ e ɾʲ
ceadaithe	ˈ c a d̪ˠ ə h ə
Céadaoin	 c eː ˈ d̪ˠ iː nʲ
céadar	ˈ c eː d̪ˠ ə ɾˠ
céadfa	ˈ c eː d̪ˠ fˠ ə
céadfaíochas	ˈ c iˑə d̪ˠ ˈ fˠ iː x ə sˠ
céadfhoireann	ˈ c iˑə ˈ d̪ˠ i ɾʲ ə nˠ
céadonóracha	ˈ c iˑə d̪ˠ o ˈ nˠ oː ɾˠ ə x ə
céadrogha	ˈ c iˑə d̪ˠ ˈ ɾˠ au ə
céadsiansa	ˈ c iˑə d̪ˠ ˈ ʃ iˑə nˠ sˠ ə
ceadú	 c a ˈ d̪ˠ uː
céadú	 c eː ˈ d̪ˠ uː
ceadúnas	 c a ˈ d̪ˠ uː nˠ ə sˠ
ceaig	ˈ c a ɟ
ceaintín	 c a nʲ ˈ tʲ iː nʲ
ceal	ˈ c a lˠ
cealaigh	ˈ c a lˠ i ɟ
ceallra	ˈ c au lˠ ɾˠ ə
cealú	 c a ˈ lˠ uː
ceam	ˈ c a mˠ
ceamach	 c ə ˈ mˠ a x
ceamara	ˈ c a mˠ ə ɾˠ ə
ceamaraí	ˌ c a mˠ ə ˈ ɾˠ iː
Ceanada	ˈ c a nˠ ə d̪ˠ ə
Ceanadach	ˈ c a nˠ ə d̪ˠ ə x
ceangail	ˈ c a ŋ ə lʲ
ceangailte	ˈ c a ŋ ɡ ə lʲ tʲ ə
ceangailteach	ˈ c a ŋ ə lʲ tʲ ə x
ceangal	ˈ c a ŋ ɡ ə lˠ
ceangaltán	ˌ c a ŋ ɡ ə lˠ ˈ t̪ˠ aː nˠ
ceanglán	 c a ŋ ˈ lˠ aː nˠ
ceanglas	ˈ c a ŋ lˠ ə sˠ
ceann	ˈ c au nˠ
Ceann	ˈ c au nˠ
céanna	ˈ c iˑə nˠ ə
ceannach	ˈ c nʲ a x
ceannaghaidh	ˈ c au ˈ nˠ ai ɟ
ceannaí	 c a ˈ nˠ iː
ceannaigh	ˈ c a nˠ i ɟ
ceannairceach	ˈ c a nˠ ə ɾʲ c ə x
ceannaire	ˈ c a nˠ ə ɾʲ ə
ceannaireacht	ˈ c au nˠ ə ˈ ɾʲ a x t̪ˠ
ceannais	ˈ c au ˈ nˠ a ʃ
ceannaithe	ˈ c a nˠ ə h ə
ceannaitheoir	ˌ c a nˠ ə ˈ h oː ɾʲ
ceannann	ˈ c a nˠ ə nˠ
ceannáras	ˈ c au ˈ nˠ aː ɾˠ ə sˠ
ceannas	ˈ c a nˠ ə sˠ
ceannasach	ˈ c a nˠ ə sˠ ə x
ceannasacht	ˈ c au nˠ ə ˈ sˠ a x t̪ˠ
ceannasaí	ˌ c a nˠ ə ˈ sˠ iː
ceannasaíocht	ˌ c a nˠ ə ˈ sˠ iˑə x t̪ˠ
ceannbheart	ˈ c au nˠ ˈ vʲ a ɾˠ t̪ˠ
ceanncheathrú	ˈ c au nˠ ç a h ə ˈ ɾ̥ˠ uː
ceanndána	ˈ c au nˠ ˈ d̪ˠ aː nˠ ə
ceanndánacht	ˈ c au nˠ ˈ d̪ˠ aː nˠ ə x t̪ˠ
ceannlitir	ˈ c au nˠ ˈ lʲ i tʲ ə ɾʲ
ceannródaí	ˌ c au nˠ ɾˠ oː ˈ d̪ˠ iː
ceannródaíoch	ˈ c au nˠ ˈ ɾˠ oː ˈ d̪ˠ iː x
ceannteideal	ˈ c au nˠ ˈ tʲ e dʲ ə lˠ
ceansaigh	ˈ c au nˠ sˠ i ɟ
ceansú	 c au nˠ ˈ sˠ uː
ceant	ˈ c au nˠ t̪ˠ
ceantáil	 c au nˠ ˈ t̪ˠ aː lʲ
ceantair	ˈ c a nˠ t̪ˠ ə ɾʲ
ceantála	 c au nˠ ˈ t̪ˠ aː lˠ ə
ceantálaí	 c au nˠ ˈ t̪ˠ aː lˠ iː
ceantar	ˈ c au nˠ t̪ˠ ə ɾˠ
ceanúil	 c a ˈ nˠ uː lʲ
ceap	ˈ c a pˠ
ceapa	ˈ c a pˠ ə
ceapach	 c ə ˈ pˠ a x
ceapadh	ˈ c a pˠ ə
ceapadóir	ˌ c a pˠ ə ˈ d̪ˠ oː ɾʲ
ceapaire	ˈ c a pˠ ə ɾʲ ə
ceaptha	ˈ c a pˠ h ə
cearc	ˈ c a ɾˠ k
ceard	ˈ c a ɾˠ d̪ˠ
céard	ˈ c eː ɾˠ d̪ˠ
ceardaí	 c a ɾˠ ˈ d̪ˠ iː
ceardaíocht	 c a ɾˠ ˈ d̪ˠ iˑə x t̪ˠ
ceardaíochta	 c a ɾˠ ˈ d̪ˠ iˑə x t̪ˠ ə
ceardchumainn	ˈ c a ɾˠ d̪ˠ x ə mˠ ə nʲ
ceardchumann	ˈ c a ɾˠ d̪ˠ x ə mˠ ə nˠ
ceardchumannaí	ˈ c a ɾˠ d̪ˠ x ə mˠ ə nˠ iː
ceardlainne	ˈ c a ɾˠ d̪ˠ lˠ ə nʲ ə
ceardlann	ˈ c a ɾˠ d̪ˠ lˠ ə nˠ
cearn	ˈ c a ɾˠ nˠ
cearnach	ˈ c aː ɾˠ nˠ ə x
cearnaigh	ˈ c aː ɾˠ nˠ i ɟ
cearnaithe	ˈ c a ɾˠ nˠ ə h ə
cearnóg	 c a ɾˠ ˈ nˠ oː ɡ
cearnógach	 c a ɾˠ ˈ nˠ oː ɡ ə x
cearpantóir	ˌ c a ɾˠ pˠ ə nˠ ˈ t̪ˠ oː ɾʲ
cearr	ˈ c au ɾˠ
cearrbhach	ˈ c au ɾˠ vˠ ə x
cearrbhachas	ˈ c au ɾˠ vˠ ə x ə sˠ
ceart	ˈ c a ɾˠ t̪ˠ
cearta	ˈ c a ɾˠ t̪ˠ ə
ceartaigh	ˈ c a ɾˠ t̪ˠ i ɟ
ceartaithe	ˈ c a ɾˠ t̪ˠ ə h ə
ceartchreidmheach	ˈ c a ɾˠ t̪ˠ ç ɾʲ e dʲ ˈ vʲ a x
ceartlár	ˈ c a ɾˠ t̪ˠ ˈ lˠ aː ɾˠ
ceartú	 c a ɾˠ ˈ t̪ˠ uː
ceartúchán	 c a ɾˠ ˈ t̪ˠ uː x aː nˠ
céas	ˈ c eː sˠ
céasadh	ˈ c eː sˠ ə
céasla	ˈ c eː sˠ lˠ ə
céaslaigh	ˈ c eː sˠ lˠ i ɟ
céaslóireacht	 c eː ˈ sˠ lˠ oː ɾʲ ə x t̪ˠ
céasta	ˈ c eː sˠ t̪ˠ ə
céatadáin	ˈ c eː t̪ˠ ə d̪ˠ aː nʲ
céatadán	ˈ c eː t̪ˠ ə d̪ˠ aː nˠ
céatadánach	ˈ c eː t̪ˠ ə d̪ˠ aː nˠ ə x
ceathair	ˈ c a h ə ɾʲ
ceathairdéagú	ˌ c a h ə ɾˠ ˈ dʲ eː ɡ uː
ceathairéad	ˌ c a h ə ˈ ɾʲ eː d̪ˠ
ceathar	ˈ c a h ə ɾˠ
Ceatharlach	ˈ c a h ə ɾˠ lˠ ə x
ceathrach	 c ə ˈ ɾ̥ˠ a x
ceathracha	 c ə ˈ ɾ̥ˠ a x ə
ceathrachadú	ˈ c a ɾ̥ˠ ə x ə d̪ˠ uː
ceathrair	ˈ c a ɾ̥ˠ ə ɾʲ
ceathrar	ˈ c a h ə ɾ̥ˠ ə ɾˠ
ceathrú	ˈ c a h ə ˈ ɾ̥ˠ uː
ceathrún	 c a ˈ ɾ̥ˠ uː nˠ
ceathrúna	 c a ˈ ɾ̥ˠ uː nˠ ə
Ceatsuach	 c a ˈ t̪ˠ uˑə x
céide	ˈ c eː dʲ ə
ceil	ˈ c e lʲ
céile	ˈ c eː lʲ ə
ceiliúir	 c e ˈ lʲ uː ɾʲ
ceiliúr	 c e ˈ lʲ uː ɾˠ
céillí	 c eː ˈ lʲ iː
ceilte	ˈ c e lʲ tʲ ə
ceilteach	 c e lʲ ˈ tʲ a x
Ceiltis	ˈ c e lʲ tʲ ə ʃ
Ceiltise	ˈ c e lʲ tʲ ə ʃ ə
ceilvin	ˈ c e lʲ vʲ ə nʲ
céim	ˈ c eː mʲ
céimchiorcal	ˈ c eː mʲ ç ə ɾˠ k ə lˠ
céime	ˈ c eː mʲ ə
céimeanna	ˈ c eː mʲ ə nˠ ə
céimí	 c eː ˈ mʲ iː
ceimic	ˈ c e mʲ ə c
ceimiceach	ˈ c e mʲ ə c ə x
ceimiceán	ˌ c e mʲ ə ˈ c aː nˠ
céimíocht	 c eː ˈ mʲ iˑə x t̪ˠ
ceimiteiripe	ˈ c e mʲ ə tʲ ə ɾʲ ə pʲ ə
céimneach	ˈ c eː mʲ nʲ ə x
céimnithe	ˈ c eː mʲ nʲ ə h ə
céimnitheach	ˈ c eː mʲ nʲ ə h ə x
céimseata	ˈ c eː mʲ ʃ ə t̪ˠ ə
Céiniach	 c eː ˈ nʲ iˑə x
ceirbheacs	ˈ c e ɾʲ ə vʲ ə k sˠ
ceirbheacsach	ˈ c e ɾʲ ə vʲ ə k sˠ ə x
ceird	ˈ c e ɾˠ dʲ
ceirmeach	ˈ c e ɾʲ ə mʲ ə x
ceirmeachta	ˈ c e ɾʲ ə mʲ ə x t̪ˠ ə
ceirnín	 c e ɾʲ ˈ nʲ iː nʲ
ceirníní	 c e ɾʲ ˈ nʲ iː nʲ iː
ceirt	ˈ c e ɾˠ tʲ
ceirtín	 c e ɾˠ ˈ tʲ iː nʲ
ceirtlín	 c e ɾˠ ˈ tʲ lʲ iː nʲ
ceirtlis	ˈ c e ɾˠ tʲ lʲ ə ʃ
ceirtlise	ˈ c e ɾˠ tʲ lʲ ə ʃ ə
ceist	ˈ c e ʃ tʲ
ceiste	ˈ c e ʃ tʲ ə
ceisteanna	ˈ c e ʃ tʲ ə nˠ ə
ceistigh	ˈ c e ʃ tʲ i ɟ
ceistiú	 c e ʃ ˈ tʲ uː
ceistneoir	 c e ʃ ˈ tʲ n̥ʲ oː ɾʲ
ceithre	ˈ c e ɾʲ ə
cén	ˈ c eː nˠ
cent	ˈ c e nʲ tʲ
ceo	ˈ c oː
ceoil	ˈ c oː lʲ
ceol	ˈ c oː lˠ
ceoláras	ˈ c oː ˈ lˠ aː ɾˠ ə sˠ
ceolbhosca	ˈ c oː lˠ ˈ vˠ u sˠ k ə
ceolchoirm	ˈ c oː lˠ ˌ x i ɾʲ ə mʲ
ceoldráma	ˈ c oː lˠ ˈ d̪ˠ ɾˠ aː mˠ ə
ceoldrámaíocht	ˈ c oː lˠ d̪ˠ ɾˠ aː ˈ mˠ iˑə x t̪ˠ
ceoldrámaíochta	ˈ c oː lˠ d̪ˠ ɾˠ aː ˈ mˠ iˑə x t̪ˠ ə
ceolfhoireann	ˈ c oː ˈ lˠ i ɾʲ ə nˠ
ceolfhoirne	ˈ c oː ˈ lˠ o ɾˠ nʲ ə
ceolfhoirneach	ˈ c oː ˈ lˠ o i ɾʲ ˈ nʲ a x
ceolmhaireacht	ˈ c oː lˠ vˠ ə ɾʲ ə x t̪ˠ
ceolmhar	ˈ c oː lˠ vˠ ə ɾˠ
ceoltóir	 c oː lˠ ˈ t̪ˠ oː ɾʲ
ceoltóirí	ˈ c oː lˠ t̪ˠ oː ˈ ɾʲ iː
cha	ˈ x a
chabhrach	ˈ x au ɾˠ ə x
chábla	ˈ x aː bˠ lˠ ə
cháin	ˈ x aː nʲ
Chainnigh	ˈ x a nʲ i ɟ
Cháisc	ˈ x aː ʃ c
Chaismír	 x a ˈ ʃ mʲ iː ɾʲ
chaite	ˈ x a tʲ ə
Chambóid	 x a mˠ ˈ bˠ oː dʲ
champála	 x a mˠ ˈ pˠ aː lˠ ə
chánach	ˈ x aː nˠ ə x
chaoi	ˈ x iː
chapall	ˈ x a pˠ ə lˠ
charbóin	ˌ x a ɾˠ ə ˈ bˠ oː nʲ
charranna	ˈ x a ɾˠ ə nˠ ə
charthanachta	ˈ x a ɾ̥ˠ ə nˠ ə x t̪ˠ ə
Chasacstáin	ˌ x a sˠ ə k sˠ ˈ t̪ˠ aː nʲ
Chásca	ˈ x aː sˠ k ə
chéad	ˈ ç iˑə d̪ˠ
Chéad	ˈ ç iˑə d̪ˠ
Chéadaoin	 ç eː ˈ d̪ˠ iː nʲ
chéadchéime	ˈ ç iˑə d̪ˠ ˈ ç eː mʲ ə
chéaduair	ˈ ç iˑə ˈ d̪ˠ uˑə ɾʲ
cheana	ˈ h a nˠ ə
cheann	ˈ ç au nˠ
chéanna	ˈ ç iˑə nˠ ə
cheannach	 ç ə ˈ nʲ a x
cheannródaí	 ç au nˠ ɾˠ oː ˈ d̪ˠ iː
cheantair	ˈ ç au nˠ t̪ˠ ə ɾʲ
cheart	ˈ ç a ɾˠ t̪ˠ
Chéasta	ˈ ç iˑə sˠ t̪ˠ ə
chéile	ˈ ç eː lʲ ə
cheilt	ˈ ç e lʲ tʲ
cheimiceach	ˈ ç e mʲ ə c ə x
Chéinia	 ç eː ˈ nʲ iˑə
cheoil	ˈ ç oː lʲ
chíche	ˈ ç iː ç ə
chinn	ˈ ç iː nʲ
Chinn	ˈ ç iː nʲ
chíos	ˈ ç iː sˠ
Chipir	ˈ ç i pʲ ə ɾʲ
Chirgeastáin	ˈ ç i ɾʲ ə ɟ ə sˠ t̪ˠ aː nʲ
chispheile	ˈ ç i sˠ pʲ h ə lʲ ə
chláraithe	ˈ x lˠ aː ɾˠ ə h ə
chlé	ˈ ç lʲ eː
chleamhnais	ˈ ç lʲ au nˠ ə ʃ
chloig	ˈ x lˠ i ɟ
chlóis	ˈ x lˠ oː ə sˠ
chluaise	ˈ x lˠ uˑə ʃ ə
chlúdach	ˈ x lˠ uː d̪ˠ ə x
chnis	ˈ ç nʲ i ʃ
Chogadh	ˈ x o ɡ ə
chogaidh	ˈ x o ɡ i ɟ
choíche	ˈ x iː h ə
choim	ˈ x o mʲ
chóimeála	 x oː ˈ mʲ aː lˠ ə
choimhdeachta	 x o vʲ ˈ dʲ a x t̪ˠ ə
choinne	ˈ x i nʲ ə
choinneáil	 x o ˈ nʲ aː lʲ
choinníoll	 x o ˈ nʲ iˑə lˠ
chóir	ˈ x oː ɾʲ
Chóiré	 x oː ˈ ɾʲ eː
chois	ˈ x o ʃ
cholainne	ˈ x o lˠ ə nʲ ə
Cholóim	 x o ˈ lˠ oː mʲ
chomh	ˈ x oː
chomhair	ˈ x oː ɾʲ
chomhraic	ˈ x oː ɾˠ ə c
Chomóra	 x o ˈ mˠ oː ɾˠ ə
chónaithe	ˈ x oː nˠ ə h ə
Chonnacht	 x o ˈ nˠ a x t̪ˠ
Chontae	ˈ x u nˠ t̪ˠ e
chor	ˈ x o ɾˠ
chosach	 x o ˈ sˠ a x
Chosaiv	ˈ x o sˠ ə vʲ
chosmhuintir	ˈ x o sˠ vˠ ə nʲ tʲ ə ɾʲ
chré	ˈ ç ɾʲ eː
chreidiúna	 ç ɾ̥ʲ e ˈ dʲ uː nˠ ə
chreidmheasa	ˈ ç ɾʲ e dʲ vʲ ə sˠ ə
Chréit	ˈ ç ɾʲ eː tʲ
chríche	ˈ ç ɾʲ iː h ə
chríochnú	 ç ɾʲ iˑə x ˈ nˠ uː
chríonna	ˈ ç ɾ̥ʲ iˑə nˠ ə
Chríostaíocht	 ç ɾʲ iː sˠ ˈ t̪ˠ iˑə x t̪ˠ
Chrócaigh	ˈ x ɾˠ oː k i ɟ
chroí	ˈ x ɾˠ iː
chroíoch	ˈ x ɾˠ iː ˈ o x
Chróit	ˈ x ɾˠ oː tʲ
chrua	ˈ x ɾˠ uˑə
chruinne	ˈ x ɾˠ i nʲ ə
chruinnithe	ˈ x ɾˠ i nʲ ə h ə
chuaigh	ˈ x uˑə ɟ
chuarda	ˈ x uˑə ɾˠ d̪ˠ ə
chuardach	ˈ x uˑə ɾˠ d̪ˠ ə x
chuid	ˈ x i dʲ
chuidithe	ˈ x i dʲ ə h ə
chuig	ˈ x i ɟ
chuige	ˈ x i ɟ ə
chúil	ˈ x uː lʲ
chuimhne	ˈ x i vʲ nʲ ə
chúirt	ˈ x uː ɾˠ tʲ
chuisniúcháin	 x i ʃ ˈ nʲ uː x aː nʲ
chuma	ˈ x u mˠ ə
chun	ˈ x u nˠ
chúnta	ˈ x uː nˠ t̪ˠ ə
chúntach	ˈ x uː nˠ t̪ˠ ə x
chur	ˈ x u ɾˠ
churlála	 x u ɾˠ ˈ lˠ aː lˠ ə
chustaim	ˈ x u sˠ t̪ˠ ə mʲ
ciall	ˈ c iˑə lˠ
ciallaigh	ˈ c iˑə lˠ i ɟ
ciallmhar	ˈ c iˑə lˠ vˠ ə ɾˠ
cian	ˈ c iˑə nˠ
cianda	ˈ c iˑə nˠ d̪ˠ ə
cianoibrí	ˈ c iˑə nˠ o ˈ bʲ ɾʲ iː
cianoideachas	ˈ c iˑə ˌ nˠ e ˈ dʲ a x ə sˠ
cianrialaithe	ˈ c iˑə nˠ ˈ ɾˠ iˑə lˠ ə h ə
cianrialtán	ˈ c iˑə nˠ ɾˠ iˑə lˠ ˈ t̪ˠ aː nˠ
cianrialú	ˈ c iˑə nˠ ɾˠ iˑə ˈ lˠ uː
cianrialúcháin	ˈ c iˑə nˠ ɾˠ iˑə ˈ lˠ uː x aː nʲ
cianrialúchán	ˈ c iˑə nˠ ɾˠ iˑə ˈ lˠ uː x aː nˠ
cianta	ˈ c iˑə nˠ t̪ˠ ə
ciap	ˈ c iˑə pˠ
ciapach	ˈ c iˑə pˠ ə x
ciapadh	ˈ c iˑə pˠ ə
ciardhubh	ˈ c iˑə ɾˠ d̪ˠ h ə vˠ
ciaróg	 c iˑə ˈ ɾˠ oː ɡ
Ciarraí	 c iˑə ˈ ɾˠ iː
ciarsúr	 c iˑə ɾˠ ˈ sˠ uː ɾˠ
cibé	 c i ˈ bʲ eː
cibeal	ˈ c i bʲ ə lˠ
cibear	ˈ c i bʲ ə ɾˠ
cibearspás	ˌ c i bʲ ə ɾˠ sˠ ˈ pˠ aː sˠ
cibir	ˈ c i bʲ ə ɾʲ
cic	ˈ c i c
cic-chlár	ˈ c i c ˈ x lˠ aː ɾˠ
ciceáil	 c i ˈ c aː lʲ
cíche	ˈ c iː ç ə
ciclipéid	ˌ c i c lʲ ə ˈ pʲ eː dʲ
cigilteach	ˈ c i ɟ ə lʲ tʲ ə x
cigire	ˈ c i ɟ ə ɾʲ ə
cigireacht	ˈ c i ɟ ə ɾʲ ə x t̪ˠ
cigireachta	ˈ c i ɟ ə ɾʲ ə x t̪ˠ ə
cileagram	ˈ c i lʲ ə ɡ ɾˠ ə mˠ
cileavatuair	ˈ c i lʲ ə vʲ ə t̪ˠ uˑə ɾʲ
ciliméadar	ˌ c i lʲ ə ˈ mʲ eː d̪ˠ ə ɾˠ
cill	ˈ c i lʲ
Cill	ˈ c i lʲ
cille	ˈ c i lʲ ə
cillí	 c i ˈ lʲ iː
cillín	 c i ˈ lʲ iː nʲ
cime	ˈ c i mʲ ə
Ciméarach	 c i ˈ mʲ eː ɾˠ ə x
cimigh	ˈ c i mʲ i ɟ
cín	ˈ c iː nʲ
Cincíse	 c i nʲ ˈ c iː ʃ ə
Cincíseach	 c i nʲ ˈ c iː ʃ ə x
cine	ˈ c i nʲ ə
cineachadh	ˈ c i nʲ ə ˈ a x ə
cineál	 c i ˌ nʲ aː lˠ
cineálta	 c i ˈ nʲ aː lˠ t̪ˠ ə
cineáltas	 c i ˈ nʲ aː lˠ t̪ˠ ə sˠ
cineama	ˈ c i nʲ ə mˠ ə
cineamatach	ˈ c i nʲ ə ˈ a mˠ ə t̪ˠ ə x
cinedheighilt	ˈ c i nʲ ə ˈ j ai lʲ tʲ
cinéiteach	 c i ˈ nʲ eː tʲ ə x
ciníoch	 c i ˈ nʲ iˑə x
ciníochaí	 c i ˈ nʲ iˑə x iː
ciníochais	 c i ˈ nʲ iˑə x ə ʃ
ciníochas	 c i ˈ nʲ iˑə x ə sˠ
ciniúil	 c i ˈ nʲ uː lʲ
cinn	ˈ c iː nʲ
cinneadh	ˈ c i nʲ ə
cinneadhtheoiric	ˌ c i nʲ ə ˈ h oː ɾʲ ə c
cinnire	ˈ c i nʲ ə ɾʲ ə
cinniúint	 c i ˈ nʲ uː nʲ tʲ
cinnte	ˈ c iː nʲ tʲ ə
cinnteacht	ˈ c iː nʲ tʲ ə x t̪ˠ
cinnteoireacht	 c iː nʲ ˈ tʲ oː ɾʲ ə x t̪ˠ
cinnteoireachta	 c iː nʲ ˈ tʲ oː ɾʲ ə x t̪ˠ ə
cinntigh	ˈ c iː nʲ tʲ i ɟ
cíoch	ˈ c iː x
cíocha	ˈ c iː x ə
cíochbheart	ˈ c iː ç vʲ ə ɾˠ t̪ˠ
cíocrach	ˈ c iː k ɾˠ ə x
cíocras	ˈ c iː k ɾˠ ə sˠ
ciogal	ˈ c i ɡ ə lˠ
cion	ˈ c u nˠ
cionn	ˈ c uː nˠ
ciontach	 c u nˠ ˈ t̪ˠ a x
ciontóir	 c u nˠ ˈ t̪ˠ oː ɾʲ
cíor	ˈ c iː ɾˠ
ciorcad	ˈ c i ɾˠ k ə d̪ˠ
ciorcal	ˈ c i ɾˠ k ə l̻ˠ
ciorclach	 c i ɾˠ ˈ k lˠ a x
ciorclaigh	ˈ c i ɾˠ k lˠ i ɟ
ciorraigh	ˈ c i ɾˠ i ɟ
ciorraithe	ˈ c i ɾˠ ə h ə
ciorrú	 c i ˈ ɾˠ uː
cíos	ˈ c iː sˠ
cíosa	ˈ c iː sˠ ə
ciotach	 c i ˈ t̪ˠ a x
ciotaí	 c i ˈ t̪ˠ iː
ciotóg	 c i ˈ t̪ˠ oː ɡ
ciotóige	 c i ˈ t̪ˠ oː ɟ ə
ciotrúnta	ˌ c i t̪ˠ ə ˈ ɾˠ uː nˠ t̪ˠ ə
cipín	 c i ˈ pʲ iː nʲ
Cipireach	ˈ c i pʲ ə ɾʲ ə x
Cipiris	ˈ c i pʲ ə ɾʲ ə ʃ
Cipirise	ˈ c i pʲ ə ɾʲ ə ʃ ə
circeoil	 c i ɾʲ ˈ c oː lʲ
circeola	 c i ɾʲ ˈ c oː lˠ ə
Cireabaití	ˈ c i ɾʲ ə bˠ ə tʲ iː
círéibe	 c iː ˈ ɾʲ eː bʲ ə
círín	 c iː ˈ ɾʲ iː nʲ
cis	ˈ c i ʃ
ciseal	ˈ c i ʃ ə lˠ
ciseán	 c i ˈ ʃ aː nˠ
cispheil	ˈ c i sˠ pʲ h ə lʲ
cispheile	ˈ c i sˠ pʲ h ə lʲ ə
císte	ˈ c iː ʃ tʲ ə
ciste	ˈ c i ʃ tʲ ə
Cistéirseach	 c i ʃ ˈ tʲ eː ɾʲ ʃ ə x
cistigh	ˈ c i ʃ tʲ i ɟ
cistin	ˈ c i ʃ tʲ ə nʲ
cistine	ˈ c i ʃ tʲ ə nʲ ə
cistiú	 c i ʃ ˈ tʲ uː
cistiúchán	 c i ʃ ˈ tʲ uː x aː nˠ
cit	ˈ c i tʲ
citeal	ˈ c i tʲ ə lˠ
citealdruma	ˈ c i tʲ ə lˠ d̪ˠ ɾˠ ə mˠ ə
cith	ˈ c i
cithdhíonach	ˈ c i ˈ j iː nˠ ə x
cithfholcadán	ˈ c i ˌ o lˠ k ə ˈ d̪ˠ aː nˠ
cithfholcadh	ˈ c i ˈ o lˠ k ə
citreach	 c i ˈ tʲ ɾ̥ʲ a x
ciú	ˈ c uː
ciúáil	 c uː ˈ aː lʲ
ciúb	ˈ c uː bˠ
ciúin	ˈ c uː nʲ
ciumhais	ˈ c u vˠ ə ʃ
ciumhaismhaisithe	ˈ c u vˠ ə sˠ vˠ ə ʃ ə h ə
ciumhsóg	 c u vˠ ˈ sˠ oː ɡ
ciúnaigh	ˈ c uː nˠ i ɟ
ciúnas	ˈ c uː nˠ ə sˠ
clabhsúr	 k lˠ au ˈ sˠ uː ɾˠ
clabhta	ˈ k lˠ au t̪ˠ ə
cladach	 k lˠ ə ˈ d̪ˠ a x
cladhaire	ˈ k lˠ ai ɾʲ ə
cladhartha	ˈ k lˠ ai ɾ̥ˠ ə
claí	ˈ k lˠ iː
claibín	 k lˠ a ˈ bʲ iː nʲ
claífort	ˈ k lˠ iː fˠ ə ɾˠ t̪ˠ
clainne	ˈ k lˠ i nʲ ə
claíomh	ˈ k lˠ iː vˠ
cláir	ˈ k lˠ aː ɾʲ
clairnéid	 k lˠ a ɾʲ ˈ nʲ eː dʲ
clairnéide	 k lˠ a ɾʲ ˈ nʲ eː dʲ ə
cláirseach	ˈ k lˠ aː ɾʲ ʃ ə x
cláirsí	 k lˠ aː ɾˠ ˈ ʃ iː
clais	ˈ k lˠ a ʃ
clamhán	 k lˠ au ˈ aː nˠ
clamhsán	 k lˠ au ˈ sˠ aː nˠ
clampa	ˈ k lˠ a mˠ pˠ ə
clampar	ˈ k lˠ a mˠ pˠ ə ɾˠ
clann	ˈ k lˠ au nˠ
claochlaigh	ˈ k lˠ eː x lˠ i ɟ
claochlaithe	ˈ k lˠ eː x lˠ ə h ə
claochlaitheach	ˈ k lˠ eː x lˠ ə h ə x
claon	ˈ k lˠ eː nˠ
claonadh	ˈ k lˠ eː nˠ ə
claonán	 k lˠ eː ˈ nˠ aː nˠ
claonbheart	ˈ k lˠ eː nˠ ˈ vʲ a ɾˠ t̪ˠ
claonta	ˈ k lˠ eː nˠ t̪ˠ ə
claontacht	ˈ k lˠ eː nˠ t̪ˠ ə x t̪ˠ
clapsholas	ˈ k lˠ a pˠ h ə lˠ ə sˠ
clár	ˈ k lˠ aː ɾˠ
Clár	ˈ k lˠ aː ɾˠ
cláraigh	ˈ k lˠ aː ɾˠ i ɟ
cláraithe	ˈ k lˠ aː ɾˠ ə h ə
cláraitheoir	ˈ k lˠ aː ɾˠ ə h oː ɾʲ
cláreagrú	ˈ k lˠ aː ɾʲ ə ɡ ɾˠ uː
clárlann	ˈ k lˠ aː ɾˠ lˠ ə nˠ
clárphláta	 k lˠ aː ɾˠ ˈ fˠ lˠ aː t̪ˠ ə
clárscátáil	 k lˠ aː ɾˠ sˠ ˈ k aː t̪ˠ aː lʲ
clársceidealú	ˌ k lˠ aː ɾʲ ʃ c ə dʲ ə ˈ lˠ uː
clasaic	ˈ k lˠ a sˠ ə c
clasaiceach	ˈ k lˠ a sˠ ə c ə x
clasaicí	ˌ k lˠ a sˠ ə ˈ c iː
clasaicíoch	ˌ k lˠ a sˠ ə ˈ c iˑə x
clásal	ˈ k lˠ aː sˠ ə lˠ
clasán	 k lˠ a ˈ sˠ aː nˠ
clascairt	ˈ k lˠ a sˠ k ə ɾˠ tʲ
claspa	ˈ k lˠ a sˠ pˠ ə
clé	ˈ c lʲ eː
cleacht	ˈ c lʲ a x t̪ˠ
cleachtadh	ˈ c lʲ a x t̪ˠ ə
cleachtas	ˈ c lʲ a x t̪ˠ ə sˠ
cleachtóir	 c lʲ a x ˈ t̪ˠ oː ɾʲ
cleamhnacht	ˈ c lʲ au nˠ ə x t̪ˠ
cleamhnais	ˈ c lʲ au nˠ ə ʃ
cleamhnas	ˈ c lʲ au nˠ ə sˠ
cleamhnú	 c lʲ au ˈ nˠ uː
cleas	ˈ c lʲ a sˠ
cleasach	 c lʲ ə ˈ sˠ a x
cleasaíocht	 c lʲ a ˈ sˠ iˑə x t̪ˠ
cléchliceáil	ˈ c lʲ eː ç lʲ ə c aː lʲ
cléibh	ˈ c lʲ eː vʲ
cleipteamáine	ˌ c lʲ e pʲ tʲ ə ˈ mˠ aː nʲ ə
cleipteamáineach	ˌ c lʲ e pʲ tʲ ə ˈ mˠ aː nʲ ə x
cléir	ˈ c lʲ eː ɾʲ
cléireach	ˈ c lʲ eː ɾʲ ə x
cléireachais	ˈ c lʲ eː ˈ ɾʲ a x ə ʃ
cléiriúil	 c lʲ eː ˈ ɾʲ uː lʲ
cleiteán	 c lʲ e ˈ tʲ aː nˠ
cleiteog	 c lʲ e ˈ tʲ oː ɡ
cleith	ˈ c lʲ e
cléithín	 c lʲ eː ˈ h iː nʲ
cleithiúnaí	 c lʲ e ˈ h uː nˠ iː
cliabh	ˈ c lʲ iˑə vˠ
cliabhán	 c lʲ iˑə ˈ vˠ aː nˠ
cliabhrach	ˈ c lʲ iˑə vˠ ɾˠ ə x
cliaint	ˈ c lʲ iˑə nʲ tʲ
cliant	ˈ c lʲ iˑə nˠ t̪ˠ
cliantacht	ˈ c lʲ iˑə nˠ t̪ˠ ə x t̪ˠ
cliath	ˈ c lʲ iˑə
cliathán	 c lʲ iˑə ˈ h aː nˠ
cliathánach	 c lʲ iː ˈ h aː nˠ ə x
cliathánaí	 c lʲ iˑə ˈ h aː nˠ iː
clib	ˈ c lʲ i bʲ
clibeáil	 c lʲ i ˈ bʲ aː lʲ
clibeáilte	 c lʲ i ˈ bʲ aː lʲ tʲ ə
clibín	 c lʲ i ˈ bʲ iː nʲ
clic	ˈ c lʲ i c
cliceáil	 c lʲ i ˈ c aː lʲ
clicire	ˈ c lʲ i c ə ɾʲ ə
cling	ˈ c lʲ i ɲ
clinic	ˈ c lʲ i nʲ ə c
cliniceoir	ˌ c lʲ i nʲ ə ˈ c oː ɾʲ
clis	ˈ c lʲ i ʃ
cliseadh	ˈ c lʲ i ʃ ə
cliste	ˈ c lʲ i ʃ tʲ ə
clisteacht	 c lʲ i ʃ ˈ tʲ a x t̪ˠ
cló	ˈ k lˠ oː
cló-aghaidh	ˈ k lˠ oː ˈ ai ɟ
clóbhuail	ˈ k lˠ oː ˈ vˠ uˑə lʲ
clóbhuailte	ˈ k lˠ oː ˈ vˠ uˑə lʲ tʲ ə
cloch	ˈ k lˠ o x
clocha	ˈ k lˠ o x a
clochar	ˈ k lˠ o x ə ɾˠ
clóchuir	ˈ k lˠ oː ˈ x i ɾʲ
clódóir	 k lˠ oː ˈ d̪ˠ oː ɾʲ
clódóireachta	ˈ k lˠ oː ˈ d̪ˠ oː i ˈ ɾʲ a x t̪ˠ ə
clófhoireann	ˈ k lˠ oː ˈ i ɾʲ ə nˠ
clog	ˈ k lˠ o ɡ
clogad	ˈ k lˠ o ɡ ə d̪ˠ
cloiche	ˈ k lˠ i h ə
cloicheán	 k lˠ o ˈ ç aː nˠ
