á	ˈ aː
Páirc	ˈ pˠ aː ɾʲ c
páirce	ˈ pˠ aː ɾʲ c ə
páirceáil	 pˠ aː ɾʲ ˈ c aː lʲ
páirceáilte	 pˠ aː ɾʲ ˈ c aː lʲ tʲ ə
páirceála	 pˠ aː ɾʲ ˈ c aː lˠ ə
páircíneach	 pˠ aː ɾʲ ˈ c iː nʲ ə x
páirt	ˈ pˠ aː ɾˠ tʲ
páirtaimseartha	ˈ pˠ aː ɾˠ ˈ tʲ ai mʲ ʃ ə ɾˠ h ə
páirtí	 pˠ aː ɾˠ ˈ tʲ iː
Pairtiach	 pˠ a ɾˠ ˈ tʲ iˑə x
páirtíocht	 pˠ aː ɾˠ ˈ tʲ iˑə x t̪ˠ
Páise	ˈ pˠ aː ʃ ə
paisinéir	ˌ pˠ a ʃ ə ˈ nʲ eː ɾʲ
páiste	ˈ pˠ aː ʃ tʲ ə
paiste	ˈ pˠ a ʃ tʲ ə
páistí	 pˠ aː ʃ ˈ tʲ iː
paiteanta	ˈ pˠ a tʲ ə nˠ t̪ˠ ə
paiteolaíocht	 pˠ a ˈ tʲ oː lˠ iˑə x t̪ˠ
paitió	ˌ pˠ a tʲ i ˈ oː
Palaistíneach	ˌ pˠ a lˠ ə ʃ ˈ tʲ iː nʲ ə x
pampaí	 pˠ a mˠ ˈ pˠ iː
pampas	ˈ pˠ a mˠ pˠ ə sˠ
Panama	ˈ pˠ a nˠ ə mˠ ə
Panamach	ˈ pˠ a nˠ ə mˠ ə x
pantar	ˈ pˠ au nˠ t̪ˠ ə ɾˠ
pápa	ˈ pˠ aː pˠ ə
Pápa	ˈ pˠ aː pˠ ə
parabal	ˈ pˠ a ɾˠ ə bˠ ə lˠ
paragraf	ˈ pˠ a ɾˠ ə ɡ ɾˠ ə fˠ
Paragua	ˌ pˠ a ɾˠ ə ˈ ɡ uˑə
paráid	 pˠ a ˈ ɾˠ aː dʲ
Páras	ˈ pˠ aː ɾˠ ə sˠ
Párasach	ˈ pˠ aː ɾˠ ə sˠ ə x
parasól	ˌ pˠ a ɾˠ ə ˈ sˠ oː lˠ
pardún	 pˠ aː ɾˠ ˈ d̪ˠ uː nˠ
parlaimint	ˈ pˠ a ɾˠ lˠ ə mʲ ə nʲ tʲ
Parlaimint	ˈ pˠ a ɾˠ lˠ ə mʲ ə nʲ tʲ
parlaiminte	ˈ pˠ a ɾˠ lˠ ə mʲ ə nʲ tʲ ə
parlaiminteach	ˈ pˠ a ɾˠ lˠ ə mʲ ə nʲ tʲ ə x
parlús	 pˠ a ɾˠ ˈ lˠ uː sˠ
paróisteach	 pˠ a ˈ ɾˠ oː ʃ tʲ ə x
parsáil	 pˠ a ɾˠ ˈ sˠ aː lʲ
parthas	ˈ pˠ a ɾ̥ˠ ə sˠ
pas	ˈ pˠ a sˠ
pasáil	 pˠ a ˈ sˠ aː lʲ
pasáiste	 pˠ u ˈ sˠ aː ʃ tʲ ə
pasfhocail	ˈ pˠ a sˠ ə k ə lʲ
pasfhocal	ˈ pˠ a sˠ ə k ə lˠ
paslaig	ˈ pˠ a sˠ lˠ ə ɟ
paslaige	ˈ pˠ a sˠ lˠ ə ɟ ə
pasta	ˈ pˠ a sˠ t̪ˠ ə
pataigin	ˈ pˠ a t̪ˠ ə ɟ ə nʲ
patraisc	ˈ pˠ a t̪ˠ ɾ̥ˠ ə ʃ c
patraisce	ˈ pˠ a t̪ˠ ɾ̥ˠ ə ʃ c ə
patrarcacht	ˈ pˠ a t̪ˠ ɾ̥ˠ ə ɾˠ k ə x t̪ˠ
patróil	 pˠ a ˈ t̪ˠ ɾ̥ˠ oː lʲ
patról	 pˠ a ˈ t̪ˠ ɾ̥ˠ oː lˠ
patrún	 pˠ a ˈ t̪ˠ ɾ̥ˠ uː nˠ
pátrún	 pˠ aː ˈ t̪ˠ ɾ̥ˠ uː nˠ
pátrúnacht	 pˠ aː ˈ t̪ˠ ɾ̥ˠ uː nˠ ə x t̪ˠ
patuar	 pˠ a ˈ t̪ˠ uˑə ɾˠ
pé	ˈ pʲ eː
péac	ˈ pʲ eː k
peaca	ˈ pʲ a k ə
peacaigh	ˈ pʲ a k i ɟ
péacán	 pʲ eː ˈ k aː nˠ
peann	ˈ pʲ au nˠ
peannaireacht	ˈ pʲ a nˠ ə ɾʲ ə x t̪ˠ
péarlaí	 pʲ eː ɾˠ ˈ lˠ iː
pearsa	ˈ pʲ a ɾˠ sˠ ə
pearsanra	ˈ pʲ a ɾˠ sˠ ə nˠ ɾˠ ə
pearsanta	ˈ pʲ a ɾˠ sˠ ə nˠ t̪ˠ ə
pearsantacht	ˈ pʲ a ɾˠ sˠ ə nˠ t̪ˠ ə x t̪ˠ
péas	ˈ pʲ eː sˠ
peata	ˈ pʲ a t̪ˠ ə
Péicing	ˈ pʲ eː c ə ɲ
péidiatraiceach	 pʲ eː ˈ dʲ iˑə t̪ˠ ɾ̥ˠ ə c ə x
peil	ˈ pʲ e lʲ
peile	ˈ pʲ e lʲ ə
peileadóir	ˌ pʲ e lʲ ə ˈ d̪ˠ oː ɾʲ
péine	ˈ pʲ eː nʲ ə
péineas	ˈ pʲ eː nʲ ə sˠ
péint	ˈ pʲ eː nʲ tʲ
péinteáil	 pʲ eː nʲ ˈ tʲ aː lʲ
péinteáilte	 pʲ eː nʲ ˈ tʲ aː lʲ tʲ ə
péinteanna	ˈ pʲ eː nʲ tʲ ə nˠ ə
péintéir	 pʲ eː nʲ ˈ tʲ eː ɾʲ
péintéireacht	 pʲ eː nʲ ˈ tʲ eː ɾʲ ə x t̪ˠ
peiptíd	 pʲ e pʲ ˈ tʲ iː dʲ
péire	ˈ pʲ eː ɾʲ ə
péireáil	 pʲ eː ˈ ɾʲ aː lʲ
péireáilte	 pʲ eː ˈ ɾʲ aː lʲ tʲ ə
peiriad	 pʲ e ˈ ɾʲ iˑə d̪ˠ
peiríocha	 pʲ e ˈ ɾʲ iˑə x ə
Peiriú	 pʲ e ˈ ɾʲ uː
Peiriúch	 pʲ e ˈ ɾʲ uː x
Peirseach	 pʲ e ɾʲ ˈ ʃ a x
peirsil	ˈ pʲ e ɾʲ ʃ ə lʲ
peirsile	ˈ pʲ e ɾʲ ʃ ə lʲ ə
peirspictíocht	ˌ pʲ e ɾʲ sˠ pʲ ə c ˈ tʲ iˑə x t̪ˠ
peitreal	ˈ pʲ e tʲ ɾ̥ʲ ə lˠ
peitril	ˈ pʲ e tʲ ɾ̥ʲ ə lʲ
peitriliam	ˌ pʲ e tʲ ɾ̥ʲ ə ˈ lʲ iˑə mˠ
péitse	ˈ pʲ eː tʲ ə
Phacastáin	ˌ fˠ a k ə sˠ ˈ t̪ˠ aː nʲ
Phádraig	ˈ fˠ aː d̪ˠ ɾˠ ə ɟ
pháirceála	 fˠ aː ɾʲ ˈ c aː lˠ ə
Phalaistín	ˌ fˠ a lˠ ə ʃ ˈ tʲ iː nʲ
Phapua	 fˠ a ˈ pˠ uˑə
pharaisiúit	ˌ fˠ a ɾˠ ə ˈ ʃ uː tʲ
Pheadair	ˈ fʲ a d̪ˠ ə ɾʲ
phearsa	ˈ fʲ a ɾˠ sˠ ə
phearsanra	ˈ fʲ a ɾˠ sˠ ə nˠ ɾˠ ə
phearsanta	ˈ fʲ a ɾˠ sˠ ə nˠ t̪ˠ ə
Pheilipinéis	ˈ fʲ e lʲ ə pʲ ə nʲ eː ʃ
phíoláf	 fʲ iː ˈ lˠ aː fˠ
phíolótach	 fʲ iː ˈ lˠ oː t̪ˠ ə x
phiotútach	 fʲ i ˈ t̪ˠ uː t̪ˠ ə x
Phoblacht	ˈ fˠ o bˠ ə lˠ ə x t̪ˠ
phóca	ˈ fˠ oː k ə
phoiblí	ˌ fˠ o bʲ ˈ lʲ iː
Pholainn	ˈ fˠ o lˠ ə nʲ
pholaitiúil	ˌ fˠ o lˠ ə ˈ tʲ uː lʲ
Phortaingéil	ˌ fˠ o ɾˠ t̪ˠ ə ˈ ɲ eː lʲ
photaireachta	ˈ fˠ o t̪ˠ ə ɾʲ ə x t̪ˠ ə
phraghais	ˈ fˠ ɾˠ ai ə ʃ
phrátaí	 fˠ ɾˠ aː ˈ t̪ˠ iː
phreispitéireach	ˌ fʲ ɾʲ e sˠ pʲ ə ˈ tʲ eː ɾʲ ə x
phríobháideach	 fʲ ɾʲ iː ˈ vˠ aː dʲ ə x
phríomha	ˈ fʲ ɾʲ iː vˠ ə
phríomhabhcóide	ˈ fʲ ɾʲ iː vˠ au ˈ k oː dʲ ə
phrofa	ˈ fˠ ɾˠ o fˠ ə
pí	ˈ pʲ iː
pian	ˈ pʲ iˑə nˠ
pianbhreith	ˈ pʲ iˑə nˠ ˈ vʲ ɾʲ e h
pianmhar	ˈ pʲ iˑə nˠ vˠ ə ɾˠ
pianó	 pʲ iˑə ˈ nˠ oː
pianódóir	ˈ pʲ iˑə nˠ oː ˈ d̪ˠ oː ɾʲ
piara	ˈ pʲ iˑə ɾˠ ə
piarda	ˈ pʲ iˑə ɾˠ d̪ˠ ə
piarmheasúnaigh	ˈ pʲ iˑə ɾʲ vʲ ə sˠ uː nˠ i ɟ
piarmheasúnú	ˈ pʲ iˑə ɾʲ vʲ ə sˠ uː nˠ uː
píb	ˈ pʲ iː bʲ
pic	ˈ pʲ i c
picnic	ˈ pʲ i c nʲ ə c
picteagram	ˈ pʲ i c tʲ ə ɡ ɾˠ ə mˠ
picteilín	ˌ pʲ i c tʲ ə ˈ lʲ iː nʲ
pictiúr	 pʲ i c ˈ tʲ uː ɾˠ
pictiúrlann	 pʲ i c ˈ tʲ uː ɾˠ lˠ ə nˠ
piléar	 pʲ lʲ eː ɾˠ
pílear	ˈ pʲ iː lʲ ə ɾˠ
piléarlann	 pʲ i ˈ lʲ eː ɾˠ lˠ ə nˠ
pilséar	 pʲ i lʲ ˈ ʃ eː ɾˠ
pimeantó	ˌ pʲ i mʲ ə nˠ ˈ t̪ˠ oː
pinc	ˈ pʲ i nʲ c
pingeáil	 pʲ i ˈ ɲ aː lʲ
pingin	ˈ pʲ i ɲ i nʲ
pinginí	ˈ pʲ i ɲ i nʲ iː
pinniúr	 pʲ i ˈ nʲ uː ɾˠ
pinsean	ˈ pʲ i nʲ ʃ ə nˠ
pinsin	ˈ pʲ i nʲ ʃ ə nʲ
pinsinéir	ˌ pʲ i nʲ ʃ ə ˈ nʲ eː ɾʲ
píob	ˈ pʲ iː bˠ
píobaigh	ˈ pʲ iː bˠ i ɟ
píobaireacht	ˈ pʲ iː bˠ ə ɾʲ ə x t̪ˠ
píobaithe	ˈ pʲ iː bˠ ə h ə
píobán	 pʲ iː ˈ bˠ aː nˠ
píobú	 pʲ iː ˈ bˠ uː
pioc	ˈ pʲ u k
píoca	ˈ pʲ iː k ə
piocadh	ˈ pʲ u k ə
piocaire	ˈ pʲ i k ə ɾʲ ə
piocóid	 pʲ i ˈ k oː dʲ
pioctha	ˈ pʲ i k h ə
piocuaran	 pʲ i ˈ k uˑə ɾˠ ə nˠ
pióg	 pʲ i ˈ oː ɡ
píoláf	 pʲ iː ˈ lˠ aː fˠ
piolla	ˈ pʲ i lˠ ə
piollaire	ˈ pʲ i lˠ ə ɾʲ ə
piolón	 pʲ i ˈ lˠ oː nˠ
píolóta	 pʲ iː ˈ lˠ oː t̪ˠ ə
píolótach	 pʲ iː ˈ lˠ oː t̪ˠ ə x
píolótaigh	 pʲ iː ˈ lˠ oː t̪ˠ i ɟ
píolótaithe	 pʲ iː ˈ lˠ oː t̪ˠ ə h ə
piongain	ˈ pʲ i ŋ ə nʲ
pionna	ˈ pʲ i nˠ ə
pionnliathróid	 pʲ u nʲ ˈ lʲ iˑə ɾ̥ˠ oː dʲ
pionnliathróide	 pʲ u nʲ ˈ lʲ iˑə ɾ̥ˠ oː dʲ ə
pionóis	 pʲ i ˈ nˠ oː ʃ
pionós	 pʲ i ˈ nˠ oː sˠ
pionósach	 pʲ i ˈ nˠ oː sˠ ə x
pionósaigh	 pʲ i ˈ nˠ oː sˠ i ɟ
pionsail	ˈ pʲ u nˠ sˠ ə lʲ
pionta	ˈ pʲ u nˠ t̪ˠ ə
píopa	ˈ pʲ iː pˠ ə
píopáil	 pʲ iː ˈ pˠ aː lʲ
píopáilte	 pʲ iː ˈ pˠ aː lʲ tʲ ə
píoráid	 pʲ iː ˈ ɾˠ aː dʲ
píoráideacht	 pʲ iː ˈ ɾˠ aː dʲ ə x t̪ˠ
píoráidigh	 pʲ iː ˈ ɾˠ aː dʲ i ɟ
píoráidithe	 pʲ iː ˈ ɾˠ aː dʲ ə h ə
piorra	ˈ pʲ i ɾˠ ə
píosa	ˈ pʲ iˑə sˠ ə
píotsa	ˈ pʲ iː t̪ˠ ə
piotútach	 pʲ i ˈ t̪ˠ uː t̪ˠ ə x
pipín	 pʲ i ˈ pʲ iː nʲ
pipíní	 pʲ i ˈ pʲ iː nʲ iː
píre	ˈ pʲ iː ɾʲ ə
pit	ˈ pʲ i tʲ
piteog	 pʲ i ˈ tʲ oː ɡ
piteogach	 pʲ i ˈ tʲ oː ɡ ə x
pits	ˈ pʲ i tʲ
pitseáil	 pʲ i ˈ tʲ aː lʲ
plá	ˈ pˠ lˠ aː
plab	ˈ pˠ lˠ a bˠ
plac	ˈ pˠ lˠ a k
placaint	ˈ pˠ lˠ a k ə nʲ tʲ
plaic	ˈ pˠ lˠ a c
plaicín	 pˠ lˠ a ˈ c iː nʲ
pláinéadach	 pˠ lˠ aː ˈ nʲ eː d̪ˠ ə x
plaisteach	 pˠ lˠ ə ʃ ˈ tʲ a x
plaistic	ˈ pˠ lˠ a ʃ tʲ ə c
pláitín	 pˠ lˠ aː ˈ tʲ iː nʲ
plána	ˈ pˠ lˠ aː nˠ ə
plánáil	 pˠ lˠ aː ˈ nˠ aː lʲ
planctóin	 pˠ lˠ au nˠ k ˈ t̪ˠ oː nʲ
planctón	 pˠ lˠ au nˠ k ˈ t̪ˠ oː nˠ
planda	ˈ pˠ lˠ a n̻ˠ d̪ˠ ə
plandáil	 pˠ lˠ a n̻ˠ ˈ d̪ˠ aː lʲ
plandú	 pˠ lˠ a n̻ˠ ˈ d̪ˠ uː
plandúil	 pˠ lˠ a n̻ˠ ˈ d̪ˠ uː lʲ
plantán	 pˠ lˠ au nˠ ˈ t̪ˠ aː nˠ
plapa	ˈ pˠ lˠ a pˠ ə
plás	ˈ pˠ lˠ aː sˠ
plásánta	 pˠ lˠ aː ˈ sˠ aː nˠ t̪ˠ ə
plásóg	 pˠ lˠ aː ˈ sˠ oː ɡ
plástar	ˈ pˠ lˠ aː sˠ t̪ˠ ə ɾˠ
pláta	ˈ pˠ lˠ aː t̪ˠ ə
plátáil	 pˠ lˠ aː ˈ t̪ˠ aː lʲ
plátáilte	 pˠ lˠ aː ˈ t̪ˠ aː lʲ tʲ ə
platanaim	ˈ pˠ lˠ a t̪ˠ ə nˠ ə mʲ
plátghloine	ˈ pˠ lˠ aː t̪ˠ ɣ lˠ ə nʲ ə
plé	ˈ pʲ lʲ eː
pléadáil	 pʲ lʲ eː ˈ d̪ˠ aː lʲ
plean	ˈ pʲ lʲ a nˠ
pleanáil	 pʲ lʲ a ˈ nˠ aː lʲ
pleanáilte	 pʲ lʲ a ˈ nˠ aː lʲ tʲ ə
pleanála	 pʲ lʲ a ˈ nˠ aː lˠ ə
pleananna	ˈ pʲ lʲ a nˠ ə nˠ ə
pléasc	ˈ pʲ lʲ eː sˠ k
pléascach	ˈ pʲ lʲ eː sˠ k ə x
pléascadh	ˈ pʲ lʲ eː sˠ k ə
pléascán	 pʲ lʲ eː sˠ ˈ k aː nˠ
pléasc-cheann	ˈ pʲ lʲ eː sˠ k ˈ ç au nˠ
pléascóg	 pʲ lʲ eː sˠ ˈ k oː ɡ
pléasctha	ˈ pʲ lʲ eː sˠ k h ə
pléatáil	 pʲ lʲ eː ˈ t̪ˠ aː lʲ
pleictream	ˈ pʲ lʲ e c tʲ ɾ̥ʲ ə mˠ
pléigh	ˈ pʲ lʲ eː j
pléisiúir	 pʲ lʲ eː ˈ ʃ uː ɾʲ
pléisiúr	 pʲ lʲ eː ˈ ʃ uː ɾˠ
pléisiúrtha	 pʲ lʲ eː ˈ ʃ uː ɾ̥ˠ ə
pleota	ˈ pʲ lʲ oː t̪ˠ ə
plépháipéar	 pʲ lʲ eː ˈ fˠ aː pʲ eː ɾˠ
plimp	ˈ pʲ lʲ i mʲ pʲ
plód	ˈ pˠ lˠ oː d̪ˠ
plódú	 pˠ lˠ oː ˈ d̪ˠ uː
plota	ˈ pˠ lˠ o t̪ˠ ə
pluais	ˈ pˠ lˠ uˑə ʃ
pluc	ˈ pˠ lˠ u k
plúch	ˈ pˠ lˠ uː x
plúchadh	ˈ pˠ lˠ uː x ə
plúchta	ˈ pˠ lˠ uː x t̪ˠ ə
pludgharda	ˈ pˠ lˠ u d̪ˠ ɣ ə ɾˠ d̪ˠ ə
pluid	ˈ pˠ lˠ i dʲ
plúir	ˈ pˠ lˠ uː ɾʲ
plúr	ˈ pˠ lˠ uː ɾˠ
plus	ˈ pˠ lˠ u sˠ
plútacratachas	ˈ pˠ lˠ uː t̪ˠ ə k ɾˠ ə t̪ˠ ə x ə sˠ
plútóiniam	 pˠ lˠ uː ˈ t̪ˠ oː nʲ iˑə mˠ
pó	ˈ pˠ oː
pobail	ˈ pˠ o bˠ ə lʲ
pobal	ˈ pˠ o bˠ ə lˠ
pobalbhreith	ˈ pˠ o bˠ ə lˠ ˈ vʲ ɾʲ e h
poblacht	ˈ pˠ o bˠ ə lˠ ə x t̪ˠ
Poblacht	ˈ pˠ o bˠ ə lˠ ə x t̪ˠ
poblachtach	ˈ pˠ o bˠ ə lˠ ə x t̪ˠ ə x
poblachtánach	ˈ pˠ o bˠ ə lˠ ə x t̪ˠ aː nˠ ə x
poc	ˈ pˠ o k
póca	ˈ pˠ oː k ə
pocáil	 pˠ o ˈ k aː lʲ
pócar	ˈ pˠ oː k ə ɾˠ
pocléim	 pˠ o ˈ c lʲ eː mʲ
póg	ˈ pˠ oː ɡ
poiblí	ˌ pˠ o bʲ ˈ lʲ iː
poiblíocht	ˌ pˠ o bʲ ə ˈ lʲ iˑə x t̪ˠ
poiblíochta	ˌ pˠ o bʲ ə ˈ lʲ iˑə x t̪ˠ ə
póigín	 pˠ oː ˈ ɟ iː nʲ
poileanta	ˈ pˠ o lʲ ə nˠ t̪ˠ ə
poileistear	ˈ pˠ o lʲ ə ʃ tʲ ə ɾˠ
póilín	 pˠ oː ˈ lʲ iː nʲ
póilíní	ˈ pˠ oː ˈ lʲ iː nʲ iː
póilió	ˌ pˠ oː lʲ i ˈ oː
pointe	ˈ pˠ iː nʲ tʲ ə
pointeáil	 pˠ iː nʲ ˈ tʲ aː lʲ
pointeáilte	 pˠ o nʲ ˈ tʲ aː lʲ tʲ ə
poircealláin	ˌ pˠ o ɾʲ c ə ˈ lˠ aː nʲ
poirceallán	ˌ pˠ o ɾʲ c ə ˈ lˠ aː nˠ
póirseáil	 pˠ oː ɾʲ ˈ ʃ aː lʲ
póirtéir	 pˠ oː ɾˠ ˈ tʲ eː ɾʲ
poist	ˈ pˠ o ʃ tʲ
poitéinseal	 pˠ o ˈ tʲ eː nʲ ʃ ə lˠ
poitéinsiúil	 pˠ o ˈ tʲ eː nʲ ʃ uː lʲ
poitigéara	ˌ pˠ o tʲ ə ˈ ɟ eː ɾˠ ə
poitigéir	ˌ pˠ o tʲ ə ˈ ɟ eː ɾʲ
polaiméir	ˌ pˠ o lˠ ə ˈ mʲ eː ɾʲ
Polainéis	ˌ pˠ o lˠ ə ˈ nʲ eː ʃ
Polainéiseach	ˌ pˠ o lˠ ə ˈ nʲ eː ʃ ə x
Polainnis	ˈ pˠ o lˠ ə nʲ ə ʃ
Polainnise	ˈ pˠ o lˠ ə nʲ ə ʃ ə
polaitéin	ˌ pˠ o lˠ ə ˈ tʲ eː nʲ
polaiteoir	ˌ pˠ o lˠ ə ˈ tʲ oː ɾʲ
polaitíochta	ˌ pˠ o lˠ ə ˈ tʲ iˑə x t̪ˠ ə
polaitiúil	ˌ pˠ o lˠ ə ˈ tʲ uː lʲ
polamorfach	ˈ pˠ o lˠ ə mˠ ə ɾˠ fˠ ə x
polanáis	ˌ pˠ o lˠ ə ˈ nˠ aː ʃ
polandras	ˈ pˠ o lˠ ə n̻ˠ d̪ˠ ɾˠ ə sˠ
Polannach	ˈ pˠ o lˠ ə nˠ ə x
polasaí	ˌ pˠ o lˠ ə ˈ sˠ iː
poll	ˈ pˠ au lˠ
pollta	ˈ pˠ au lˠ t̪ˠ ə
póna	ˈ pˠ oː nˠ ə
pónaire	ˈ pˠ oː nˠ ə ɾʲ ə
pónairí	ˈ pˠ oː nˠ ə ɾʲ iː
pónaithe	ˈ pˠ oː nˠ ə h ə
ponc	ˈ pˠ o ŋ k
poncaigh	ˈ pˠ o nˠ k i ɟ
poncaithe	ˈ pˠ o nˠ k ə h ə
pór	ˈ pˠ oː ɾˠ
póraigh	ˈ pˠ oː ɾˠ i ɟ
póraitheoir	ˈ pˠ oː ɾˠ ə h oː ɾʲ
pórc	ˈ pˠ oː ɾˠ k
port	ˈ pˠ o ɾˠ t̪ˠ
Port	ˈ pˠ o ɾˠ t̪ˠ
Portaingéalach	ˌ pˠ o ɾˠ t̪ˠ ə ˈ ɲ eː lˠ ə x
pórtar	ˈ pˠ oː ɾˠ t̪ˠ ə ɾˠ
pórtheastas	ˈ pˠ oː ɾ̥ʲ ə sˠ t̪ˠ ə sˠ
Pórtó	 pˠ oː ɾˠ ˈ t̪ˠ oː
portráid	 pˠ o ɾˠ ˈ t̪ˠ ɾˠ aː dʲ
portráidí	 pˠ o ɾˠ ˈ t̪ˠ ɾˠ aː dʲ iː
portráidíocht	 pˠ o ɾˠ ˈ t̪ˠ ɾˠ aː dʲ iˑə x t̪ˠ
pórúcháin	 pˠ oː ˈ ɾˠ uː x aː nʲ
pós	ˈ pˠ oː sˠ
pósadh	ˈ pˠ oː sˠ ə
posatrón	ˌ pˠ o sˠ ə ˈ t̪ˠ ɾ̥ˠ oː nˠ
post	ˈ pˠ o sˠ t̪ˠ
pósta	ˈ pˠ oː sˠ t̪ˠ ə
póstaer	 pˠ oː sˠ ˈ t̪ˠ eː ɾˠ
postaigh	ˈ pˠ o sˠ t̪ˠ i ɟ
postáil	 pˠ o sˠ ˈ t̪ˠ aː lʲ
postálaí	 pˠ o sˠ ˈ t̪ˠ aː lˠ iː
postas	ˈ pˠ o sˠ t̪ˠ ə sˠ
postíoctha	 pˠ o ʃ ˈ tʲ iˑə k h ə
postroinnt	ˈ pˠ o sˠ t̪ˠ ɾ̥ˠ ə nʲ tʲ
postú	 pˠ o sˠ ˈ t̪ˠ uː
postúil	 pˠ o sˠ ˈ t̪ˠ uː lʲ
pota	ˈ pˠ o t̪ˠ ə
pótaire	ˈ pˠ oː t̪ˠ ə ɾʲ ə
potaireacht	ˈ pˠ o t̪ˠ ə ɾʲ ə x t̪ˠ
potaireachta	ˈ pˠ o t̪ˠ ə ɾʲ ə x t̪ˠ ə
potaisiam	ˌ pˠ o t̪ˠ ə ˈ ʃ iˑə mˠ
potaithe	ˈ pˠ o t̪ˠ ə h ə
prácás	 pˠ ɾˠ aː ˈ k aː sˠ
praghais	ˈ pˠ ɾˠ ai ə ʃ
praghas	ˈ pˠ ɾˠ ai sˠ
praghsáil	 pˠ ɾˠ ai ˈ sˠ aː lʲ
pragmatach	ˈ pˠ ɾˠ a ɡ mˠ ə t̪ˠ ə x
práinn	ˈ pˠ ɾˠ aː nʲ
práinne	ˈ pˠ ɾˠ aː nʲ ə
práinneach	ˈ pˠ ɾˠ aː nʲ ə x
práis	ˈ pˠ ɾˠ aː ʃ
práisc	ˈ pˠ ɾˠ aː ʃ c
praiseach	 pˠ ɾˠ ə ˈ ʃ a x
praiticiúil	ˌ pˠ ɾˠ a tʲ ə ˈ c uː lʲ
pras	ˈ pˠ ɾˠ a sˠ
práta	ˈ pˠ ɾˠ aː t̪ˠ ə
prátaí	 pˠ ɾˠ aː ˈ t̪ˠ iː
preab	ˈ pʲ ɾʲ a bˠ
preabadh	ˈ pʲ ɾʲ a bˠ ə
preabaire	ˈ pʲ ɾˠ a bˠ ə ɾʲ ə
preabthosaigh	ˈ pʲ ɾʲ a bˠ ˈ h o sˠ i ɟ
preabthosú	ˈ pʲ ɾʲ a bˠ h o ˈ sˠ uː
préachta	ˈ pʲ ɾʲ eː x t̪ˠ ə
preas	ˈ pʲ ɾʲ a sˠ
preasagallamh	ˈ pʲ ɾʲ a sˠ ə ɡ ə lˠ ə vˠ
preasáil	 pʲ ɾʲ a ˈ sˠ aː lʲ
preaseisiúint	ˌ pʲ ɾʲ a ʃ ə ˈ ʃ uː nʲ tʲ
preasócáid	 pʲ ɾʲ a ˈ sˠ oː k aː dʲ
preasoifig	ˈ pʲ ɾʲ a sˠ ə fʲ ə ɟ
preasráiteas	 pʲ ɾʲ a ˈ sˠ ɾˠ aː tʲ ə sˠ
preibind	ˈ pʲ ɾʲ e bʲ ə nʲ dʲ
preibindire	ˈ pʲ ɾʲ e bʲ ə nʲ dʲ ə ɾʲ ə
preideacáideach	ˌ pʲ ɾʲ e dʲ ə ˈ k aː dʲ ə x
preispitéir	ˌ pʲ ɾʲ e sˠ pʲ ə ˈ tʲ eː ɾʲ
Preispitéireach	ˌ pʲ ɾʲ e sˠ pʲ ə ˈ tʲ eː ɾʲ ə x
priacal	ˈ pʲ ɾʲ iˑə k ə lˠ
prímeáil	 pʲ ɾʲ iː ˈ mʲ aː lʲ
prímeáilte	 pʲ ɾʲ iː ˈ mʲ aː lʲ tʲ ə
printéir	 pʲ ɾʲ i nʲ ˈ tʲ eː ɾʲ
printíseach	 pʲ ɾʲ i nʲ ˈ tʲ iː ʃ ə x
printíseacht	 pʲ ɾʲ i nʲ ˈ tʲ iː ʃ ə x t̪ˠ
printíseachta	 pʲ ɾʲ i nʲ ˈ tʲ iː ʃ ə x t̪ˠ ə
príobháideach	 pʲ ɾʲ iː ˈ vˠ aː dʲ ə x
prioc	ˈ pʲ ɾʲ i k
priocadh	ˈ pʲ ɾ̥ʲ u k ə
príomh	ˈ pʲ ɾʲ iː vˠ
príomha	ˈ pʲ ɾˠ iː vˠ ə
príomhábhar	ˈ pʲ ɾʲ iː ˈ vˠ aː vˠ ə ɾˠ
príomhach	ˈ pʲ ɾˠ iː vˠ ə x
príomhaí	 pʲ ɾʲ iː ˈ vˠ iː
príomháidh	ˈ pʲ ɾʲ iː ˈ vˠ aː j
príomh-aire	ˈ pʲ ɾʲ iː ˈ vˠ a ɾʲ ə
príomhalt	ˈ pʲ ɾʲ iː ˈ vˠ a lˠ t̪ˠ
príomh-am	ˈ pʲ ɾʲ iː ˈ vˠ au mˠ
príomhaturnae	ˈ pʲ ɾʲ iː ˌ vˠ a t̪ˠ ə ɾˠ ˈ nˠ eː
príomhbhairr	ˈ pʲ ɾʲ iː ˈ vˠ a ɾʲ
príomhbhóthar	ˈ pʲ ɾʲ iː ˈ vˠ oː h ə ɾˠ
Príomh-Bhreitheamh	ˈ pʲ ɾʲ iː ˈ vʲ ɾˠ e h ə vˠ
príomhchábla	ˈ pʲ ɾʲ iː vˠ ˈ x aː bˠ lˠ ə
príomhcharachtar	ˈ pʲ ɾʲ iː vˠ x ə ˈ ɾˠ a x t̪ˠ ə ɾˠ
príomhchathair	ˈ pʲ ɾʲ iˑə vˠ ˌ x a h ə ɾʲ
príomhchigire	ˈ pʲ ɾʲ iː vˠ ˈ ç i ɟ ə ɾʲ ə
príomhchinnire	ˈ pʲ ɾʲ iː vˠ ˈ ç i nʲ ə ɾʲ ə
príomhchleite	ˈ pʲ ɾʲ iː vˠ ˈ ç lʲ e tʲ ə
príomhchonstábla	ˈ pʲ ɾʲ iː vˠ x o nˠ sˠ ˈ t̪ˠ aː bˠ lˠ ə
príomhchúram	ˈ pʲ ɾʲ iː vˠ ˈ x uː ɾˠ ə mˠ
príomhchúrsa	ˈ pʲ ɾʲ iː vˠ ˈ x uː ɾˠ sˠ ə
príomhfheidhmeannach	ˈ pʲ ɾʲ iː ˈ vˠ ai mʲ ə nˠ ə x
príomhghiúróir	ˈ pʲ ɾʲ iː vˠ j uː ˈ ɾˠ oː ɾʲ
príomhghrúpa	ˈ pʲ ɾʲ iː vˠ ˈ ɣ ɾˠ uː pˠ ə
príomhláithreoir	ˈ pʲ ɾʲ iː vˠ lˠ aː ˈ ɾ̥ʲ oː ɾʲ
príomhlíne	ˈ pʲ ɾʲ iː vˠ ˈ lʲ iː nʲ ə
príomhlíonra	ˈ pʲ ɾʲ iː vˠ ˈ lʲ iː nˠ ɾˠ ə
príomh-mhír	ˈ pʲ ɾʲ iː ˈ vʲ iː ɾʲ
príomhnóta	ˈ pʲ ɾʲ iː vˠ ˈ nˠ oː t̪ˠ ə
príomhoide	ˈ pʲ ɾʲ iː ˈ vˠ o dʲ ə
príomhoifigeach	ˈ pʲ ɾʲ iː ˈ vˠ o fʲ ə ɟ ə x
príomhpháirt	ˈ pʲ ɾʲ iː vˠ ˈ fˠ aː ɾˠ tʲ
príomhscannán	ˈ pʲ ɾʲ iː vˠ sˠ k a ˈ nˠ aː nˠ
príomhscéal	ˈ pʲ ɾʲ iː vˠ ˈ ʃ c iˑə lˠ
príomhshráid	ˈ pʲ ɾʲ iː vˠ ˈ ɾ̥ˠ aː dʲ
príomhshuim	ˈ pʲ ɾʲ iː vˠ ˈ h iː mʲ
príomhúil	 pʲ ɾˠ iː ˈ vˠ uː lʲ
príomhveidhleadóir	ˈ pʲ ɾʲ iː ˌ vʲ ai lʲ ə ˈ d̪ˠ oː ɾʲ
priompallán	ˌ pʲ ɾʲ i mˠ pˠ ə ˈ lˠ aː nˠ
prionsabal	ˈ pʲ ɾʲ u nˠ sˠ ə bˠ ə lˠ
prionsabáltacht	ˌ pʲ ɾʲ u nˠ sˠ ə ˈ bˠ aː lˠ t̪ˠ ə x t̪ˠ
prionta	ˈ pʲ ɾʲ u nˠ t̪ˠ ə
priontáil	 pʲ ɾʲ u nˠ ˈ t̪ˠ aː lʲ
priontáilte	 pʲ ɾʲ u nˠ ˈ t̪ˠ aː lʲ tʲ ə
prios	ˈ pʲ ɾʲ i sˠ
príosúin	 pʲ ɾʲ iː ˈ sˠ uː nʲ
príosún	ˈ pʲ ɾʲ iː ˈ sˠ uː nˠ
príosúnach	 pʲ ɾʲ iː ˈ sˠ uː nˠ ə x
príosúnacht	 pʲ ɾʲ iː ˈ sˠ uː nˠ ə x t̪ˠ
próca	ˈ pˠ ɾˠ oː k ə
prochóg	 pˠ ɾˠ o ˈ x oː ɡ
profa	ˈ pˠ ɾˠ o fˠ ə
profaigh	ˈ pˠ ɾˠ o fˠ i ɟ
profáil	 pˠ ɾˠ o ˈ fˠ aː lʲ
profú	 pˠ ɾˠ o ˈ fˠ uː
Proibhinseach	ˈ pˠ ɾˠ o vʲ ə nʲ ʃ ə x
proifisiúnta	ˌ pˠ ɾˠ o fʲ ə ˈ ʃ uː nˠ t̪ˠ ə
proinn	ˈ pˠ ɾˠ iː nʲ
proinnteach	ˈ pˠ ɾˠ iː nʲ tʲ ə x
Proinsiasach	 pˠ ɾˠ o nʲ ˈ ʃ iˑə sˠ ə x
próis	ˈ pˠ ɾˠ oː ʃ
próiseáil	 pˠ ɾˠ oː ˈ ʃ aː lʲ
próiseas	ˈ pˠ ɾˠ oː ʃ ə sˠ
próitéin	 pˠ ɾˠ oː ˈ tʲ eː nʲ
prólatáireach	ˈ pˠ ɾˠ oː lˠ ə t̪ˠ aː ɾʲ ə x
prólatáireacht	ˈ pˠ ɾˠ oː lˠ ə t̪ˠ aː ɾʲ ə x t̪ˠ
promanád	ˌ pˠ ɾˠ o mˠ ə ˈ nˠ aː d̪ˠ
promanáid	ˌ pˠ ɾˠ o mˠ ə ˈ nˠ aː dʲ
promhadh	ˈ pˠ ɾˠ uː ə
propast	ˈ pˠ ɾˠ o pˠ ə sˠ t̪ˠ
próstatach	ˈ pˠ ɾˠ oː sˠ t̪ˠ ə t̪ˠ ə x
próstataigh	ˈ pˠ ɾˠ oː sˠ t̪ˠ ə t̪ˠ i ɟ
prótacal	ˈ pˠ ɾˠ oː t̪ˠ ə k ə lˠ
Protastúnach	ˌ pˠ ɾˠ o t̪ˠ ə sˠ ˈ t̪ˠ uː nˠ ə x
prótón	 pˠ ɾˠ oː ˈ t̪ˠ oː nˠ
Prúiseach	ˈ pˠ ɾˠ uː ʃ ə x
pub	ˈ pˠ u bˠ
púdar	ˈ pˠ uː d̪ˠ ə ɾˠ
puilpid	ˈ pˠ i lʲ pʲ ə dʲ
Puinseábach	 pˠ i nʲ ˈ ʃ aː bˠ ə x
puint	ˈ pˠ uː nʲ tʲ
puipéad	 pˠ i ˈ pʲ eː d̪ˠ
puipéadóireacht	 pˠ i ˈ pʲ eː d̪ˠ oː ɾʲ ə x t̪ˠ
púir	ˈ pˠ uː ɾʲ
púl	ˈ pˠ uː lˠ
pulc	ˈ pˠ u lˠ k
pumpa	ˈ pˠ u mˠ pˠ ə
pumpáil	ˈ pˠ u mˠ ˈ pˠ aː lʲ
Púnach	ˈ pˠ uː nˠ ə x
punann	ˈ pˠ u nˠ ə nˠ
punt	ˈ pˠ uː nˠ t̪ˠ
púróg	 pˠ uː ˈ ɾˠ oː ɡ
pus	ˈ pˠ u sˠ
puth	ˈ pˠ u h
putóga	 pˠ u ˈ t̪ˠ oː ɡ ə
puzal	ˈ pˠ u ə lˠ
Q	ˈ c uː
R	ˈ aː ɾˠ
RA	ˈ aː ɾˠ ə
rá	ˈ ɾˠ aː
rabhadh	ˈ ɾˠ au ə
rabhaidh	ˈ ɾˠ au j
rabhait	ˈ ɾˠ au ə tʲ
rabharta	ˈ ɾˠ au ɾˠ t̪ˠ ə
rabhláil	 ɾˠ au ˈ lˠ aː lʲ
rabhnáilte	 ɾˠ au ˈ nˠ aː lʲ tʲ ə
rac	ˈ ɾˠ a k
raca	ˈ ɾˠ a k ə
racán	 ɾˠ a ˈ k aː nˠ
rac-cheoil	ˈ ɾˠ a k ˈ ç oː lʲ
rac-cheol	ˈ ɾˠ a k ˈ ç oː lˠ
ráchairt	ˈ ɾˠ aː x ə ɾˠ tʲ
rachmais	ˈ ɾˠ a x mˠ ə ʃ
rachmasach	ˈ ɾˠ a x mˠ ə sˠ ə x
racht	ˈ ɾˠ a x t̪ˠ
rad	ˈ ɾˠ a d̪ˠ
radagraf	ˈ ɾˠ a d̪ˠ ə ɡ ɾˠ ə fˠ
radaighníomhach	ˌ ɾˠ a d̪ˠ i ˈ ɟ nʲ iˑə vˠ ə x
radaíocht	 ɾˠ a ˈ d̪ˠ iˑə x t̪ˠ
radaiteiripe	ˈ ɾˠ a d̪ˠ ə tʲ ə ɾʲ ə pʲ ə
radar	ˈ ɾˠ a d̪ˠ ə ɾˠ
radharc	ˈ ɾˠ ai ɾˠ k
radharcra	ˈ ɾˠ ai ɾˠ k ɾˠ ə
ráfla	ˈ ɾˠ aː fˠ lˠ ə
ragús	 ɾˠ a ˈ ɡ uː sˠ
ragúsach	 ɾˠ a ˈ ɡ uː sˠ ə x
ráib	ˈ ɾˠ aː bʲ
ráibeáil	 ɾˠ aː ˈ bʲ aː lʲ
raibh	ˈ ɾˠ e vʲ
raic	ˈ ɾˠ a c
raicleach	 ɾˠ ə ˈ c lʲ a x
raideolaíocht	 ɾˠ a ˈ dʲ oː lˠ iˑə x t̪ˠ
raidhfil	ˈ ɾˠ ai fʲ ə lʲ
raidhse	ˈ ɾˠ ai ʃ ə
raidió	ˌ ɾˠ a dʲ i ˈ oː
ráig	ˈ ɾˠ aː ɟ
ráigiúil	 ɾˠ aː ˈ ɟ uː lʲ
railí	 ɾˠ a ˈ lʲ iː
ráille	ˈ ɾˠ aː lʲ ə
raiméis	ˈ ɾˠ aː mʲ eː ʃ
ráinigh	ˈ ɾˠ aː nʲ i ɟ
rainse	ˈ ɾˠ a nʲ ʃ ə
ráiteas	ˈ ɾˠ aː tʲ ə sˠ
ráithe	ˈ ɾˠ aː h ə
raithneach	ˈ ɾˠ a nʲ ə x
rámha	ˈ ɾˠ aː
rámhaí	 ɾˠ aː ˈ vˠ iː
rámhaigh	ˈ ɾˠ aː vˠ i ɟ
rámhaíochta	 ɾˠ aː ˈ vˠ iˑə x t̪ˠ ə
ramhar	ˈ ɾˠ au ɾˠ
ramhraigh	ˈ ɾˠ au ɾˠ i ɟ
rampaireachta	ˈ ɾˠ a mˠ pˠ ə ɾʲ ə x t̪ˠ ə
rang	ˈ ɾˠ au ŋ ɡ
ranga	ˈ ɾˠ a ŋ ə
rangaigh	ˈ ɾˠ a ŋ i ɟ
rangaithe	ˈ ɾˠ a ŋ ə h ə
rann	ˈ ɾˠ au nˠ
rannach	 ɾˠ ə ˈ nˠ a x
rannán	 ɾˠ a ˈ nˠ aː nˠ
ranníocaíocht	ˈ ɾˠ au nˠ iː ˈ k iˑə x t̪ˠ
rannóg	 ɾˠ a ˈ nˠ oː ɡ
rannpháirtí	ˈ ɾˠ au nˠ fˠ aː ɾˠ ˈ tʲ iː
ransaigh	ˈ ɾˠ au nˠ sˠ i ɟ
ransaitheoir	ˈ ɾˠ au nˠ sˠ ə h oː ɾʲ
ransú	 ɾˠ au nˠ ˈ sˠ uː
raon	ˈ ɾˠ eː nˠ
rap	ˈ ɾˠ a pˠ
raptór	 ɾˠ a pˠ ˈ t̪ˠ oː ɾˠ
rás	ˈ ɾˠ aː sˠ
rása	ˈ ɾˠ aː sˠ ə
rásaí	 ɾˠ aː ˈ sˠ iː
rásáil	 ɾˠ aː ˈ sˠ aː lʲ
rásaíocht	 ɾˠ aː ˈ sˠ iˑə x t̪ˠ
rásaíochta	 ɾˠ aː ˈ sˠ iˑə x t̪ˠ ə
ráschúrsa	 ɾˠ aː sˠ ˈ x uː ɾˠ sˠ ə
rásnathair	ˈ ɾˠ aː sˠ nˠ ə h ə ɾʲ
Rastafárach	ˌ ɾˠ a sˠ t̪ˠ ə ˈ fˠ aː ɾˠ ə x
ráta	ˈ ɾˠ aː t̪ˠ ə
rátaí	 ɾˠ aː ˈ t̪ˠ iː
rátáil	 ɾˠ aː ˈ t̪ˠ aː lʲ
ráth	ˈ ɾˠ aː
rath	ˈ ɾˠ a h
ráthaigh	ˈ ɾˠ aː h i ɟ
ráthaíocht	 ɾˠ aː ˈ h iˑə x t̪ˠ
ráthaithe	ˈ ɾˠ aː h ə h ə
rathúil	 ɾˠ a ˈ h uː lʲ
rathúlacht	 ɾˠ a ˈ h uː lˠ ə x t̪ˠ
ré	ˈ ɾˠ eː
réab	ˈ ɾˠ eː bˠ
réabadh	ˈ ɾˠ eː bˠ ə
réabhlóid	 ɾˠ eː ˈ vˠ lˠ oː dʲ
reáchtáil	 ɾˠ aː x ˈ t̪ˠ aː lʲ
reachtaíocht	 ɾˠ a x ˈ t̪ˠ iˑə x t̪ˠ
reachtaire	ˈ ɾˠ a x t̪ˠ ə ɾʲ ə
reachtas	ˈ ɾˠ a x t̪ˠ ə sˠ
reachtóir	 ɾˠ a x ˈ t̪ˠ oː ɾʲ
reachtú	 ɾˠ a x ˈ t̪ˠ uː
réad	ˈ ɾˠ eː d̪ˠ
réadach	ˈ ɾˠ eː d̪ˠ ə x
réadaigh	ˈ ɾˠ eː d̪ˠ i ɟ
réadlann	ˈ ɾˠ eː d̪ˠ lˠ ə nˠ
réadmhaoin	 ɾˠ eː d̪ˠ ˈ vˠ iː nʲ
réadmhaoine	 ɾˠ eː d̪ˠ ˈ vˠ iː nʲ ə
réaduchtach	ˈ ɾˠ eː d̪ˠ ə x t̪ˠ ə x
réaduchtaí	ˈ ɾˠ eː d̪ˠ ə x t̪ˠ iː
réadúil	 ɾˠ eː ˈ d̪ˠ uː lʲ
réal	ˈ ɾˠ eː lˠ
réaladh	ˈ ɾˠ eː lˠ ə
réalaigh	ˈ ɾˠ eː lˠ i ɟ
réalaíoch	 ɾˠ eː ˈ lˠ iˑə x
réalóir	 ɾˠ eː ˈ lˠ oː ɾʲ
réalta	ˈ ɾˠ eː lˠ t̪ˠ ə
réaltacht	ˈ ɾˠ eː lˠ t̪ˠ ə x t̪ˠ
réaltaí	 ɾˠ eː lˠ ˈ t̪ˠ iː
réaltchomhartha	ˈ ɾˠ eː lˠ t̪ˠ ˈ x oː ɾ̥ˠ ə
réamatóideach	ˈ ɾˠ eː mˠ ə t̪ˠ oː dʲ ə x
réamh	ˈ ɾˠ eː vˠ
réamhaclaíocht	ˈ ɾˠ eː vˠ a ˈ k lˠ iˑə x t̪ˠ
réamhaisnéis	ˈ ɾˠ eː ˈ vˠ a ʃ ˈ nʲ eː ʃ
réamhbhabhta	ˈ ɾˠ eː ˈ vˠ au t̪ˠ ə
réamhbheartaithe	ˈ ɾˠ eː ˈ vʲ a ɾˠ t̪ˠ ə h ə
réamhbhreithe	ˈ ɾˠ eː ˈ vʲ ɾʲ e h ə
réamhchantóir	ˈ ɾˠ eː vˠ x au nˠ ˈ t̪ˠ oː ɾʲ
réamhchlaonadh	ˈ ɾˠ eː vˠ ˈ x lˠ eː nˠ ə
réamhchleachtadh	ˈ ɾˠ eː vˠ ˈ ç lʲ a x t̪ˠ ə
réamhchliniciúil	ˈ ɾˠ eː vˠ ˌ ç lʲ i nʲ ə ˈ c uː lʲ
réamhchluiche	ˈ ɾˠ eː vˠ ˈ x lˠ i h ə
réamhchógas	ˈ ɾˠ eː vˠ ˈ x oː ɡ ə sˠ
réamhdhéanta	ˈ ɾˠ eː vˠ ˈ j iˑə nˠ t̪ˠ ə
réamhdhéantán	ˈ ɾˠ eː vˠ j eː nˠ ˈ t̪ˠ aː nˠ
réamhdheochanna	ˈ ɾˠ eː vˠ ˈ j oː x ə nˠ ə
réamheolaire	ˈ ɾˠ eː ˈ vˠ oː lˠ ə ɾʲ ə
réamhfhoclach	ˈ ɾˠ eː vˠ o ˈ k lˠ a x
réamhíocaíocht	ˈ ɾˠ eː vˠ iː ˈ k iˑə x t̪ˠ
réamhléiriú	ˈ ɾˠ eː vˠ lʲ eː ˈ ɾʲ uː
réamh-mheas	ˈ ɾˠ eː ˈ vʲ a sˠ
réamh-mheasta	ˈ ɾˠ eː ˈ vʲ a sˠ t̪ˠ ə
réamh-mheastachán	ˈ ɾˠ eː ˌ vʲ a sˠ t̪ˠ ə ˈ x aː nˠ
réamhól	ˈ ɾˠ eː ˈ vˠ oː lˠ
réamhscoil	ˈ ɾˠ eː vˠ ˈ sˠ k e lʲ
réamhscoile	ˈ ɾˠ eː vˠ ˈ sˠ k e lʲ ə
réamhscolaíochta	ˈ ɾˠ eː vˠ sˠ k o ˈ lˠ iˑə x t̪ˠ ə
réamhshéasúir	ˈ ɾˠ eː vˠ h eː ˈ sˠ uː ɾʲ
réamhshéasúr	ˈ ɾˠ eː vˠ h eː ˈ sˠ uː ɾˠ
réamhshocraithe	ˈ ɾˠ eː vˠ ˈ h o ˈ k ɾˠ a h ə
réamhstairiúil	ˈ ɾˠ eː vˠ sˠ t̪ˠ a ˈ ɾʲ uː lʲ
réamhtheachtaí	ˈ ɾˠ eː vˠ h a x ˈ t̪ˠ iː
réamhthosaigh	ˈ ɾˠ eː vˠ ˈ h o sˠ i ɟ
réasún	 ɾˠ eː ˈ sˠ uː nˠ
réasúnach	 ɾˠ eː ˈ sˠ uː nˠ ə x
réasúnaigh	 ɾˠ eː ˈ sˠ uː nˠ i ɟ
réasúnaíocht	 ɾˠ eː ˈ sˠ uː nˠ iˑə x t̪ˠ
réasúnta	 ɾˠ eː ˈ sˠ uː nˠ t̪ˠ ə
réasúnú	 ɾˠ eː ˈ sˠ uː nˠ uː
reatha	ˈ ɾˠ a h ə
réchas	ˈ ɾˠ eː x ə sˠ
réchúis	 ɾˠ eː ˈ x uː ʃ
réchúiseach	 ɾˠ eː ˈ x uː ʃ ə x
reibiliúnach	ˌ ɾˠ e bʲ ə ˈ lʲ uː nˠ ə x
reic	ˈ ɾˠ e c
réidh	ˈ ɾˠ eː ɟ
reifreann	ˈ ɾˠ e fʲ ɾʲ ə nˠ
reigé	 ɾˠ e ˈ ɟ eː
réigiún	 ɾˠ eː ˈ ɟ uː nˠ
réigiúnach	 ɾˠ eː ˈ ɟ uː nˠ ə x
réigiúnaí	 ɾˠ eː ˈ ɟ uː nˠ iː
réigiúnaíoch	 ɾˠ eː ˈ ɟ uː nˠ iˑə x
réileán	 ɾˠ eː ˈ lʲ aː nˠ
reilig	ˈ ɾˠ e lʲ ə ɟ
reilige	ˈ ɾˠ e lʲ ə ɟ ə
reiligiúin	ˌ ɾˠ e lʲ ə ˈ ɟ uː nʲ
reiligiún	ˌ ɾˠ e lʲ ə ˈ ɟ uː nˠ
reiligiúnach	ˌ ɾˠ e lʲ ə ˈ ɟ uː nˠ ə x
