á	ˈ aː
feidhmiú	 fʲ ai ˈ mʲ uː
feidhmiúcháin	 fʲ ai ˈ mʲ uː x aː nʲ
feidhmiúil	 fʲ ai ˈ mʲ uː lʲ
feidhmiúlach	 fʲ ai ˈ mʲ uː lˠ ə x
feidhmiúlacht	 fʲ ai ˈ mʲ uː lˠ ə x t̪ˠ
feighlí	ˌ fʲ ai ˈ lʲ iː
feil	ˈ fʲ e lʲ
féile	ˈ fʲ eː lʲ ə
féileacán	ˈ fʲ eː lʲ ə k aː nˠ
feileastram	ˈ fʲ e lʲ ə sˠ t̪ˠ ɾˠ ə mˠ
feileon	 fʲ e ˈ lʲ oː nˠ
feileonacht	 fʲ e ˈ lʲ oː nˠ ə x t̪ˠ
féilire	ˈ fʲ eː lʲ ə ɾʲ ə
feiliúnach	 fʲ e ˈ lʲ uː nˠ ə x
feimineach	ˈ fʲ e mʲ ə nʲ ə x
féin	ˈ fʲ eː nʲ
féinbhranda	ˈ fʲ eː nʲ ˈ vˠ ɾˠ au nˠ d̪ˠ ə
féincheartú	ˈ fʲ eː nʲ ç a ɾˠ ˈ t̪ˠ uː
féinchúis	ˈ fʲ eː nʲ ˈ x uː ʃ
féindochar	ˈ fʲ eː nʲ ˈ d̪ˠ o x ə ɾˠ
féinfhostaíocht	ˈ fʲ eː nʲ o sˠ ˈ t̪ˠ iˑə x t̪ˠ
féinfhostaithe	ˈ fʲ eː ˈ nʲ o sˠ t̪ˠ ə h ə
féinfhreastal	ˈ fʲ eː nʲ ˈ ɾʲ a sˠ t̪ˠ ə lˠ
féinghraf	ˈ fʲ eː nʲ ˈ ɣ ɾˠ a fˠ
Féiníceach	ˈ fʲ eː ˈ nʲ iː c ə x
féiníomhá	ˈ fʲ eː nʲ iː ˈ vˠ aː
féinmhachnamh	ˈ fʲ eː nʲ ˈ vˠ a x nˠ ə vˠ
féinmharú	ˈ fʲ eː nʲ vˠ a ˈ ɾˠ uː
féinmheasúnú	ˈ fʲ eː nʲ vʲ a ˈ sˠ uː nˠ uː
féinmhuinín	ˈ fʲ eː nʲ vˠ i ˈ nʲ iː nʲ
féinphic	ˈ fʲ eː nʲ ˈ fʲ i c
féinrialúchán	ˈ fʲ eː nʲ ɾˠ iˑə ˈ lˠ uː x aː nˠ
féinscrúdú	ˈ fʲ eː nʲ ˈ sˠ k ɾˠ uː ˈ d̪ˠ uː
féinseirbhís	ˈ fʲ eː nʲ ˌ ʃ e ɾʲ ə ˈ vʲ iː ʃ
féinsmacht	ˈ fʲ eː nʲ ˈ sˠ mˠ a x t̪ˠ
féir	ˈ fʲ eː ɾʲ
feirbín	ˌ fʲ e ɾʲ ə ˈ bʲ iː nʲ
féirín	 fʲ eː ˈ ɾʲ iː nʲ
feirm	ˈ fʲ e ɾʲ ə mʲ
feirme	ˈ fʲ e ɾʲ ə mʲ ə
feirmeoir	ˌ fʲ e ɾʲ ə ˈ mʲ oː ɾʲ
feirmeoireacht	ˌ fʲ e ɾʲ ə ˈ mʲ oː ɾʲ ə x t̪ˠ
Feisire	ˈ fʲ e ʃ ə ɾʲ ə
feisteas	ˈ fʲ e ʃ tʲ ə sˠ
feisteoir	 fʲ e ʃ ˈ tʲ oː ɾʲ
feistigh	ˈ fʲ e ʃ tʲ i ɟ
feistiú	 fʲ e ʃ ˈ tʲ uː
féith	ˈ fʲ eː
feitheamh	ˈ fʲ e h ə vˠ
féitheogach	 fʲ eː ˈ h oː ɡ ə x
feithicil	ˈ fʲ e h ə c ə lʲ
feithid	ˈ fʲ e h ə dʲ
feithimh	ˈ fʲ e h ə vʲ
feo	ˈ fʲ oː
feoigh	ˈ fʲ oː j
feoil	ˈ fʲ oː lʲ
feothan	ˈ fʲ oː h ə nˠ
fhad	ˈ a d̪ˠ
fháil	ˈ aː lʲ
fhaisean	ˈ a ʃ ə nˠ
fhánach	ˈ aː nˠ ə x
Fharó	 a ˈ ɾˠ oː
fharraige	ˈ a ɾˠ ə ɟ ə
fheabhas	ˈ au sˠ
fheadair	ˈ a d̪ˠ ə ɾʲ
Fhéile	ˈ eː lʲ ə
Fhilipíneacha	ˌ i lʲ ə ˈ pʲ iː nʲ ə x ə
fhiolarmónach	ˌ i lˠ ə ɾˠ ˈ mˠ oː nˠ ə x
Fhionlainn	ˈ u nˠ lˠ ə nʲ
fhíorúil	 iː ˈ ɾˠ uː lʲ
fhisiceach	ˈ i ʃ ə c ə x
fhocal	ˈ o k ə lˠ
fhoinn	ˈ iː nʲ
fholtach	ˈ o ˈ lˠ t̪ˠ a x
fhótavoltach	ˈ oː t̪ˠ ə vʲ ə lˠ t̪ˠ ə x
Fhrainc	ˈ ɾˠ a nʲ c
fí	ˈ fʲ iː
fia	ˈ fʲ iˑə
fiabhras	ˈ fʲ iˑə vˠ ɾˠ ə sˠ
fiabhrasach	ˈ fʲ iˑə vˠ ɾˠ ə sˠ ə x
fiacail	ˈ fʲ iˑə k ə lʲ
fiach	ˈ fʲ iˑə x
fiacha	ˈ fʲ iˑə x ə
fiachas	ˈ fʲ iˑə x ə sˠ
fia-chat	ˈ fʲ iˑə ˈ x a t̪ˠ
fiacla	ˈ fʲ iˑə k lˠ ə
fiaclach	ˈ fʲ iˑə k lˠ ə x
fiaclóir	 fʲ iˑə ˈ k lˠ oː ɾʲ
fiaclóireacht	 fʲ iˑə ˈ k lˠ oː ɾʲ ə x t̪ˠ
fiaclóireachta	 fʲ iˑə ˈ k lˠ oː ɾʲ ə x t̪ˠ ə
fiadhúlra	 fʲ iˑə ˈ ɣ uː lˠ ɾˠ ə
fiafraigh	ˈ fʲ iˑə fˠ ɾˠ i ɟ
fiaigh	ˈ fʲ iˑə ɟ
fiáin	 fʲ i ˈ aː nʲ
fial	ˈ fʲ iˑə lˠ
fianaigh	ˈ fʲ iˑə nˠ i ɟ
fianaise	ˈ fʲ iˑə nˠ ə ʃ ə
fiánta	 fʲ i ˈ aː nˠ t̪ˠ ə
fiar	ˈ fʲ iˑə ɾˠ
fiarshúileach	 fʲ iˑə ɾˠ ˈ h uː lʲ ə x
fiarthrasna	ˈ fʲ iˑə ɾ̥ˠ ɾˠ ə sˠ nˠ ə
fiarthrasnán	ˈ fʲ iˑə ɾ̥ˠ ɾˠ ə sˠ nˠ aː nˠ
fiata	ˈ fʲ iˑə t̪ˠ ə
fiche	ˈ fʲ i h ə
Fichead	ˈ fʲ i h ə d̪ˠ
ficheall	ˈ fʲ i ç ə lˠ
fichidí	ˌ fʲ i ç ə ˈ dʲ iː
fichille	ˈ fʲ i ç ə lʲ ə
fichiú	 fʲ i ˈ ç uː
ficsean	ˈ fʲ i c ʃ ə nˠ
ficseanaigh	ˈ fʲ i c ʃ ə nˠ i ɟ
ficseanaithe	ˈ fʲ i c ʃ ə nˠ ə h ə
ficseanú	ˌ fʲ i c ʃ ə ˈ nˠ uː
fíd	ˈ fʲ iː dʲ
fidil	ˈ fʲ i dʲ ə lʲ
fidle	ˈ fʲ i dʲ lʲ ə
Fidsí	 fʲ i dʲ ˈ ʃ iː
Fidsíoch	 fʲ i dʲ ˈ ʃ iˑə x
fíf	ˈ fʲ iː fʲ
figh	ˈ fʲ i ɟ
figín	 fʲ i ˈ ɟ iː nʲ
figiúirí	 fʲ i ˈ ɟ uː ɾʲ iː
figiúr	 fʲ i ˈ ɟ uː ɾˠ
file	ˈ fʲ i lʲ ə
filiméala	ˌ fʲ i lʲ ə ˈ mʲ eː lˠ ə
filíocht	 fʲ i ˈ lʲ iˑə x t̪ˠ
Filipíneach	ˌ fʲ i lʲ ə ˈ pʲ iː nʲ ə x
Filipíní	ˌ fʲ i lʲ ə ˈ pʲ iː nʲ iː
fill	ˈ fʲ i lʲ
filleadh	ˈ fʲ i lʲ ə
fillte	ˈ fʲ i lʲ tʲ ə
fillteach	 fʲ i lʲ ˈ tʲ a x
fillteán	 fʲ i lʲ ˈ tʲ aː nˠ
filltín	 fʲ i lʲ ˈ tʲ iː nʲ
fine	ˈ fʲ i nʲ ə
fínéagar	 fʲ iː ˈ nʲ eː ɡ ə ɾˠ
fíneáil	 fʲ iː ˈ nʲ aː lʲ
fíneálta	 fʲ iː ˈ nʲ aː lˠ t̪ˠ ə
finíoch	 fʲ i ˈ nʲ iˑə x
fíniúin	 fʲ iː ˈ nʲ uː nʲ
finné	 fʲ i ˈ nʲ eː
finnéacht	 fʲ i ˈ nʲ eː x t̪ˠ
finscéal	 fʲ i nʲ ʃ ˈ c eː lˠ
finscéalaíocht	 fʲ i nʲ ʃ ˈ c eː lˠ iˑə x t̪ˠ
fíoch	ˈ fʲ iː x
fíochán	 fʲ iː ˈ x aː nˠ
fíochmhar	ˈ fʲ iː x vˠ ə ɾˠ
fíodóir	 fʲ iː ˈ d̪ˠ oː ɾʲ
fioghual	 fʲ i ˈ ɣ uˑə lˠ
fiolarmónach	ˌ fʲ i lˠ ə ɾˠ ˈ mˠ oː nˠ ə x
fíon	ˈ fʲ iː nˠ
fíona	ˈ fʲ iˑə nˠ ə
fíondaite	ˈ fʲ iː n̻ˠ d̪ˠ ə tʲ ə
fíonghort	ˈ fʲ iː ŋ h ə ɾˠ t̪ˠ
fionn	ˈ fʲ uː nˠ
fionnachtain	 fʲ i ˈ nˠ a x t̪ˠ ə nʲ
fionnadh	ˈ fʲ i nˠ ə
fionnaidh	ˈ fʲ i nˠ ə
fionnaitheach	ˈ fʲ i nˠ ə h ə x
fionnrua	 fʲ u nˠ ˈ ɾˠ uˑə
fionnuar	ˈ fʲ i ˌ nˠ uˑə ɾˠ
fiontair	ˈ fʲ u nˠ t̪ˠ ə ɾʲ
fiontar	ˈ fʲ u nˠ t̪ˠ ə ɾˠ
fiontrach	 fʲ u nˠ ˈ t̪ˠ ɾ̥ˠ a x
fiontraí	 fʲ u nˠ ˈ t̪ˠ ɾ̥ˠ iː
fiontraíocht	 fʲ u nˠ ˈ t̪ˠ ɾ̥ˠ iˑə x t̪ˠ
fíor	ˈ fʲ iˑə ɾˠ
fíorálainn	ˈ fʲ iː ˈ ɾˠ aː lˠ ə nʲ
fíor-am	ˈ fʲ iː ˈ ɾˠ au mˠ
fíor-ama	ˈ fʲ iː ˈ ɾˠ a mˠ ə
fíorasc	ˈ fʲ iː ˈ ɾˠ a sˠ k
fíorbharrúil	ˈ fʲ iː ɾˠ vˠ a ˈ ɾˠ uː lʲ
fíorbhun	ˈ fʲ iː ɾˠ ˈ vˠ u nˠ
fíordheimhnigh	ˈ fʲ iː ɾˠ ˈ j e vʲ nʲ i ɟ
fíordheimhnithe	ˈ fʲ iː ɾˠ ˈ j e vʲ nʲ ə h ə
fíordheimhniú	ˈ fʲ iː ɾˠ j ai ˈ nʲ uː
Fíor-Dheisceart	ˈ fʲ iː ɾˠ ˈ j e ʃ c ə ɾˠ t̪ˠ
fíordhona	ˈ fʲ iː ɾˠ ˈ ɣ o nˠ ə
fíorghalánta	ˈ fʲ iː ɾˠ ɣ u ˈ lˠ aː nˠ t̪ˠ ə
fíorghreannmhar	ˈ fʲ iː ɾˠ ˈ j ɾʲ au nˠ vˠ ə ɾˠ
fíoríochtar	ˈ fʲ iː ˈ ɾˠ iˑə x t̪ˠ ə ɾˠ
fíormhaith	ˌ fʲ iˑə ɾˠ ˈ vˠ a
fíor-rúnda	ˈ fʲ iː ˈ ɾˠ uː nˠ d̪ˠ ə
fíorscoth	ˈ fʲ iː ɾˠ ˈ sˠ k o
fíortheist	ˈ fʲ iː ɾˠ ˈ h e ʃ tʲ
fíorú	 fʲ iː ˈ ɾˠ uː
fíor-veigeatóir	ˈ fʲ iː ɾˠ ˌ vʲ e ɟ ə ˈ t̪ˠ oː ɾʲ
fiosrach	 fʲ i ˈ sˠ ɾˠ a x
fiosracht	 fʲ i ˈ sˠ ɾˠ a x t̪ˠ
fiosraigh	ˈ fʲ i sˠ ɾˠ i ɟ
fiosraithe	ˈ fʲ i sˠ ɾˠ ə h ə
fiosrú	 fʲ i ˈ sˠ ɾˠ uː
fiosrúcháin	 fʲ i ˈ sˠ ɾˠ uː x aː nʲ
fiosrúchán	 fʲ i ˈ sˠ ɾˠ uː x aː nˠ
fir	ˈ fʲ i ɾʲ
Fir	ˈ fʲ i ɾʲ
fireann	ˈ fʲ i ɾʲ ə nˠ
fireannach	ˈ fʲ i ɾʲ ə nˠ ə x
fíric	ˈ fʲ iː ɾʲ ə c
firín	 fʲ i ˈ ɾʲ iː nʲ
fírinne	ˈ fʲ iː ɾʲ ə nʲ ə
fírinneach	ˈ fʲ iː ɾʲ i nʲ ə x
fís	ˈ fʲ iː ʃ
físchaiséad	ˈ fʲ iː ʃ x a ˈ ʃ eː d̪ˠ
físcheamara	ˈ fʲ iː ʃ ˈ ç a mˠ ə ɾˠ ə
físchluiche	ˈ fʲ iː ʃ ˈ x lˠ i h ə
físchomhdháil	ˈ fʲ iː ʃ ˈ x oː ˈ ɣ aː lʲ
físdialann	ˈ fʲ iː ʃ ˈ dʲ iˑə lˠ ə nˠ
físe	ˈ fʲ iː ʃ ə
físeán	ˈ fʲ iː ˈ ʃ aː nˠ
fiseolaíoch	 fʲ i ˈ ʃ oː lˠ iˑə x
fiseolaíocht	 fʲ i ˈ ʃ oː lˠ iˑə x t̪ˠ
físghránnán	ˈ fʲ iː ʃ ɣ ɾˠ aː ˈ nˠ aː nˠ
fisic	ˈ fʲ i ʃ ə c
fisice	ˈ fʲ i ʃ ə c ə
fisiceach	ˈ fʲ i ʃ ə c ə x
fisiceacha	ˈ fʲ i ʃ ə c ə x ə
fisiceoir	ˌ fʲ i ʃ ə ˈ c oː ɾʲ
fisiciúil	ˌ fʲ i ʃ ə ˈ c uː lʲ
fisió	ˌ fʲ i ʃ i ˈ oː
fisiteiripe	ˈ fʲ i ʃ ə tʲ ə ɾʲ ə pʲ ə
fisiteiripeoir	 fʲ i ʃ ə tʲ ə ɾʲ ə ˈ pʲ oː ɾʲ
físiúil	 fʲ iː ˈ ʃ uː lʲ
fístéip	ˈ fʲ iː ʃ ˈ tʲ eː pʲ
fithín	 fʲ i ˈ h iː nʲ
fiú	ˈ fʲ uː
fiuch	ˈ fʲ u x
fiúchas	ˈ fʲ uː x ə sˠ
fiúigil	ˈ fʲ uː ɟ ə lʲ
fiúis	ˈ fʲ uː ʃ
fiúise	ˈ fʲ uː ʃ ə
fiúnach	ˈ fʲ uː nˠ ə x
fiúntach	ˈ fʲ uː nˠ t̪ˠ ə x
fiúntas	ˈ fʲ uː nˠ t̪ˠ ə sˠ
fiús	ˈ fʲ uː sˠ
flaitheas	ˈ fˠ lˠ a h ə sˠ
flaitheasach	ˈ fˠ lˠ a h ə sˠ ə x
flaithis	ˈ fˠ lˠ a h i ʃ
flaithiúil	 fˠ lˠ a ˈ h uː lʲ
flaithiúlacht	 fˠ lˠ a ˈ h uː lˠ ə x t̪ˠ
flaithiúnas	 fˠ lˠ a ˈ h uː nˠ ə sˠ
flannbhuí	 fˠ lˠ au nˠ ˈ vˠ iː
flas	ˈ fˠ lˠ a sˠ
fleá	ˈ fʲ lʲ aː
fleaige	ˈ fʲ lʲ a ɟ ə
fleasc	ˈ fʲ lʲ a sˠ k
flíp	ˈ fʲ lʲ iː pʲ
fliú	ˈ fʲ lʲ uː
fliuch	ˈ fʲ lʲ u x
fliuchadh	ˈ fʲ lʲ u x ə
fliuchras	ˈ fʲ lʲ u x ɾˠ ə sˠ
fliúit	ˈ fʲ lʲ uː tʲ
fliúite	ˈ fʲ lʲ uː tʲ ə
fliúiteadóir	ˈ fʲ lʲ uː tʲ ə d̪ˠ oː ɾʲ
flocas	ˈ fˠ lˠ o k ə sˠ
flóra	ˈ fˠ lˠ oː ɾˠ ə
flosc	ˈ fˠ lˠ o sˠ k
flosctha	ˈ fˠ lˠ o sˠ k h ə
flúirse	ˈ fˠ lˠ uː ɾˠ ʃ ə
flúirseach	ˈ fˠ lˠ uː ɾˠ ʃ ə x
fo	ˈ fˠ o
fo-alt	ˈ fˠ o ˈ a lˠ t̪ˠ
fo-bhaile	ˈ fˠ o ˈ vˠ a lʲ ə
fobhealach	ˈ fˠ o vʲ ə ˈ lˠ a x
fobhríste	ˈ fˠ o ˈ vʲ ɾʲ iː ʃ tʲ ə
foc	ˈ fˠ o k
focail	ˈ fˠ o k ə lʲ
focáil	ˈ fˠ o ˈ k aː lʲ
focain	ˈ fˠ o ˈ k a nʲ
focal	ˈ fˠ o k ə l̻ˠ
focál	ˈ fˠ o ˈ k aː lˠ
fócas	ˈ fˠ oː k ə sˠ
fócasaigh	ˈ fˠ oː k ə sˠ i ɟ
fócasghrúpa	ˈ fˠ oː k ə sˠ ɣ ɾˠ uː pˠ ə
fócasú	ˈ fˠ oː k ə sˠ uː
fochéime	ˈ fˠ o ˈ ç eː mʲ ə
fochéimí	ˈ fˠ o ç eː ˈ mʲ iː
fochlós	ˈ fˠ o ˈ x lˠ oː sˠ
fochoiste	ˈ fˠ o ˈ x o ʃ tʲ ə
foclaíocht	ˈ fˠ o ˈ k lˠ iː x t̪ˠ
foclóirín	ˈ fˠ o k lˠ oː ˈ ɾʲ iː nʲ
fód	ˈ fˠ oː d̪ˠ
fódaigh	ˈ fˠ oː d̪ˠ i ɟ
fodhlí	ˈ fˠ o ˈ j lʲ iː
fodhromchla	ˈ fˠ o ˈ ɣ ɾˠ o mˠ x lˠ ə
fo-éadaí	ˈ fˠ o ˈ iˑə d̪ˠ iː
fo-eagarthóir	ˈ fˠ o ˌ a ɡ ə ˈ ɾ̥ˠ oː ɾʲ
fógair	ˈ fˠ oː ɡ ə ɾʲ
fógairt	ˈ fˠ oː ɡ ə ɾˠ tʲ
fógartha	ˈ fˠ oː ɡ ə ɾ̥ˠ ə
fogha	ˈ fˠ au ə
foghlaí	 fˠ au ˈ lˠ iː
foghlaim	ˈ fˠ au lˠ ə mʲ
foghlama	ˈ fˠ o ˈ ɣ lˠ a mˠ ə
foghlamtha	ˈ fˠ au lˠ ə mˠ h ə
fo-ghnó	ˈ fˠ o ˈ ɣ nˠ oː
foghrád	ˈ fˠ o ˈ ɣ ɾˠ aː d̪ˠ
fógra	ˈ fˠ oː ɡ ɾˠ ə
fógraí	 fˠ oː ˈ ɡ ɾˠ iː
fógráin	 fˠ oː ˈ ɡ ɾˠ aː nʲ
fógraíocht	 fˠ oː ˈ ɡ ɾˠ iˑə x t̪ˠ
fógraíochta	 fˠ oː ˈ ɡ ɾˠ iˑə x t̪ˠ ə
fógrán	 fˠ oː ˈ ɡ ɾˠ aː nˠ
fógróir	 fˠ oː ˈ ɡ ɾˠ oː ɾʲ
foiche	ˈ fˠ i h ə
foighne	ˈ fˠ ai nʲ ə
foighneach	ˈ fˠ ai nʲ ə x
fóillíocht	 fˠ oː ˈ lʲ iˑə x t̪ˠ
fóillíochta	 fˠ oː ˈ lʲ iˑə x t̪ˠ ə
foilmhe	ˈ fˠ o lʲ ə vʲ ə
foilseachán	ˌ fˠ o lʲ ʃ ə ˈ x aː nˠ
foilseán	ˈ fˠ o ˈ i lʲ ˈ ʃ aː nˠ
foilsigh	ˈ fˠ o lʲ ʃ i ɟ
foilsithe	ˈ fˠ o ˈ i lʲ ˈ ʃ i h ə
foilsitheoir	ˌ fˠ o lʲ ʃ ə ˈ h oː ɾʲ
foilsitheoireacht	ˌ fˠ o lʲ ʃ ə ˈ h oː ɾʲ ə x t̪ˠ
foilsitheoireachta	ˈ fˠ o ˈ i lʲ ʃ i ˈ h oː ɾʲ ə x t̪ˠ ə
fóin	ˈ fˠ oː nʲ
foinse	ˈ fˠ iː nʲ ʃ ə
foinseach	ˈ fˠ o ˈ i nʲ ˈ ʃ a x
foinsí	ˌ fˠ iː nʲ ˈ ʃ iː
foinsigh	ˈ fˠ o ˈ i nʲ ˈ ʃ i ɟ
fóinteach	ˈ fˠ oː nʲ tʲ ə x
fóir	ˈ fˠ oː ɾʲ
foirceann	ˈ fˠ o ɾʲ c ə nˠ
foirceanta	ˈ fˠ o ɾˠ k ə nˠ t̪ˠ ə
foircneach	ˈ fˠ o i ɾʲ ˈ c nʲ a x
fóirdheonaigh	 fˠ oː ɾˠ dʲ ˈ h oː nˠ i ɟ
fóirdheonaithe	 fˠ oː ɾˠ dʲ ˈ h oː nˠ ə h ə
fóirdheontas	 fˠ oː ɾˠ dʲ ˈ h oː nˠ t̪ˠ ə sˠ
foireann	ˈ fˠ i ɾʲ ə nˠ
foirfe	ˈ fˠ o ɾʲ ə fʲ ə
foirfigh	ˈ fˠ o ɾʲ ə fʲ i ɟ
foirfithe	ˈ fˠ o ˈ i ɾʲ ə fʲ ə h ə
foirgneamh	ˈ fˠ o ɾʲ ə ɟ nʲ ə vˠ
foirgnigh	ˈ fˠ o ˈ i ɾʲ ə ɟ nʲ i ɟ
foirgníochta	ˈ fˠ o ˌ i ɾʲ ə ˈ ɟ nʲ iˑə x t̪ˠ ə
fóirithint	ˈ fˠ oː ɾʲ ə h ə nʲ tʲ
fóirithinte	ˈ fˠ oː ɾʲ ə h ə nʲ tʲ ə
foirm	ˈ fˠ o ɾʲ ə mʲ
foirmeálta	ˈ fˠ o ˌ i ɾʲ ə ˈ mʲ aː lˠ t̪ˠ ə
foirmeán	ˈ fˠ o ˌ i ɾʲ ə ˈ mʲ aː nˠ
foirmiúil	ˌ fˠ o ɾʲ ə ˈ mʲ uː lʲ
foirmle	ˈ fˠ o ɾʲ ə mʲ lʲ ə
foirne	ˈ fˠ o ɾˠ nʲ ə
foirnéis	 fˠ o ɾˠ ˈ nʲ eː ʃ
foirnithe	ˈ fˠ o ˈ i ɾʲ nʲ ə h ə
fóirsteanach	ˈ fˠ oː ɾʲ ʃ tʲ ə nˠ ə x
fo-ithir	ˈ fˠ o ˈ i h ə ɾʲ
fola	ˈ fˠ o lˠ ə
folaigh	ˈ fˠ o lˠ i ɟ
folaíochta	ˈ fˠ o ˈ lˠ iː x t̪ˠ ə
foláireamh	 fˠ o ˈ lˠ aː ɾʲ ə vˠ
foláirimh	ˈ fˠ o ˈ lˠ aː ɾʲ ə vʲ
folaithe	ˈ fˠ o ˈ lˠ a h ə
folamh	ˈ fˠ o lˠ ə vˠ
folc	ˈ fˠ o lˠ k
folcadán	ˌ fˠ o lˠ k ə ˈ d̪ˠ aː nˠ
folctha	ˈ fˠ o ˈ lˠ k h a
foléim	ˈ fˠ o ˈ lʲ eː mʲ
folíne	ˈ fˠ o ˈ lʲ iː nʲ ə
folínigh	ˈ fˠ o ˈ lʲ iː nʲ i ɟ
folláin	 fˠ o ˈ lˠ aː nʲ
folláine	ˈ fˠ o ˈ lˠ aː nʲ ə
follasach	ˈ fˠ o lˠ ə sˠ ə x
folmhaigh	ˈ fˠ o lˠ ə vˠ i ɟ
foluain	 fˠ o ˈ lˠ uˑə nʲ
folúntas	 fˠ o ˈ lˠ uː nˠ t̪ˠ ə sˠ
folús	 fˠ o ˈ lˠ uː sˠ
folúsghlantóir	ˈ fˠ o ˈ lˠ uː sˠ ɣ lˠ ə nˠ t̪ˠ oː ɾʲ
fómhair	ˈ fˠ oː vˠ ə ɾʲ
Fómhair	ˈ fˠ oː vˠ ə ɾʲ
fómhar	ˈ fˠ oː vˠ ə ɾˠ
fomhuireán	ˈ fˠ o ˈ vˠ i ˈ ɾʲ aː nˠ
fón	ˈ fˠ oː nˠ
fónaic	ˈ fˠ oː nˠ ə c
fónáil	 fˠ oː ˈ nˠ aː lʲ
fónamh	ˈ fˠ oː nˠ ə vˠ
fonn	ˈ fˠ au nˠ
fonnadh	ˈ fˠ o ˈ nˠ ai
fonnadóir	ˈ fˠ o nˠ a ˈ d̪ˠ oː ɾʲ
fonnadóireacht	ˈ fˠ o nˠ a ˈ d̪ˠ oː ɾʲ ə x t̪ˠ
fonóta	ˈ fˠ o ˈ nˠ oː t̪ˠ ə
fonsaithe	ˈ fˠ o ˈ nˠ sˠ a h ə
fónta	ˈ fˠ oː nˠ t̪ˠ ə
fopharagraf	ˈ fˠ o ˈ fˠ a ɾˠ ə ɡ ɾˠ ə fˠ
foráil	 fˠ o ˈ ɾˠ aː lʲ
forainm	ˈ fˠ o ˈ ɾˠ a nʲ ə mʲ
fóram	ˈ fˠ oː ɾˠ ə mˠ
fóraoil	 fˠ oː ˈ ɾˠ iː lʲ
foraois	 fˠ o ˈ ɾˠ iː ʃ
forás	 fˠ o ˈ ɾˠ aː sˠ
foras	ˈ fˠ o ɾˠ ə sˠ
forásach	ˈ fˠ o ˈ ɾˠ aː sˠ ə x
forásaí	ˈ fˠ o ɾˠ aː ˈ sˠ iː
forbair	ˈ fˠ o ɾˠ ə bˠ ə ɾʲ
forbairt	ˈ fˠ o ɾˠ ə bˠ ə ɾˠ tʲ
forbartha	ˈ fˠ o ˈ ɾˠ bˠ a ɾ̥ˠ ə
forbhall	ˈ fˠ o ˈ ɾˠ vˠ au lˠ
forbraíocht	ˈ fˠ o ˈ ɾˠ bˠ ɾˠ iː x t̪ˠ
forbraíochta	ˈ fˠ o ˈ ɾˠ bˠ ɾˠ iː x t̪ˠ ə
forbróir	ˈ fˠ o ˈ ɾˠ bˠ ɾˠ oː ɾʲ
forchéimnitheach	ˈ fˠ o ˈ ɾʲ ç eː mʲ nʲ ə h ə x
forchlúdach	ˈ fˠ o ˈ ɾˠ x lˠ uː d̪ˠ ə x
forchlúid	ˈ fˠ o ˈ ɾˠ x lˠ uː dʲ
forchuir	ˈ fˠ o ˈ ɾˠ x i ɾʲ
forchur	ˈ fˠ o ˈ ɾˠ x u ɾˠ
foréigean	 fˠ ə ˈ ɾˠ eː ɟ ə nˠ
forghabháil	ˈ fˠ o ɾˠ ɡ h au ˈ aː lʲ
forghníomhaigh	ˈ fˠ o ˈ ɾʲ ɟ h nʲ iː vˠ i ɟ
forghníomhú	ˈ fˠ o ɾʲ ɟ h nʲ iː ˈ vˠ uː
forhalla	ˈ fˠ o ˈ ɾˠ h a lˠ ə
forlámhas	ˈ fˠ o ˈ ɾˠ lˠ aː vˠ ə sˠ
forleathan	ˈ fˠ o ˈ ɾˠ lʲ a h ə nˠ
forleathnú	ˈ fˠ o ɾˠ lʲ a ˈ n̥ˠ uː
forleathnúchán	ˈ fˠ o ɾˠ lʲ a ˈ n̥ˠ uː x aː nˠ
forleithne	ˈ fˠ o ˈ ɾˠ lʲ e n̥ʲ ə
forma	ˈ fˠ o ɾˠ ə mˠ ə
formadach	ˈ fˠ o ɾˠ mˠ ə ˈ d̪ˠ a x
formheas	ˈ fˠ o ˈ ɾʲ vʲ a sˠ
formhór	ˌ fˠ o ɾˠ ə ˈ vˠ oː ɾˠ
forneart	ˈ fˠ oː ɾˠ ˈ nʲ a ɾˠ t̪ˠ
forneartach	ˈ fˠ o ɾˠ nʲ ə ɾˠ ˈ t̪ˠ a x
forógra	ˈ fˠ o ˈ ɾˠ oː ˈ ɡ ɾˠ a
fo-roinn	ˈ fˠ o ˈ ɾˠ iː nʲ
fórsa	ˈ fˠ oː ɾˠ sˠ ə
fórsaí	 fˠ oː ɾˠ ˈ sˠ iː
fórsáil	 fˠ oː ɾˠ ˈ sˠ aː lʲ
fós	ˈ fˠ oː sˠ
fosaigh	ˈ fˠ o ˈ sˠ ai
fosaithe	ˈ fˠ o ˈ sˠ a h ə
foscadh	ˈ fˠ o sˠ k ə
fosta	ˈ fˠ o sˠ t̪ˠ ə
fostaí	 fˠ o sˠ ˈ t̪ˠ iː
fostaigh	ˈ fˠ o sˠ t̪ˠ i ɟ
fostaíocht	 fˠ o sˠ ˈ t̪ˠ iˑə x t̪ˠ
fostaíochta	ˈ fˠ o ˈ sˠ t̪ˠ iː x t̪ˠ ə
fostaithe	ˈ fˠ o ˈ sˠ t̪ˠ a h ə
fostóir	 fˠ o sˠ ˈ t̪ˠ oː ɾʲ
fostú	 fˠ o sˠ ˈ t̪ˠ uː
fosú	ˈ fˠ o ˈ sˠ uː
fótabhuamáil	ˈ fˠ oː t̪ˠ ə uˑə mˠ aː lʲ
fótachóip	ˈ fˠ oː t̪ˠ ə x oː pʲ
fótachóipeálaí	ˈ fˠ oː t̪ˠ ə x oː pʲ aː lˠ iː
fótagraf	ˈ fˠ oː t̪ˠ ə ɡ ɾˠ ə fˠ
fótagrafach	ˈ fˠ oː t̪ˠ ə ɡ ɾˠ ə fˠ ə x
fótagrafaíocht	ˌ fˠ oː t̪ˠ ə ɡ ɾˠ ə ˈ fˠ iˑə x t̪ˠ
fótavoltach	ˈ fˠ oː t̪ˠ ə vʲ ə lˠ t̪ˠ ə x
fotha	ˈ fˠ o ˈ h a
fo-thacar	ˈ fˠ o ˈ h a k ə ɾˠ
fothain	ˈ fˠ o h ə nʲ
fothéacs	ˈ fˠ o ˈ h eː k sˠ
fotheideal	ˈ fˠ o ˈ h e dʲ ə lˠ
fothrach	ˈ fˠ o h ə ɾˠ ə x
fothragadh	ˈ fˠ o h ə ɾˠ ə ɡ ə
fothram	ˈ fˠ o h ə ɾˠ ə mˠ
fótón	 fˠ oː ˈ t̪ˠ oː nˠ
Fraince	ˈ fˠ ɾˠ ai ɲ c ə
Fraincis	ˌ fˠ ɾˠ ai ɲ ˈ c iː ʃ
Fraincise	ˈ fˠ ɾˠ a nʲ c ə ʃ ə
fráma	ˈ fˠ ɾˠ aː mˠ ə
frámaí	 fˠ ɾˠ aː ˈ mˠ iː
frámáilte	 fˠ ɾˠ aː ˈ mˠ aː lʲ tʲ ə
Francach	ˈ fˠ ɾˠ au ŋ k ə x
fraochán	 fˠ ɾˠ eː ˈ x aː nˠ
fraochta	ˈ fˠ ɾˠ eː x t̪ˠ ə
frapa	ˈ fˠ ɾˠ a pˠ ə
fras	ˈ fˠ ɾˠ a sˠ
frása	ˈ fˠ ɾˠ aː sˠ ə
frásach	ˈ fˠ ɾˠ aː sˠ ə x
frásaíocht	 fˠ ɾˠ aː ˈ sˠ iˑə x t̪ˠ
freachnamh	ˈ fʲ ɾʲ a x nˠ ə vˠ
freagair	ˈ fʲ ɾʲ a ɡ ə ɾʲ
freagairt	ˈ fʲ ɾʲ a ɡ ə ɾˠ tʲ
freagra	ˈ fʲ ɾʲ a ɡ ɾˠ ə
freagrach	ˈ fʲ ɾʲ a ɡ ə ɾˠ ə x
freagracht	ˈ fʲ ɾʲ a ɡ ə ɾˠ ə x t̪ˠ
fréamhaigh	ˈ fʲ ɾʲ eː vˠ i ɟ
fréamhnóta	 fʲ ɾʲ eː vˠ ˈ nˠ oː t̪ˠ ə
freastail	ˈ fʲ ɾʲ a sˠ t̪ˠ ə lʲ
freastal	ˈ fʲ ɾʲ a sˠ t̪ˠ ə lˠ
freastalaí	ˌ fʲ ɾʲ a sˠ t̪ˠ ə ˈ lˠ iː
freastalán	ˌ fʲ ɾʲ a sˠ t̪ˠ ə ˈ lˠ aː nˠ
freasúra	 fʲ ɾʲ a ˈ sˠ uː ɾˠ ə
freisin	ˈ fʲ ɾʲ e ʃ ə nʲ
frídín	 fʲ ɾʲ iː ˈ dʲ iː nʲ
Frigiach	 fʲ ɾʲ i ˈ ɟ iˑə x
friotal	ˈ fʲ ɾʲ i t̪ˠ ə lˠ
friotán	 fʲ ɾʲ i ˈ t̪ˠ aː nˠ
friseáilte	 fʲ ɾʲ i ˈ ʃ aː lʲ tʲ ə
frithbheathach	ˈ fʲ ɾʲ i vʲ ə ˈ h a x
frithchaiteoir	ˈ fʲ ɾʲ i x a ˈ tʲ oː ɾʲ
frithchaith	ˈ fʲ ɾʲ i ˈ x a h
frithchaitheamh	ˈ fʲ ɾʲ i ˈ x a h ə vˠ
frithchoirpín	ˈ fʲ ɾʲ i x o ɾʲ ˈ pʲ iː nʲ
frithdhúlagair	ˈ fʲ ɾʲ i ˈ ɣ uː lˠ ə ɡ ə ɾʲ
frithdhúlagrán	ˈ fʲ ɾʲ i ˈ ɣ uː lˠ ə ɡ ɾˠ aː nˠ
frithfhreagairt	ˈ fʲ ɾʲ i ˈ ɾʲ a ɡ ə ɾˠ tʲ
frithghealladh	ˈ fʲ ɾʲ i ˈ j a lˠ ə x
frithgheallaí	ˈ fʲ ɾʲ i j a ˈ lˠ iː
frithghníomh	ˈ fʲ ɾʲ i ˈ j nʲ iˑə vˠ
frithghníomhach	ˈ fʲ ɾʲ i ˈ j nʲ iː vˠ ə x
frithghníomhaí	ˈ fʲ ɾʲ i j nʲ iː ˈ vˠ iː
frithghníomhaigh	ˈ fʲ ɾʲ i ˈ j nʲ iː vˠ i ɟ
frithghníomhú	ˈ fʲ ɾʲ i j nʲ iː ˈ vˠ uː
frithir	ˈ fʲ ɾˠ i h ə ɾʲ
frithradadh	ˈ fʲ ɾʲ i ˈ ɾˠ a d̪ˠ ə
frithráiteach	ˈ fʲ ɾʲ i ˈ ɾˠ aː tʲ ə x
frithsceimhlitheoireacht	ˈ fʲ ɾʲ i ˌ ʃ c e vʲ lʲ ə ˈ h oː ɾʲ ə x t̪ˠ
frith-Sheimíteach	ˈ fʲ ɾʲ i h e ˈ mʲ iː tʲ ə x
frithvíreas	ˈ fʲ ɾʲ i ˈ vʲ iː ɾʲ ə sˠ
frog	ˈ fˠ ɾˠ o ɡ
froga	ˈ fˠ ɾˠ o ɡ ə
fronta	ˈ fˠ ɾˠ o nˠ t̪ˠ ə
fruiligh	ˈ fˠ ɾˠ i lʲ i ɟ
fruiliú	 fˠ ɾˠ i ˈ lʲ uː
fuacht	ˈ fˠ uˑə x t̪ˠ
fuadach	ˈ fˠ uˑə d̪ˠ ə x
fuadaigh	ˈ fˠ uˑə d̪ˠ i ɟ
fuadaitheoir	ˈ fˠ uˑə d̪ˠ ə h oː ɾʲ
fuadar	ˈ fˠ uˑə d̪ˠ ə ɾˠ
fuadrach	ˈ fˠ uˑə d̪ˠ ə ɾˠ ə x
fuaidrigh	ˈ fˠ uˑə dʲ ɾʲ i ɟ
fuaigh	ˈ fˠ uˑə j
fuail	ˈ fˠ uˑə lʲ
fuaim	ˈ fˠ uˑə mʲ
fuaime	ˈ fˠ uˑə mʲ ə
fuaimeolaíocht	ˈ fˠ uˑə mʲ oː ˈ lˠ iˑə x t̪ˠ
fuaimíocht	 fˠ uˑə ˈ mʲ iˑə x t̪ˠ
fuaimiúil	 fˠ uˑə ˈ mʲ uː lʲ
fuaimnigh	ˈ fˠ uˑə mʲ nʲ i ɟ
fuaimniú	 fˠ uˑə mʲ ˈ nʲ uː
fuaimrian	ˈ fˠ uˑə mʲ ˈ ɾˠ iˑə nˠ
fual	ˈ fˠ uˑə lˠ
fuar	ˈ fˠ uˑə ɾˠ
fuaraigh	ˈ fˠ uˑə ɾˠ i ɟ
fuaraithe	ˈ fˠ uˑə ɾˠ ə h ə
fuaraitheoir	ˈ fˠ uˑə ɾˠ ə h oː ɾʲ
fuarán	 fˠ uˑə ˈ ɾˠ aː nˠ
fuaránach	 fˠ uˑə ˈ ɾˠ aː nˠ ə x
fuaránta	 fˠ uˑə ˈ ɾˠ aː nˠ t̪ˠ ə
fuarbhruite	ˈ fˠ uˑə ɾˠ vˠ ɾˠ ə tʲ ə
fuarchúiseach	 fˠ uˑə ɾˠ ˈ x uː ʃ ə x
fuarlach	ˈ fˠ uˑə ɾˠ lˠ ə x
fuarú	 fˠ uˑə ˈ ɾˠ uː
fuascail	ˈ fˠ uˑə sˠ k ə lʲ
fuascailteoir	ˈ fˠ uˑə sˠ k ə lʲ tʲ oː ɾʲ
fuath	ˈ fˠ uˑə
fuatha	ˈ fˠ uˑə h ə
fud	ˈ fˠ u d̪ˠ
fuidreamh	ˈ fˠ i dʲ ə ɾʲ ə vˠ
fuil	ˈ fˠ i lʲ
fuilchill	ˈ fˠ i lʲ ə ç ə lʲ
fuileadán	ˌ fˠ i lʲ ə ˈ d̪ˠ aː nˠ
fuilibiliú	ˈ fˠ i lʲ ə bʲ ə lʲ uː
fuíll	ˈ fˠ iː lʲ
fuílleach	ˈ fˠ iː lʲ ə x
fuilteach	 fˠ i lʲ ˈ tʲ a x
fuin	ˈ fˠ i nʲ
fuingicíd	ˌ fˠ i ɲ ə ˈ c iː dʲ
fuingicídeach	ˌ fˠ i ɲ ə ˈ c iː dʲ ə x
fuinneamh	ˈ fˠ i nʲ ə vˠ
fuinneog	 fˠ i ˈ nʲ oː ɡ
fuinneoige	 fˠ i ˈ nʲ oː ɟ ə
fuinnimh	ˈ fˠ i nʲ ə vʲ
fuinniúil	 fˠ i ˈ nʲ uː lʲ
fuinseoige	 fˠ i nʲ ˈ ʃ oː ɟ ə
fuip	ˈ fˠ i pʲ
fuipeáil	 fˠ i ˈ pʲ aː lʲ
fuireach	 fˠ i ˈ ɾʲ a x
fuirseoir	 fˠ i ɾʲ ˈ ʃ oː ɾʲ
fuirseoireacht	 fˠ i ɾʲ ˈ ʃ oː ɾʲ ə x t̪ˠ
fuisce	ˈ fˠ i ʃ c ə
fuistean	ˈ fˠ i ʃ tʲ ə nˠ
fúl	ˈ fˠ uː lˠ
fulacht	 fˠ u ˈ lˠ a x t̪ˠ
fulachta	 fˠ u ˈ lˠ a x t̪ˠ ə
fulaing	ˈ fˠ u lˠ ə ɲ
fulaingt	ˈ fˠ u lˠ ə ɲ tʲ
Fúlánach	 fˠ uː ˈ lˠ aː nˠ ə x
fulmanáit	ˈ fˠ u lˠ ə mˠ ə nˠ aː tʲ
func	ˈ fˠ u nˠ k
funcaí	 fˠ u nˠ ˈ k iː
funcaíáilte	 fˠ u nˠ ˈ k iː aː lʲ tʲ ə
fungais	ˈ fˠ u ŋ ə ʃ
fungas	ˈ fˠ u ŋ ə sˠ
fungasach	ˈ fˠ u ŋ ə sˠ ə x
fungaschruthach	ˈ fˠ u ŋ ə sˠ x ɾˠ ə h ə x
furasta	ˈ fˠ u ɾˠ ə sˠ t̪ˠ ə
furchaidh	 fˠ u ˈ ɾˠ a x ə
fústaire	ˈ fˠ uː sˠ t̪ˠ ə ɾʲ ə
fústar	ˈ fˠ uː sˠ t̪ˠ ə ɾˠ
ga	ˈ ɡ a
gá	ˈ ɡ aː
gábh	ˈ ɡ aː vˠ
gabh	ˈ ɡ au
gabha	ˈ ɡ au ə
gabháil	ˈ ɡ vˠ aː lʲ
gabhal	ˈ ɡ au lˠ
gabhálaí	 ɡ au ˈ aː lˠ iː
gabhálas	 ɡ au ˈ aː lˠ ə sˠ
gabháltas	 ɡ au ˈ aː lˠ t̪ˠ ə sˠ
gabhann	ˈ ɡ au nˠ
gabhar	ˈ ɡ au ɾˠ
Gabhar	ˈ ɡ au ɾˠ
gabhdán	 ɡ au ˈ d̪ˠ aː nˠ
gabhlán	 ɡ au ˈ lˠ aː nˠ
gabhlóg	 ɡ au ˈ lˠ oː ɡ
gach	ˈ ɡ a x
gadaí	 ɡ a ˈ d̪ˠ iː
gadaíocht	 ɡ a ˈ d̪ˠ iˑə x t̪ˠ
gadhair	ˈ ɡ ai ɾʲ
gadhar	ˈ ɡ ai ɾˠ
Gaeilge	ˈ ɡ eː lʲ ɟ ə
Gaelach	ˈ ɡ eː lˠ ə x
gafa	ˈ ɡ a fˠ ə
gaibhnigh	ˈ ɡ a vʲ nʲ i ɟ
Gaidhlig	ˈ ɡ ai lʲ ə ɟ
gáifeach	ˈ ɡ aː fʲ ə x
gáifeachas	ˈ ɡ aː fʲ ə x ə sˠ
gáifeacht	ˈ ɡ aː fʲ ə x t̪ˠ
gaige	ˈ ɡ a ɟ ə
gaile	ˈ ɡ a lʲ ə
gailearaí	ˌ ɡ a lʲ ə ˈ ɾˠ iː
gailf	ˈ ɡ a lʲ fʲ
Gailíleach	 ɡ a ˈ lʲ iː lʲ ə x
Gailíseach	 ɡ a ˈ lʲ iː ʃ ə x
Gaillimh	ˈ ɡ a lʲ ə vʲ
gaineamh	ˈ ɡ a nʲ ə vˠ
gaineamhchloch	ˈ ɡ a nʲ ə vˠ x lˠ ə x
gaineamhlach	ˈ ɡ a nʲ ə vˠ lˠ ə x
gaing	ˈ ɡ a ɲ
gainne	ˈ ɡ a nʲ ə
gáinneáil	 ɡ aː ˈ nʲ aː lʲ
gaíon	ˈ ɡ iː nˠ
gáir	ˈ ɡ aː ɾʲ
gair	ˈ ɡ a ɾʲ
gairbhéal	ˌ ɡ a ɾʲ ə ˈ vʲ eː lˠ
gairdín	 ɡ a ɾˠ ˈ dʲ iː nʲ
Gairdíní	 ɡ a ɾˠ ˈ dʲ iː nʲ iː
gáire	ˈ ɡ aː ɾʲ ə
gairéadach	 ɡ a ˈ ɾʲ eː d̪ˠ ə x
gaireas	ˈ ɡ a ɾʲ ə sˠ
gairgeach	ˈ ɡ a ɾʲ ə ɟ ə x
gairid	ˈ ɡ a ɾʲ ə dʲ
gairleoige	 ɡ a ɾʲ ˈ lʲ oː ɟ ə
gairm	ˈ ɡ a ɾʲ ə mʲ
gairme	ˈ ɡ a ɾʲ ə mʲ ə
gairmí	ˌ ɡ a ɾʲ ə ˈ mʲ iː
gairmiúil	ˌ ɡ a ɾʲ ə ˈ mʲ uː lʲ
gairneoireacht	 ɡ a ɾʲ ˈ nʲ oː ɾʲ ə x t̪ˠ
gáirsiúil	 ɡ aː ɾʲ ˈ ʃ uː lʲ
gáis	ˈ ɡ aː ʃ
gaisce	ˈ ɡ a ʃ c ə
gaiscíoch	 ɡ a ʃ ˈ c iˑə x
gaiste	ˈ ɡ a ʃ tʲ ə
gal	ˈ ɡ a lˠ
galaigh	ˈ ɡ a lˠ i ɟ
galamaisíocht	ˈ ɡ a lˠ ə mˠ ə ʃ iˑə x t̪ˠ
galánta	 ɡ a ˈ lˠ aː nˠ t̪ˠ ə
galántacht	 ɡ a ˈ lˠ aː nˠ t̪ˠ ə x t̪ˠ
galar	ˈ ɡ a lˠ ə ɾˠ
galbhruith	ˈ ɡ a lˠ ə vˠ ɾˠ ə
galf	ˈ ɡ a lˠ fˠ
galfaire	ˈ ɡ a lˠ fˠ ə ɾʲ ə
galfchúrsa	 ɡ a lˠ fˠ ˈ x uː ɾˠ sˠ ə
Gall	ˈ ɡ au lˠ
Gallach	 ɡ ə ˈ lˠ a x
gallchnó	 ɡ au lˠ x ˈ nˠ oː
gallóglach	 ɡ a ˈ lˠ oː ɡ lˠ ə x
gallúnach	 ɡ a ˈ lˠ uː nˠ ə x
galrach	 ɡ ə lˠ ˈ ɾˠ a x
galtán	 ɡ a lˠ ˈ t̪ˠ aː nˠ
gamal	ˈ ɡ a mˠ ə lˠ
gan	ˈ ɡ a nˠ
Gána	ˈ ɡ aː nˠ ə
gangaid	ˈ ɡ a ŋ ə dʲ
gangaideach	ˈ ɡ a ŋ ə dʲ ə x
gann	ˈ ɡ au nˠ
gannchúis	ˈ ɡ au nˠ ə x uː ʃ
gannchúiseach	ˈ ɡ au nˠ ə x uː ʃ ə x
ganntanas	ˈ ɡ au nˠ t̪ˠ ə nˠ ə sˠ
gaofar	ˈ ɡ eː fˠ ə ɾˠ
gaoil	ˈ ɡ iː lʲ
gaoithe	ˈ ɡ iː h ə
gaol	ˈ ɡ eː lˠ
gaolmhaireacht	ˈ ɡ eː lˠ vˠ ə ɾʲ ə x t̪ˠ
gaolmhar	ˈ ɡ eː lˠ vˠ ə ɾˠ
gaolta	ˈ ɡ eː lˠ t̪ˠ ə
gaosán	 ɡ eː ˈ sˠ aː nˠ
gaoth	ˈ ɡ eː
gaothach	ˈ ɡ eː h ə x
gaothrán	 ɡ eː ˈ ɾ̥ˠ aː nˠ
gaothscáth	 ɡ eː h sˠ ˈ k aː
gaothscátha	 ɡ eː h sˠ ˈ k aː h ə
gar	ˈ ɡ a ɾˠ
garaíocht	 ɡ a ˈ ɾˠ iˑə x t̪ˠ
garastún	ˌ ɡ a ɾˠ ə sˠ ˈ t̪ˠ uː nˠ
garbh	ˈ ɡ a ɾˠ ə vˠ
garbhán	ˈ ɡ a ɾˠ ˈ vˠ aː nˠ
garchabhair	ˈ ɡ a ɾˠ ˈ x au ɾʲ
garda	ˈ ɡ aː ɾˠ d̪ˠ ə
gardaí	ˈ ɡ aː ɾˠ ˌ d̪ˠ iː
gardáil	 ɡ aː ɾˠ ˈ d̪ˠ aː lʲ
gariníon	ˈ ɡ a ɾˠ i ˈ nʲ iˑə nˠ
Garman	ˈ ɡ a ɾˠ ˈ mˠ au nˠ
garmhac	ˈ ɡ a ɾˠ ˈ vˠ a k
garpháiste	ˈ ɡ a ɾˠ ˈ fˠ aː ʃ tʲ ə
garraí	 ɡ a ˈ ɾˠ iː
garraíodóireacht	ˈ ɡ a ɾˠ iˑə d̪ˠ oː ɾʲ ə x t̪ˠ
Garraithe	ˈ ɡ a ɾˠ ə h ə
garrán	 ɡ a ˈ ɾˠ aː nˠ
garsún	 ɡ a ɾˠ ˈ sˠ uː nˠ
garthuismitheoir	ˈ ɡ a ɾˠ ˌ h i ʃ mʲ ə ˈ h oː ɾʲ
garuncail	ˈ ɡ a ˈ ɾˠ uː ŋ k ə lʲ
gás	ˈ ɡ aː sˠ
gásaigh	ˈ ɡ aː sˠ i ɟ
gaschill	ˈ ɡ a ʃ ç ə lʲ
gáslampa	ˈ ɡ aː sˠ lˠ ə mˠ pˠ ə
Gasóg	 ɡ a ˈ sˠ oː ɡ
gasra	ˈ ɡ a sˠ ɾˠ ə
gasta	ˈ ɡ a sˠ t̪ˠ ə
gastacht	 ɡ ə sˠ ˈ t̪ˠ a x t̪ˠ
gastrach	 ɡ ə sˠ ˈ t̪ˠ ɾ̥ˠ a x
gastraistéigeach	ˌ ɡ a sˠ t̪ˠ ɾ̥ˠ ə ʃ ˈ tʲ eː ɟ ə x
gasúr	 ɡ a ˈ sˠ uː ɾˠ
gátar	ˈ ɡ aː t̪ˠ ə ɾˠ
